,full_name,link,description,stars,forks,watchers,keywords,source
440,AzureBilling,https://github.com/kovairaj/AzureBilling.git,"A comprehensive solution that iwll allow collect billing data for all types of subscriptions like Cloud Service Providers, Enterprise Customers and Azure Offers. A loosely coupled system that allows data gathering, storage of historical data and data visualization.",0,0,0,cloud+enterprise,GitHub
441,https-www.infoholicresearch.com-worldwide-hybrid-cloud-computing-market-to-grow-at-a-cagr-of-34-3-,https://github.com/Savitri5/https-www.infoholicresearch.com-worldwide-hybrid-cloud-computing-market-to-grow-at-a-cagr-of-34-3-.git,"According to Infoholic Research, currently hybrid cloud is at an early adoption stage and organizations across all verticals and sizes are implementing a hybrid cloud. Most of the enterprises are benefiting from the hybrid adoption as it helps to save cost with its pay as you use model. A rapid increase in the private cloud adoption is driving the hybrid cloud market with nearly 82% of the enterprises planning to have a hybrid cloud strategy by 2017. The market is expected to grow at a CAGR of 34.3% during the period 2016–2022 to touch an aggregate of $241.13 billion by 2022. Hybrid cloud provides a single solution to organizations involved in multiple verticals; more than 50% of the large enterprises are planning to implement hybrid cloud by 2018. In addition to that, the hybrid cloud provides a significant opportunity for cost savings by shutting down unused workloads and by helping to select lower-cost clouds based on the requirement. The hybrid cloud computing market is analyzed by four segments: solutions, service model, verticals and regions.",0,0,0,cloud+enterprise,GitHub
442,Asset-Performance-Management-APM-Market-Trends-Size-Competitive-Analysis-and-Forecast---2019-202,https://github.com/pooja2893/Asset-Performance-Management-APM-Market-Trends-Size-Competitive-Analysis-and-Forecast---2019-202.git,"The global market for APM is projected to have considerable CAGR during the forecast period. The market growth is attributed to various pivotal factors such as the growing demand for cloud-based APM services associated with growing demand from small-medium sized enterprises (SMEs) across the globe. Owing to this, various cloud-based APM solution providers are introducing new products to fulfill the growing demand from different verticals. For instance, in October 2019, IBM announced the launch of IBM Maximo Enterprise Asset Management SaaS with an aim to provide the cloud-based asset management experience to global clients with the ability to generate role-based work centers. ",0,0,0,cloud+enterprise,GitHub
443,cloud-computing,https://github.com/amersandhu/cloud-computing.git,Cloud Computing gives the opportunity to use scalable resources from professional service providers without having the knowledge of their infrastructure. This enables businesses to add rich features into enterprise-level applications in a minimal amount of time. Cloud allows flexibility and fast service straight to your screen.,0,0,0,cloud+enterprise,GitHub
444,eurynome-cloud-athena,https://github.com/herodotus-cloud/eurynome-cloud-athena.git,"Platform for developing micro service architecture and service capability in enterprise technology. Based on Spring Boot 2.5.3, Spring Cloud 2020.0.3, Spring Cloud Alibaba 2021.1 and Nacos 2.0.3, it follows the programming idea of springboot and is highly modular and configurable.   🔝 🔝 Click a star to follow the update!",0,0,0,cloud+enterprise+spring-boot+spring-cloud+spring-cloud-alibaba+nacos+spring-security-oauth2+spring-data-jpa+microservices+skywalking+seata+sentinel+elk+eurynome-cloud+knife4j+jetcache+spring-cloud-gateway+docker+kubernetes+spring-security-jwt,GitHub
445,X-byte-Enterprise-Solutions,https://github.com/Kulmohan/X-byte-Enterprise-Solutions.git,"Director at X-byte Enterprise Solutions X-Byte Enterprise Solutions is a global digital agency with presence in 3 continents and customers in 24+ countries. We offer 360 degree turnkey solutions on Web, Mobile, Cloud and IoT. Services we Offer: • UI/UX Designing • Website Development • Mobile Application Engineering • IoT Automation Solutions | Visit us: https://www.xbytesolutions.com/  | Phone: +1 (832) 251 7311   | Email: sales@xbytesolutions.com",0,0,0,cloud+enterprise,GitHub
446,Rouing-Anomaly-Classification,https://github.com/ankitsinha/Rouing-Anomaly-Classification.git,"Timely detection of such huge routing table updates are critical for network availability and quality. Networking is important aspect of any enterprise, be is mission critical application or public cloud access. With ever changing usage of internet and humongous internet expansion it is important to double click and see what is changing in enterprise routing domain. Hence timely detection of changes in routing table is critical.",0,0,0,cloud+enterprise,GitHub
447,End-to-End-ERP-system-with-cloud-based-management-software,https://github.com/Tyasuite/End-to-End-ERP-system-with-cloud-based-management-software.git,"Organizations trying to coordinate their different frameworks might be interested in a cloud based solution An undeniably well known cloud system for SMEs is the enterprise resource planning ERP software Understand what a cloud ERP is and how your business can profit from it  ERP is a cloud based management software generally offered as a heap of modules that aims to help organizations digitalize the storage collection management and interpretation of information from different sources like inventory accounting advertising service delivery and so on With cloud ERP software entrepreneurs and directors can get an incorporated real time view of resources business processes and commitments  Cloud ERP solutions are essentially a set up of ERP applications delivered to clients over the web, which is usually accessed through a browser ",0,0,0,cloud+enterprise,GitHub
448,techclouderp,https://github.com/techclouderp/techclouderp.git,"Our Tech Cloud ERP is an enterprise-wide information system that facilitates the flow of information and coordinates all resources and activities within the business organization. Of all the software an organization can deploy, Tech Cloud ERP has potentially the most direct impact on reducing costs. Our Tech Cloud ERP software integrates all business processes including inventory, manufacturing, sales and marketing, purchase, human resources, asset management, plant maintenance, quality control, and finance. We aim at providing full-fledged services to the clients focusing on long-term relationship and value-added services.",0,0,0,cloud+enterprise,GitHub
449,Direct-File-Transfer,https://github.com/BlondelSeumo/Direct-File-Transfer.git,"Hot Cloud Storage is an enterprise-class and tier-free bit-bucket storage provider that’s compatible with and comparable to Amazon’s S3 business cloud storage solution. With a price of $5.99 per terabyte (TB) per month (based on $.0059 gigabyte or GB per month) and with server farms in 6 regions, This Hot Cloud Storage has a minimum monthly charge associated with 1 TB of storage ($5.99 per month). If you store less than 1 TB of active storage in your account, then your total charge will still be $5.99 per month.",0,0,0,cloud+enterprise,GitHub
450,laureate_education_master,https://github.com/SteveSunTech/laureate_education_master.git,"Based on the many years of experience in online education platform development and operation, we are committed to creating a distributed online education system applicable to all industries. The system adopts the front-end and back-end separation mode, the front-end uses vue.js as the core framework, and the back-end uses Spring Cloud as the core framework. The main functions of the system currently include course on-demand function, support for multiple video cloud access, course attachment management function, support for multiple storage cloud access, lecturer management function, support lecturer entry function, which can help individuals or enterprises quickly build a light A massive online education platform.",0,0,0,cloud+enterprise,GitHub
451,What-is-Cloud-ERP-and-what-are-the-Benefits-of-Cloud-ERP-,https://github.com/Tyasuite/What-is-Cloud-ERP-and-what-are-the-Benefits-of-Cloud-ERP-.git,"Enterprise Resource Planning is also known as ERP is a type of software used by companies to manage information across organizations. It is referred to as ERP software and tools that are managed and offered in the cloud. With fast-changing and evolving technology,",0,0,0,cloud+enterprise,GitHub
452,project-otr,https://github.com/MatsStromberg/project-otr.git,"Oracle Tablespace Report is used to gather various statistics e.g. Tablespace usage (allocated, used and free) space. The statistics are stored centrally in the OTR Repository. This tool is built using Open BlueDragon and it can be configured to access to an Oracle Enterprise Manager/Cloud Control repository to also collect storage usage.",0,0,0,cloud+enterprise,GitHub
453,Global-Analytics-as-a-Service-Market-Trends-Size-Competitive-Analysis-and-Forecast---2019-2025,https://github.com/pooja2893/Global-Analytics-as-a-Service-Market-Trends-Size-Competitive-Analysis-and-Forecast---2019-2025.git, The global analytics as a service market is expected to grow at a CAGR of 27.6% during the forecast period. Cloud and Big Data are two of the trends that define the emerging enterprise computing and creates a lot of potential and opportunities for a new era of combined applications.,0,0,0,cloud+enterprise,GitHub
454,5-Features-Which-You-Should-Look-Out-In-Cloud-ERP-Software,https://github.com/Tyasuite/5-Features-Which-You-Should-Look-Out-In-Cloud-ERP-Software.git,Enterprise Resource Planning erp software is a way through which businesses around the globe are able to handle and manage their complex business issues with ease. It helps in planning and executing a set of operations in a specialized manner to achieve efficiency.  5 features which every investor should check before investing in a Cloud ERP Software,0,0,0,cloud+enterprise,GitHub
455,6-visible-benefits-of-moving-to-the-cloud-in-2021.,https://github.com/ifcloudsoftware/6-visible-benefits-of-moving-to-the-cloud-in-2021..git,"In the modern digital space, users need more space to host their data. Cloud Hosting providers in the market are looking at serving the current needs through bespoke plans for users and enterprises. This includes free 10GB space in the basic plan and extra features in the paid plans.",0,0,0,cloud+enterprise,GitHub
456,Enterprise-deployment-using-ASE,https://github.com/VB-Cloudboy/Enterprise-deployment-using-ASE.git,"Azure App Service is a PaaS service used to host a variety of apps on Azure: web apps, API apps, functions, and mobile apps. App Service Environment or ASE allows enterprises to deploy their App Service apps in a subnet in their own Azure Virtual Network, providing an isolated, highly scalable, and dedicated environment for their cloud workloads.",0,0,0,cloud+enterprise,GitHub
457,redhat_linux,https://github.com/Ajaypaul2697/redhat_linux.git,"Red Hat Enterprise Linux (RHEL) is a Linux-based operating system from Red Hat designed for businesses. RHEL can work on desktops, on servers, in hypervisors or in the cloud. Red Hat and its community-supported counterpart, Fedora, are among the most widely used Linux distributions in the world.",0,0,0,cloud+enterprise,GitHub
458,CSCI2433-termproject-Enterprise-Data-Architecture,https://github.com/sophia-tsilerides/CSCI2433-termproject-Enterprise-Data-Architecture.git,"An end-to-end enterprise level database system for an insurance company. The project involved data modeling, architecture, creating the ODS, managing the ETL, hosting the database on the cloud, data mining of real time data, and a front end inspired in JavaScript and PHP. The project was assigned for Database Systems at NYU Courant Institute of Mathematical Sciences.",0,0,0,cloud+enterprise,GitHub
459,oracle-HCM-Training,https://github.com/RizeTrainingsOnline/oracle-HCM-Training.git,"RizeTrainings is the Industry leader in Oracle HCM training which highlight on hands on experience with examples from real-time scenarios by experts.   The objective of this training is to provide hands on experience and in depth understanding of the following modules of Oracle HCM Online Training. 1 Course Overview Oracle Fusion Applications Overview Oracle Fusion HCM Overview Introducing Oracle Fusion HCM Cloud Service Introducing Oracle Fusion Applications User Interface Demonstrating Oracle Fusion Applications Help   2 HCM Cloud Service Overview Oracle Fusion HCM Cloud Service Patching and Upgrades Oracle Cloud Environment Management Functional Setup Manager (FSM) Oracle Cloud Backup Policies Oracle Cloud Disaster Recovery Objectives Know How to Work with Oracle SaaS     3 Enterprise Structures: Initial Configuration & Maintenance Enterprise Structures Overview Designing Enterprise Configuration Enterprise Structures Configurator Reference Data Sharing Jobs and Positions Contextual Attributes for Jobs and Positions at different levels 4 Workforce Structures Manage Enterprise HCM Information Task Employment Models Work Day Information Number Generation Person- Name Languages Enterprise-Level User and Role-Provisioning Options Defining Locations Defining HCM Organizations Actions and Action Reasons 5 Define Legal Entities for HCM Legal Entity Role Legal Entity Considerations Legal Entity and its Relationship to Divisions Legal Reporting Units Overview Legislative Data Groups   6 Define Grades Grades Setup and Maintenance Defining Grades Defining Grade Rates Defining Grade Ladders 7 Define Jobs Jobs Setup and Maintenance Lookups for Jobs Grades Job Families   8 Define Positions Positions Setup and Maintenance Lookups for Positions Positions Examples in different industries 9 Manage Workforce Lifecycle Add Person Manage Employment Information Areas of Responsibility Employment Processes Mass Updates Employee and Manager Self Service   10 Maintain Worker Directories Person Gallery and Portrait Person Search Line Manager Self-Service Worker Self-Service Portrait Cards Simplified User Experience Managing Gallery Portrait   11 Define Workforce Records Defining Availability Defining Person Record Values Defining Employment Record Values Defining Documents   12 Workflow, Approvals, and Notifications (Overview) Workflow Approval Policies Approver Types Manage Approval Groups for Human Capital Management Approval Structure Oracle BPM Worklist Approval Rules   13 Extend and Personalize HCM (Overview) Sandbox Manager Customizations Flexfield Concepts   14 HCM Security Overview (Overview) Role-Based Security Model Role Inheritance Security Profiles and Data Roles User and Role Provisioning   15 Business Intelligence and Ad Hoc Reporting (Overview) Oracle Fusion Reporting Tools for Oracle HCM Cloud Service Comparison of Reporting Tools Overview of OTBI and BI Publisher   Contact US  For Free Demo: Call: +91- 970 39767 53 Email: contact@rizetrainings.com Website: www.rizetrainings.com url: http://www.rizetrainings.com/oracle-fusion-hcm-online-training.html",0,0,0,cloud+enterprise,GitHub
460,Oracle-course-,https://github.com/sbsystemgroup/Oracle-course-.git,"Oracle Corporation is an American multinational computer technology corporation headquartered in Austin, Texas. The company was formerly headquartered in Redwood Shores, California until December 2020 when it moved its headquarters to Texas.[5] The company sells database software and technology, cloud engineered systems, and enterprise software products—particularly its own brands of database management systems. In 2020, Oracle was the second-largest software company by revenue and market capitalization.[6] The company also develops and builds tools for database development and systems of middle-tier software, enterprise resource planning (ERP) software, Human Capital Management (HCM) software, customer relationship management (CRM) software, and supply chain management (SCM) software",0,0,0,cloud+enterprise,GitHub
461,Streamline-your-business-process-with-Cloud-ERP-Software,https://github.com/Tyasuite/Streamline-your-business-process-with-Cloud-ERP-Software.git,"Enterprise resource planning Cloud ERP Software is a tool which helps businesses to manage and handle their operations in a much more effective and efficient way. With a cloud ERP software, companies can switch from manual working to an automated working environment which leads to operations been completed in less time frame with fewer hassles.   In this dynamic and fast-growing environment, it is essential for companies to grow and adapt themselves in regards to the changing working environment and therefore to meet with all the obligations, it is crucial for them to implement cloud ERP software. It manages various processes like asset management, inventory, compliance, sales order management, vendor, procurement and more.  Have a glance at TYASuite Cloud ERP Software, India’s #1 plug and play software which is instilled with a wide variety of unique features to help businesses to grow and thrive. Book a demo session today; also sign up to get a 30 days free trial of the software. ",0,0,0,cloud+enterprise,GitHub
462,Enterprise-Content-Management-ECM-Market-Trends-Size-Forecast---2019-2025-,https://github.com/pooja2893/Enterprise-Content-Management-ECM-Market-Trends-Size-Forecast---2019-2025-.git,"The global market for ECM is projected to have considerable CAGR of around 11.5% during the forecast period. The market growth is attributed to various pivotal factors such as the growing demand for cloud-based ECM services associated with growing demand from small-medium sized enterprises (SMEs) across the globe. ECM system is designed to contain unstructured information such as drawings, files, and images. Its purpose is the delivery of the right content to the right person at the right time, and in the right context.  The companies are adopting ECM solutions to organize their large volume of non-structured content and to make this information more accessible for users and these systems communicate with relational database backed solutions through a single interface. Moreover, a significant concern lies in dependence on traditional IT systems and technologies for the management of large amount of enterprise content, therefore creating significant demand of ECM solution across various enterprise.",0,0,0,cloud+enterprise,GitHub
463,Why-Cloud-ERP-is-a-Biggest-Game-Changer-in-Business-,https://github.com/Tyasuite/Why-Cloud-ERP-is-a-Biggest-Game-Changer-in-Business-.git," The innovation of technology has completely changed the scenario of business globally. Organizations around the globe are competing among themselves to excel and grow together. Enterprise Resource Planning (ERP) is a commonly used technique used by the majority of organizations to manage their information, business, and inventory.  The cloud ERP refers to the software that is managed in the cloud along with business hosting on their systems. Every organization around the globe is working with different tools and techniques to overcome the challenge. For effective implementation and to compete with global competitors the ERP",0,0,0,cloud+enterprise,GitHub
464,Cloud-ERP-A-Revolution-in-the-World-of-Digital-Era,https://github.com/Tyasuite/Cloud-ERP-A-Revolution-in-the-World-of-Digital-Era.git,"Enterprise Resource Planning (ERP) was introduced to automate the business process across the organization. Right from managing the finance to automate the manufacturing process in a plant the ERP was introduced for smooth functioning.  Decades later with introduction of cloud technology the software was delivered with the help of internet. ERP is constituted with numerous applications and technology that is helping companies to achieve goals and complete their professional commitments.  Cloud ERP is a system that runs on vendors cloud platform to integrate and automate the business functions and provide a streamline source of data which includes inventory, order, and supply chain management. There are computing resources that are maintained in remote data centers which is dedicated to hosting various applications on multiple platforms.  Cloud ERP Software has lower operating costs because they are leased for a particular time frame. With the helps of cloud ERP it gives an access to the companies to control their business-critical applications at any time from across the locations. Cloud ERP in India is quite valuable to small as well as medium sized business because it provides access full functions at a reasonable price. The selection of right ERP software will help the organizations to scale up their business productivity to the next level.  The cloud ERP solutions help the companies to shrink the costs of maintaining the applications since the cloud vendors can easily handleall the upgrades and updates. With hassle free implementation accessing the system remotely will help the organizations to expand geographically.  Since the time cloud ERP software came into existence it has completely changed the ways of expanding the business across the globe as well as it has opened the doors of endless possibilities for the world.",0,0,0,cloud+enterprise,GitHub
465,cloudrouter,https://github.com/ghzwireless/cloudrouter.git,"The CloudRouter Project is a collaborative open source project focused on bringing simplicity to network interconnection, a traditionally complex process. With the growing proliferation of performance and security issues occurring over the public Internet, there is an increasing demand for secure, direct network-to-network interconnection, including Enterprise to Cloud. The CloudRouter community is developing and maintaining an open source software distribution of networking technologies.",0,0,0,cloud+enterprise,GitHub
466,Clinical-Information-System,https://github.com/kkandhas/Clinical-Information-System.git,"Built an Enterprise java application (Maven Project) with JDBC connections for maintaining a Clinical Information System and deployed it in Apache server which ran in AWS Ec2 Linux instance(cloud). Used 3 different types of Architecture Resource Oriented Architecture, Message-Oriented Architecture and Event-Driven Architecture as a part of this project. Also used REST Web Service Client and SOAP Web Service Client as a part of this Project.",0,0,0,cloud+enterprise,GitHub
467,Global-Data-Center-Interconnect-DCI-Market-Trends-Size-Competitive-Analysis-and-Forecast---2019-,https://github.com/pooja2893/Global-Data-Center-Interconnect-DCI-Market-Trends-Size-Competitive-Analysis-and-Forecast---2019-.git,"   The global market for DCI is estimated to have a significant CAGR of around 13.5% during the forecast period. The market is mainly driven by the migration towards cloud-based services, rise in big data, and growing concerns about data privacy and security. A considerable rise in big data is a major concern for enterprises to safely store and manage the huge amount of data. With the growing digitization across the globe, big data is on a continuous rise.",0,0,0,cloud+enterprise,GitHub
468,Java-Developer,https://github.com/RitikaJalan/Java-Developer.git,"Skills   Experience developing Applications using frameworks such as React, Angular Experience with back-end development using JavaScript with Node, Java with Spring framework, etc. Basic knowledge of Cloud and AWS platform Experience with writing SQL for fetching/updating data from/to relational databases Solid understanding of code versioning tools such as Git and SVN Solid understanding of asynchronous request handling, partial page updates, and AJAX Experience with enterprise application development using Java, SOAP, REST, JSP, JavaScript, CSS, HTML5 and JQuery etc.. ",0,0,0,cloud+enterprise,GitHub
469,5-Signs-Businesses-Should-Invest-In-Cloud-ERP-Software,https://github.com/Tyasuite/5-Signs-Businesses-Should-Invest-In-Cloud-ERP-Software.git,"Enterprise Resource Planning software is a tool which helps businesses to manage and handle their business processes effectively. From handling finances to managing vendors and mitigating risks, everything is given due consideration and taken care of by a Cloud ERP Software. Many companies have a misconception that ERP Software is only useful for large enterprises and cannot meet with the demands of SMEs, but it is not true. A Cloud ERP Software enhances the business productivity of companies irrespective of their size and sector. Here are 5 signs which will tell you that your business needs Cloud ERP Software and you should invest in one. · When your business process is expanding and growing · Manage and secure business data and information · When managing reports becomes difficult · If maintenance cost is increasing · If there are sever timing issues Have a glance at TYASuite Cloud ERP Software which is developed on years of knowledge about the marketplace. It specializes in optimizing the productivity of the business to achieve goals with precision and efficacy. Grab the FREE trial today to know more about it!",0,0,0,cloud+enterprise,GitHub
