,full_name,link,description,stars,forks,watchers,keywords,source
226,Home-Assistant-wundergroundpws,https://github.com/cytech/Home-Assistant-wundergroundpws.git,Home Assistant custom component sensor for Weather Underground personal weather station users,71,28,71,weather,GitHub
227,rwunderground,https://github.com/ALShum/rwunderground.git,A simple R package to get historical and forecast weather data,71,14,71,weather+weather-data+weather+weather-underground+weather-history,GitHub
228,codetabs,https://github.com/jolav/codetabs.git,Free Online Services. Github/GitLab star history. Count Lines of Code. CORS proxy server. IP GeoLocation. Convert Video to Gif. HTTP Headers. Api weather temp. Alexa ranking.,71,11,71,weather+github-stars-graphical-history+count-lines-of-code-online+cors-proxy+weather-api+alexa-rank+http-headers+apis+api-service+video2gif+online-service+geolocation-api+gitlab-stars-graphical-history,GitHub
229,evala,https://github.com/krasimir/evala.git,"Clock, Weather, Terminal ... ÐµÐ²Ð°Ð»Ð° :)",70,10,70,weather,GitHub
230,DavisRFM69,https://github.com/dekay/DavisRFM69.git,An Arduino library for the RFM69 transceiver module that enables communications with Davis Instruments weather station hardware.,70,19,70,weather,GitHub
231,meteostat-python,https://github.com/meteostat/meteostat-python.git,Access and analyze historical weather and climate data with Python.,69,9,69,weather+weather+weather-station+climate+climate-change+climate-data+statistics+open-data+data-science+meteostat,GitHub
232,DarkSkyWeather,https://github.com/Bodmer/DarkSkyWeather.git,Arduino ESP32 and ESP8266 compatible library to read weather forecast from Dark Sky API,69,18,69,weather,GitHub
233,weather-react,https://github.com/iamsainikhil/weather-react.git,A robust weather application to provide current and 24 hour 7-day weather forecast for any city in the world built with â¤ï¸ using React. Weather forecast data is powered by Dark Sky and city search data is powered by Algolia Places.,69,16,69,weather+react+weather+tailwindcss+scss+darksky-api+react-hooks+weather-forecast+javascript,GitHub
234,ha-card-weather-conditions,https://github.com/r-renato/ha-card-weather-conditions.git,Weather condition card (Lovelace) for Home Assistant.,67,10,67,weather+home-assistant+home-assistant-hacs+lovelace+card+weather-conditions,GitHub
235,elixir-weather,https://github.com/tacticiankerala/elixir-weather.git,A command line weather app built using elixir,67,8,67,weather,GitHub
236,80speak,https://github.com/connornishijima/80speak.git,"80speak is an online speech synthesizer based on DECtalk, famously used by Professor Stephen Hawking, The US National Weather Service, Back To The Future Part II, and Benny Benassi.",67,18,67,weather,GitHub
237,homebridge-display,https://github.com/EricAndrechek/homebridge-display.git,"Homebridge-Display, a Homebridge plugin that allows you to control and view Spotify, see the weather forecast and current conditions, see news articles, control some Homebridge devices, and much, much more!",67,2,67,weather+homebridge+homebridge-display,GitHub
238,OpenWeather,https://github.com/Bodmer/OpenWeather.git,Arduino library to fetch weather forecasts from OpenWeatherMap,66,17,66,weather+openweathermap+esp32+esp8266+arduino+arduino-library,GitHub
239,python-yr,https://github.com/wckd/python-yr.git,Get the forecast from the norwegian weather service yr.no in python,66,26,66,weather,GitHub
240,dark-sky-api,https://github.com/deanbot/dark-sky-api.git,a simple and robust weather api using dark sky for client-side or server-side js,66,14,66,weather,GitHub
241,minxiuWeather,https://github.com/wuwhs/minxiuWeather.git,a simple miniprogram of weather,65,20,65,weather,GitHub
242,cbatmo,https://github.com/Gulivertx/cbatmo.git,A Netatmo Weather Station Web-APP for Raspberry Pi & official Raspberry touchscreen,65,13,65,weather,GitHub
243,hereR,https://github.com/munterfinger/hereR.git,"R package that provides an interface to the HERE REST APIs: Geocoder API, Routing API, Traffic API, Public Transit API and Destination Weather API. Locations and routes are returned as 'sf' objects.",65,7,65,weather+routing+geocoding+traffic+weather+isoline+here-technologies+api+rspatial+rstats+gis,GitHub
244,eON-AQSENS_213_V2_ED3-EFEKTALAB,https://github.com/smartboxchannel/eON-AQSENS_213_V2_ED3-EFEKTALAB.git,"Wireless, battery-operated Mini air quality and weather station. Air quality, temperature, humidity, pressure, weather forecast. Designed on the RF52810, nRF52811, nRF52832, nRF52833, nRF52840 wireless radio modules. The temperature, humidity and pressure sensor BME280, temperature and pressure sensor BMP280, temperature and humidity sensor SHTC3, light sensor MAX44009, air quality sensor SGP40 is used The device is powered by CR2477 battery. Consumption when transmitting data is 8mA, in sleep mode is 325uA-35uA (see datasheet SGP40).",65,4,65,weather,GitHub
245,meteo-qt,https://github.com/dglent/meteo-qt.git,System tray application for weather status information,64,15,64,weather,GitHub
246,AndRoad,https://github.com/gkfabs/AndRoad.git,"AndRoad is a fork of the AndNav2 project. It is an opensource fully featured Turn-By-Turn Navigation Application. It supports Location-Lookup, POIs, Text-2-Speech Instructions, Traffic-Feeds, Contact-Search, 4-day Weather Forecast, Via-Points, Avoid-Areas, and many more... ",64,31,64,weather,GitHub
247,SRClimate,https://github.com/guowilling/SRClimate.git,Concise style weather forecasting.,63,20,63,weather+elegant+climate+weather+locate+forcasting,GitHub
248,goose-weather,https://github.com/andrewevans0102/goose-weather.git,Weather App that uses NOAA and Open Weather Map API to show forecast,63,34,63,weather,GitHub
249,XWeather,https://github.com/colbylwilliams/XWeather.git,A weather app for iOS and Android built with Xamarin,63,56,63,weather+xamarin+weather+android+ios+mobile-center+xamarin-ios+xamarin-android,GitHub
250,WeatherWatch,https://github.com/Katharine/WeatherWatch.git,Pebble watch face with current weather conditions. Demo for httpebble.,63,31,63,weather,GitHub
251,weather-cli,https://github.com/riyadhalnur/weather-cli.git,Check the weather for your city from your terminal,63,8,63,weather+weather+weather-cli+cli+terminal+nodejs,GitHub
252,Photon-Weather-Station,https://github.com/gradyh/Photon-Weather-Station.git,Wifi-enabled weather display using panel meters,62,13,62,weather,GitHub
253,WeatherStationReceiver,https://github.com/practicalarduino/WeatherStationReceiver.git,Use an Arduino and a 433MHz receiver module to intercept and process weather data from a La Crosse home weather station,62,33,62,weather,GitHub
254,Deep_Learning_Weather_Forecasting,https://github.com/BruceBinBoxing/Deep_Learning_Weather_Forecasting.git,"Deep Learning for Weather Forecasting, accepted applied data science of KDD 2019",62,29,62,weather,GitHub
255,ultra-weather,https://github.com/Leftium/ultra-weather.git,"UltraWeather gives user-friendly, actionable weather forecasts. ",62,5,62,weather,GitHub
256,privacy-friendly-weather,https://github.com/SecUSo/privacy-friendly-weather.git,Privacy Friendly App for Android that can display weather for cities.,62,23,62,weather,GitHub
257,nimbus,https://github.com/danrabbit/nimbus.git,A minimal weather applet,61,20,61,weather+gweather,GitHub
258,weather,https://github.com/devfacet/weather.git,A module for obtaining weather information,61,25,61,weather+weather+forecast,GitHub
259,Weather_Shield,https://github.com/sparkfun/Weather_Shield.git,"Barometric pressure, temperature, humidity and light sensing weather shield for Arduino.",61,61,61,weather+sparkfun-products+humidity+temperature+weather+arduino-platform+arduino,GitHub
260,my-weather-indicator,https://github.com/atareao/my-weather-indicator.git,"A Weather Indicator for Linux Desktop (Plasma, GNOME, MATE, XFCE,...)",61,14,61,weather,GitHub
261,weather-challenge,https://github.com/chris-horner/weather-challenge.git,Jetpack Compose weather app dev challenge,61,7,61,weather,GitHub
262,Auckland_Cycling,https://github.com/nicolasfauchereau/Auckland_Cycling.git,An analysis of cycling counts in Auckland in relation to the weather ,61,45,61,weather,GitHub
263,TrayWeather,https://github.com/FelixdelasPozas/TrayWeather.git,Tray Weather is a simple application to retrieve and show weather information for a given geographic location in a small dialog and in the Windows OS system tray.,61,7,61,weather,GitHub
264,ForkGAN,https://github.com/zhengziqiang/ForkGAN.git,"ForkGAN: Seeing into the rainy night. ECCV 2020 (oral). A task-agnostic image translation framework that can boost multiple vision tasks in adverse weather conditions, including localization, semantic segmentation and object detection.",61,8,61,weather,GitHub
265,bom-weather-card,https://github.com/DavidFW1960/bom-weather-card.git,Custom Animated Weather Card for any weather provider,60,25,60,weather+bom+homeassistant+home-assistant+home-automation+weather-forecast+dask-sky,GitHub
266,android-wunderground-client,https://github.com/47degrees/android-wunderground-client.git,An Android client for the Weather Underground Weather API,60,17,60,weather,GitHub
267,react-native-weather-app,https://github.com/shevawen/react-native-weather-app.git,Weather App build with react native fork from sofish's Weather App(https://github.com/sofish/weather),60,16,60,weather,GitHub
268,WeatherStream,https://github.com/QuixomTech/WeatherStream.git,Weather Stream app for android,60,14,60,weather,GitHub
269,WEATHER_DDE_DOCK,https://github.com/sonichy/WEATHER_DDE_DOCK.git,Deepin Linux DDE-Dock weather forcast plugin,60,21,60,weather,GitHub
270,ArduinoWeatherOS,https://github.com/robwlakes/ArduinoWeatherOS.git,"Arduino Uno, 433MhzRx and OS WMR86 Weather Station",60,16,60,weather+weather+station+oregon+scientific+433mhz+anemometer+rain+gauge+intercepting+rasberrypi+arduino+air+pressure+humidity+manchester+protocol,GitHub
271,WorldWeatherSymbols,https://github.com/OGCMetOceanDWG/WorldWeatherSymbols.git,A complete set of WMO weather symbols in SVG with full metadata.,60,24,60,weather,GitHub
272,ha-gismeteo,https://github.com/Limych/ha-gismeteo.git,Gismeteo Weather Provider for Home Assistant,60,4,60,weather+home-assistant+gismeteo+gismeteo-weather+weather-provider+sensor+forecast+hacs+sensors,GitHub
273,ufs-weather-model,https://github.com/ufs-community/ufs-weather-model.git,UFS Weather Model,59,128,59,weather,GitHub
274,Weather-Forecast-Dashboard,https://github.com/vlaine/Weather-Forecast-Dashboard.git,Weather Forecast Dashboard,59,15,59,weather,GitHub
275,pi-weather-station,https://github.com/johnwargo/pi-weather-station.git,"Raspberry Pi Sense HAT, Weather Underground station",59,24,59,weather,GitHub
276,fitbit-weather,https://github.com/gregoiresage/fitbit-weather.git,Weather module for Fitbit OS,59,13,59,weather,GitHub
277,JARVIS-AI,https://github.com/Arbazkhan4712/JARVIS-AI.git,It is an AI assistant which will automate your task like it can send emails also it can control lights using raspberry pi it can inform about weather and many more features,59,40,59,weather+python+jarvis+artificial-intelligence+arduino+raspberry-pi+raspberry-pi-camera+assistant-personnel+assistant-computer-control+ai-assistants,GitHub
278,autowx2,https://github.com/filipsPL/autowx2.git,"The program for scheduling recordings and processing of the satellite and ground radio transmissions (like capturing of the weather APT images from NOAA satellites, voice messages from ISS, fixed time recordings of WeatherFaxes etc.) :earth_africa: :satellite:",59,14,59,weather+noaa+weather+satellite+noaa-satellites+capture+weather-data+antenna,GitHub
279,verif,https://github.com/WFRT/verif.git,Software for verifying weather forecasts,58,31,58,weather+weather+prediction+evaluation+verification+forecasting+statistics,GitHub
280,weather-widget,https://github.com/felixhageloh/weather-widget.git,A weather widget for Ãœbersicht,58,31,58,weather,GitHub
281,WeatherFontIcon,https://github.com/shafiullakhan/WeatherFontIcon.git,Using Font Icon Set within Label to display weather icon ,58,11,58,weather,GitHub
282,WeatherApp-Android,https://github.com/Shashank02051997/WeatherApp-Android.git,â›ˆ Weather app with OpenWeatherMap API,58,3,58,weather,GitHub
283,stormcloud,https://github.com/consindo/stormcloud.git,An awesome weather app.,57,19,57,weather,GitHub
284,weather2,https://github.com/Corosauce/weather2.git,Minecraft Forge Mod - Localized Weather - A rewrite of weather & tornados with a focus on localized storm systems,57,37,57,weather,GitHub
285,weatherData,https://github.com/Ram-N/weatherData.git,A simple R package that fetches Weather data from WeatherUnderground,57,38,57,weather,GitHub
286,IceVarFigs,https://github.com/zmlabe/IceVarFigs.git,Weather and climate graphics for science communication,57,15,57,weather+arctic-sea-ice+sea-ice-thickness+climate-change+scicomm+climate-variability,GitHub
287,muni-led-sign,https://github.com/pshved/muni-led-sign.git,San Francisco Muni Prediction and Weather LED sign,57,10,57,weather,GitHub
288,dwdweather2,https://github.com/panodata/dwdweather2.git,"Python client to access weather data from Deutscher Wetterdienst (DWD), the federal meteorological service in Germany.",57,11,57,weather+dwd+dwd-ftp+weather+weather-data+weather-api+opendata+open-data,GitHub
289,E_ink_dashboard,https://github.com/duxenmx/E_ink_dashboard.git,"E_paper display using raspberry pi zero showing realtime information of several topics, like weather, transit, currencies, stocks, tasklist and meetings",57,6,57,weather,GitHub
290,Weather-Map,https://github.com/rafaelkyrdan/Weather-Map.git,Weather Map.,56,15,56,weather,GitHub
291,HowsTheWeather,https://github.com/DannyDelott/HowsTheWeather.git,Tells you the weather when you put in a zip code.,56,233,56,weather,GitHub
292,app-pretty-weather,https://github.com/jamesmontemagno/app-pretty-weather.git,A very pretty weather application built with Xamarin :),56,22,56,weather,GitHub
293,yandex-weather-cli,https://github.com/msoap/yandex-weather-cli.git,Command line interface for Yandex weather service / â˜€ï¸â›…ï¸â„ï¸,56,0,56,weather+golang+cli+yandex+weather+utility+homebrew,GitHub
294,kindle-kt3_weatherdisplay_battery-optimized,https://github.com/nicoh88/kindle-kt3_weatherdisplay_battery-optimized.git,Use your Kindle KT3 (8. generation) for a weather station with weather underground api and homematic weather sensor.,55,14,55,weather+kindle+weatherdisplay+weather-underground+homematic+wakealarm,GitHub
295,react-native-weather-app,https://github.com/catalinmiron/react-native-weather-app.git,React native using Open Weather API - http://openweathermap.org/api,55,18,55,weather,GitHub
296,xrit-rx,https://github.com/sam210723/xrit-rx.git,ðŸ“¡ Receive images from weather satellite GEO-KOMPSAT-2A (GK-2A).,55,6,55,weather+satellite+lrit+hrit+gk-2a+python+python3+xrit-rx+coms-1+weather+weather-satellite+satellite-imagery+geo-kompsat-2a+rtlsdr+airspy,GitHub
297,rn-minimalist-weather-app,https://github.com/amandeepmittal/rn-minimalist-weather-app.git,Minimalist Weather App using React Native,54,29,54,weather+react+react-native+weather+mobile-app+mobile,GitHub
298,avwx-engine,https://github.com/avwx-rest/avwx-engine.git,Aviation Weather parsing engine. METAR & TAF,54,27,54,weather,GitHub
299,worldclockwidget,https://github.com/arminha/worldclockwidget.git,A world clock and weather widget for Android,54,25,54,weather+java+android+worldclock,GitHub
300,BME280,https://github.com/embeddedadventures/BME280.git,Bosch BME280 Embedded Adventures MOD-1022 weather multi-sensor Arduino code,54,25,54,weather,GitHub
301,Weather-Forecast,https://github.com/PanagiotisDrakatos/Weather-Forecast.git,  Weather Forecast is a simple app that shows you a weather. It comes with your standard features like your daily and hourly forecast along with access to additional information,54,19,54,weather+weather-app+awesome+ui-design+gui+robust+forecast,GitHub
302,WeatherFlow_PiConsole,https://github.com/peted-davis/WeatherFlow_PiConsole.git,Raspberry Pi Python console for WeatherFlow Tempest and Smart Home Weather Stations,54,10,54,weather,GitHub
303,bureau_of_meteorology,https://github.com/bremor/bureau_of_meteorology.git,Custom component for retrieving weather information from the Bureau of Meteorology.,54,7,54,weather+observations+weather+forecast+bom+bureau+meteorology+hacs+weather-information,GitHub
304,weather-api,https://github.com/sofish/weather-api.git,æä¾›ä¸€ä¸ªä»Ž weather.com.cn ä¸Šæ ¹æ®åŸŽå¸‚æŽ¥å£å–å¤©æ°”ä¿¡æ¯çš„æ–¹æ³•,54,21,54,weather,GitHub
305,ePaper-Spotify-Clock,https://github.com/alexthescott/ePaper-Spotify-Clock.git,ePaper Clock with two user's Spotify info and the weather using Waveshare's 4.2inch EPD,54,5,54,weather+e-paper+epaper+python+spotipy+spotipy-library+clock+weather+epd+waveshare-eink+python3+openweathermap-api+waveshare,GitHub
306,aws-serverless-fullstack-swift-apple-carplay-example,https://github.com/aws-samples/aws-serverless-fullstack-swift-apple-carplay-example.git,This application demonstrates a full-stack Apple CarPlay app that uses Swift for both the UI and the backend services in AWS. The app accesses Lambda functions written in Swift and deployed from Docker images.  The app accesses Amazon Location Service and a 3rd party weather api to display information in the vicinity of the user.,54,3,54,weather+swift+lambda+lambda-functions+appsync+carplay+amazon+location-services+aws+api+graphql+amplify+ios+swiftui+cdk+docker,GitHub
307,WeatherPredictionFromImage,https://github.com/berkgulay/WeatherPredictionFromImage.git,ML project to predict weather condition in given image,53,15,53,weather+machine-learning+weather-prediction+image-processing+classification+neural-network,GitHub
308,google-weather,https://github.com/jnunemaker/google-weather.git,stupid simple fetching of the weather using google's api,53,15,53,weather,GitHub
309,wheather,https://github.com/celoyd/wheather.git,Image-compositing scripts for filtering weather out of satellite images,53,5,53,weather,GitHub
310,consuming-rest-apis,https://github.com/mstahv/consuming-rest-apis.git,A simple JAX-RS Client usage example. Fetches weather data from a openweathermap.org and displays that on a simple Vaadin UI.,53,81,53,weather,GitHub
311,angular-openweather-app,https://github.com/atufkas/angular-openweather-app.git,A weather forecast app written in AngularJS,52,56,52,weather+openweathermap+angularjs+javascript+example-project+weather-data+angular1+angular-directives+openweathermap-api+weather-forecast+jasmine-tests+karma-tests+demo,GitHub
312,miniWeather,https://github.com/mrnorman/miniWeather.git,A parallel programming training mini app simulating weather-like flows,52,23,52,weather,GitHub
313,MKWeatherUndergroundKit,https://github.com/MendyK/MKWeatherUndergroundKit.git,A simple iOS and OS X library for retrieving weather information using the Weather Underground API,52,5,52,weather,GitHub
314,twent,https://github.com/mikkkee/twent.git,"Time, WEather, and News in Terminal.",52,5,52,weather,GitHub
315,weather,https://github.com/woheller69/weather.git,A privacy friendly weather app for Android with built in rain radar,52,3,52,weather,GitHub
316,avwx-api,https://github.com/avwx-rest/avwx-api.git,REST API for parsing aviation weather data,51,37,51,weather,GitHub
317,gis-weather,https://github.com/RingOV/gis-weather.git,Customizable weather widget,51,16,51,weather,GitHub
318,laravel-weather,https://github.com/vemcogroup/laravel-weather.git,Weather package for Laravel to use different providers to get weather info,51,4,51,weather,GitHub
319,esd,https://github.com/metno/esd.git,"An R-package designed for climate and weather data analysis, empirical-statistical downscaling, and visualisation.",51,25,51,weather,GitHub
320,ESP8266-HomeKit-Weather-Station-BME280-Elgato-Eve,https://github.com/HomeKidd/ESP8266-HomeKit-Weather-Station-BME280-Elgato-Eve.git,"ESP8266 based ï£¿ HomeKit Weather Station using Bosch BME280 temperature, humidity, barometric pressure sensorðŸ”¥ ðŸŒ¡",51,6,51,weather+esp-homekit+esp-homekit-demo+esp-open-rtos+esp-homekit-sonoff+esp8266+homekit+homekit-accessory+homekit-accessory-protocol+homekit-api+homekit-server+homekit-controller+homekit-device+homebridge+homebridge-plugin+esp8266-arduino+espressif+homekit-weather-station+fakegato+fakegato-history+ravencore,GitHub
321,homebridge-eveatmo,https://github.com/skrollme/homebridge-eveatmo.git,Homebridge plugin which adds a Netatmo weatherstation as HomeKit device and tries to act like Elgato Eve Room/Weather,51,6,51,weather+homebridge+homebridge-plugin+netatmo+netatmo-weather-station+homekit+homebridge-netatmo,GitHub
322,graphql-openweathermap-server,https://github.com/apaquino/graphql-openweathermap-server.git,GraphQL server to get weather forecasts from the http://www.openweathermap.org API and now youtube API v3 search.  With sample react app,51,7,51,weather,GitHub
323,MyWeather,https://github.com/Jamesxu182/MyWeather.git,A Simple Weather App For Hefei,50,36,50,weather,GitHub
324,atlas,https://github.com/ecmwf/atlas.git,A library for numerical weather prediction and climate modelling,50,22,50,weather,GitHub
325,authentic-ubersicht,https://github.com/reduxd/authentic-ubersicht.git,"The most honest weather app, on your desktop",50,17,50,weather,GitHub
326,compose-weather,https://github.com/vitaviva/compose-weather.git,CuteWeather is a beautiful weather app build in Jetpack Compose,50,13,50,weather+jetpack-compose+androiddevchallenge-compose+weather-app+jetpack-compose-animation+weather-icon,GitHub
327,shaman,https://github.com/HalosGhost/shaman.git,"A small, native C library and utility to fetch weather",50,5,50,weather,GitHub
328,esp8266-weather-station-oled-DST,https://github.com/neptune2/esp8266-weather-station-oled-DST.git,Customized version of Squix78 ESP8266 OLED Weather Station w/ Auto Daylight Saving Time Adjust and other mods using SSD1306 OLED. See https://github.com/squix78/esp8266-weather-station for original code and library ,50,15,50,weather,GitHub
329,OpenWeatherDuino,https://github.com/l0wl3vel/OpenWeatherDuino.git,An Arduino standalone based Open Source Weather Station which is connected to Openweathermap.org,50,5,50,weather,GitHub
330,raspi-weather,https://github.com/DerekCaelin/raspi-weather.git,a weather application for the raspberry pi and the Pimorioni Inky pHAT.,50,3,50,weather+weather+python+raspberry-pi-z+eink,GitHub
331,Weather,https://github.com/Sparker0i/Weather.git,This is the weather app I've built as a part of the assignment of the Android Internship Workshop I'd attended at Amrita in the Summer of 2016,50,37,50,weather+android+weather+open-source,GitHub
