,full_name,link,description,stars,forks,watchers,keywords,source
906,MQTTX,https://github.com/emqx/MQTTX.git,MQTT X - Elegant Cross-platform MQTT 5.0 Desktop Client,1180,167,1180,platform+mqtt-tool+mqtt+mqtt-client+electron-app+electron+iot+iot-application+mqttx+vue+emq+cross-platform+snap-store+macos+linux,GitHub
907,examples,https://github.com/confluentinc/examples.git,Apache Kafka and Confluent Platform examples and demos,1179,738,1179,platform+kafka+demo+examples+confluent+replicator+cloud+ksql+connect+connector+jdbc+debezium+quickstart+schema-registry+monitoring+avro+kubernetes+cdc+sql+docker+microservices,GitHub
908,clutch,https://github.com/lyft/clutch.git,Extensible platform for infrastructure management,1179,82,1179,platform+lyft+infrastructure-management+developer-portal,GitHub
909,flutter_ume,https://github.com/bytedance/flutter_ume.git,UME is an in-app debug kits platform for Flutter. Produced by Flutter Infra team of ByteDance,1178,66,1178,platform+flutter+debug+debugging-tool+devtool+development+developer+dart-library+tools,GitHub
910,KivyMD,https://github.com/kivymd/KivyMD.git,"KivyMD is a collection of Material Design compliant widgets for use with Kivy, a framework for cross-platform, touch-enabled graphical applications. https://youtube.com/c/KivyMD https://twitter.com/KivyMD https://habr.com/ru/users/kivymd https://stackoverflow.com/tags/kivymd",1178,408,1178,platform+kivymd+kivy+cross-platform+material-design+ui+python+app+android+ios+windows+linux+macos+library,GitHub
911,dreamfactory,https://github.com/dreamfactorysoftware/dreamfactory.git,DreamFactory API Management Platform,1177,268,1177,platform+dreamfactory+laravel+framework+php+api+rest+openapi+automatic-api,GitHub
912,mx3,https://github.com/libmx3/mx3.git,a sample project showcasing/collecting cross platform techniques on mobile,1176,153,1176,platform,GitHub
913,RcloneBrowser,https://github.com/mmozeiko/RcloneBrowser.git,Simple cross platform GUI for rclone,1174,273,1174,platform+rclone,GitHub
914,ACMESharp,https://github.com/ebekker/ACMESharp.git,An ACME client library and PowerShell client for the .NET platform (Let's Encrypt),1166,188,1166,platform+dotnet+powershell+letsencrypt+acme-client+acme-protocol+certificate,GitHub
915,datawrapper,https://github.com/datawrapper/datawrapper.git,"An open source data visualization platform helping everyone to create simple, correct and embeddable charts in minutes.",1162,273,1162,platform+datawrapper+visualization+ddj+tool+mapping,GitHub
916,Low-Latency-Android-iOS-Linux-Windows-tvOS-macOS-Interactive-Audio-Platform,https://github.com/superpoweredSDK/Low-Latency-Android-iOS-Linux-Windows-tvOS-macOS-Interactive-Audio-Platform.git,"🇸Superpowered Audio, Networking and Cryptographics SDKs. High performance and cross platform on Android, iOS, macOS, tvOS, Linux, Windows and modern web browsers.",1159,261,1159,platform+cpp+audio+midi+usb-audio+cryptography+https+json+aes+rsa+hashing+android+ios+linux+windows+webassembly+spatialization+hls+fft+time-stretch+macos,GitHub
917,cryptosphere,https://github.com/cryptosphere/cryptosphere.git,"Encrypted peer-to-peer web application platform for decentralized, privacy-preserving applications",1157,51,1157,platform,GitHub
918,zap-desktop,https://github.com/LN-Zap/zap-desktop.git,Cross platform Lightning Network wallet focused on user experience and ease of use ⚡️,1153,207,1153,platform,GitHub
919,mio,https://github.com/mandreyel/mio.git,Cross-platform C++11 header-only library for memory mapped file IO,1153,90,1153,platform+cpp+cpp11+cpp14+memory-mapped-file+memory-mapping+mmap+fileviewer+file-view+header-only+cross-platform,GitHub
920,fuxi,https://github.com/jeffzh3ng/fuxi.git,Penetration Testing Platform,1151,363,1151,platform+security+vulnerability+pentest-tool+penetration-testing,GitHub
921,cpal,https://github.com/RustAudio/cpal.git,Cross-platform audio I/O library in pure Rust,1140,187,1140,platform+rust+audio,GitHub
922,cinatra,https://github.com/qicosmos/cinatra.git,"modern c++(c++17), cross-platform, header-only, easy to use http framework",1140,249,1140,platform,GitHub
923,tipsi-stripe,https://github.com/tipsi/tipsi-stripe.git,React Native Stripe binding for iOS/Android platforms,1139,551,1139,platform+stripe+android+ios+apple-pay+react-native,GitHub
924,omnibus,https://github.com/chef/omnibus.git,Easily create full-stack installers for your project across a variety of platforms.,1139,287,1139,platform,GitHub
925,Criterion,https://github.com/Snaipe/Criterion.git,A cross-platform C and C++ unit testing framework for the 21st century,1139,132,1139,platform+c+c-plus-plus+unit-testing+framework+kiss+cross-platform,GitHub
926,UnityStandaloneFileBrowser,https://github.com/gkngkc/UnityStandaloneFileBrowser.git,A native file browser for unity standalone platforms,1138,176,1138,platform+unity+unity3d+file-browser+file-chooser+windows+macos+linux+gtk+webgl,GitHub
927,ShadowEditor,https://github.com/tengge1/ShadowEditor.git,"Cross-platform 3D scene editor based on three.js, golang and mongodb for desktop and web. https://tengge1.github.io/ShadowEditor-examples/",1138,205,1138,platform+webgl+editor+scene+game-engine+threejs+shadow-editor+lol+three+golang+web-gis+three-editor+gis,GitHub
928,usbdriveby,https://github.com/samyk/usbdriveby.git,"USBdriveby exploits the trust of USB devices by emulating an HID keyboard and mouse, installing a cross-platform firewall-evading backdoor, and rerouting DNS within seconds of plugging it in.",1135,293,1135,platform,GitHub
929,cells,https://github.com/pydio/cells.git,Future-proof content collaboration platform,1133,113,1133,platform+filesharing+golang-application+microservices,GitHub
930,mantis,https://github.com/Netflix/mantis.git,"A platform that makes it easy for developers to build realtime, cost-effective, operations-focused applications",1133,99,1133,platform,GitHub
931,orbit,https://github.com/andymatuschak/orbit.git,Experimental spaced repetition platform for exploring ideas in memory augmentation and programmable attention,1129,24,1129,platform+spaced-repetition+research-platform+mnemonic-medium+memory-augmentation,GitHub
932,MongoShake,https://github.com/alibaba/MongoShake.git,MongoShake is a universal data replication platform based on MongoDB's oplog. Redundant replication and active-active replication are two most important functions. 基于mongodb oplog的集群复制工具，可以满足迁移和同步的需求，进一步实现灾备和多活功能。,1126,316,1126,platform+mongo-database+mongodb-oplog+replication+active-active+mongoshake,GitHub
933,manageiq,https://github.com/ManageIQ/manageiq.git,ManageIQ Open-Source Management Platform,1123,801,1123,platform+manageiq+ruby+rails+cloud+containers+vmware+rhev+ovirt+amazon+management+ansible+google-cloud+azure+openstack+kubernetes+openshift+nuage+foreman+aws,GitHub
934,WaykiChain,https://github.com/WaykiChain/WaykiChain.git,Public Blockchain as a Decentralized Finance Infrastructure Service Platform,1120,242,1120,platform+blockchain+dpos+smart+contract+cryptography+p2p+stablecoin+c-plus-plus+defi+wasm+dex+cdp,GitHub
935,kdeconnect-kde,https://github.com/KDE/kdeconnect-kde.git,Multi-platform app that allows your devices to communicate,1118,114,1118,platform,GitHub
936,aspnet-starter-kit,https://github.com/kriasoft/aspnet-starter-kit.git,"Cross-platform web development with Visual Studio Code, C#, F#, JavaScript, ASP.NET Core, EF Core, React (ReactJS), Redux, Babel. Single-page application boilerplate.",1116,201,1116,platform,GitHub
937,OpenBoard,https://github.com/OpenBoard-org/OpenBoard.git,OpenBoard is a cross-platform interactive whiteboard application intended for use in a classroom setting.,1115,268,1115,platform,GitHub
938,Shinobi,https://github.com/moeiscool/Shinobi.git,:peace_symbol: :palestinian_territories: Shinobi CE - The Free Open Source CCTV platform written in Node.JS (Camera Recorder - Security Surveillance Software - Restreamer,1111,164,1111,platform+websockets+webm+mp4+ip-camera+stream+local-cameras+shinobi+hls+camera-recorder+monitor+nodejs+cctv+cctv-cameras+nvr+mjpeg+base64+onvif+zoneminder+storageareas+shinobicctv,GitHub
939,PowerForensics,https://github.com/Invoke-IR/PowerForensics.git,PowerForensics provides an all in one platform for live disk forensic analysis,1104,259,1104,platform,GitHub
940,Vynchronize,https://github.com/kyle8998/Vynchronize.git,Watch videos with friends online with the new real time video synchronization platform,1103,187,1103,platform+watch-synchronized-videos+single-page-app+video-player+synchronization+web-sockets+socket-io+nodejs+social+realtime,GitHub
941,govcl,https://github.com/ying32/govcl.git,Cross-platform Golang GUI library. ,1100,136,1100,platform+golang+ui+goui+golangui+golcl+go+lazarus+gui+gogui+go-ui+go-gui+golang-library+gui-toolkit+linux-desktop+windows-desktop+macos-app+lcl,GitHub
942,Hedwig,https://github.com/onevcat/Hedwig.git,"Send email to any SMTP server like a boss, in Swift and cross-platform",1098,62,1098,platform+swift+mail+smtp+cross-platform+server,GitHub
943,Cockatrice,https://github.com/Cockatrice/Cockatrice.git,A cross-platform virtual tabletop for multiplayer card games,1095,375,1095,platform+card-games+magic-the-gathering+tabletop-gaming+cockatrice+c-plus-plus+transifex+hacktoberfest,GitHub
944,messenger-bot,https://github.com/remixz/messenger-bot.git,A Node client for the Facebook Messenger Platform,1095,225,1095,platform+facebook+facebook-messenger-platform+bot,GitHub
945,museeks,https://github.com/martpie/museeks.git,"🎵 A simple, clean and cross-platform music player",1095,177,1095,platform+museeks+music+cross-platform+music-player+react+electron,GitHub
946,liberapay.com,https://github.com/liberapay/liberapay.com.git,Source code of the recurrent donations platform Liberapay,1095,164,1095,platform+python+crowdfunding+web+money+donation,GitHub
947,setup-gcloud,https://github.com/google-github-actions/setup-gcloud.git,A collection of GitHub Actions for interfacing with Google Cloud Platform.,1095,344,1095,platform,GitHub
948,UI-For-UWP,https://github.com/telerik/UI-For-UWP.git,"This repo contains the source code for Telerik UI for Universal Windows Platform (UWP), which includes 20+ UI controls for developers building UWP applications.",1095,240,1095,platform+csharp+uwp+uwp-apps+visual-studio+windows-10+xaml+telerik,GitHub
949,mycollab,https://github.com/MyCollab/mycollab.git,"An open source, free, high performance, stable and secure Java Application Business Platform of Project Management and Document",1094,533,1094,platform+java+mysql+project-management+collaboration+agile+kanban+kotlin+mysql-server+microservices+spring-boot+springframework+vaadin+mybatis+opensource+onpremises+mybatis3+rest-api+quartz-scheduler+guava,GitHub
950,glazier,https://github.com/google/glazier.git,A tool for automating the installation of the Microsoft Windows operating system on various device platforms.,1093,89,1093,platform,GitHub
951,cs-script,https://github.com/oleg-shilo/cs-script.git,C# scripting platform,1091,173,1091,platform,GitHub
952,rxjava_for_android,https://github.com/cn-ljb/rxjava_for_android.git,Android platform on the use of Demo RxJava,1088,265,1088,platform+rxajva+android,GitHub
953,ever-demand,https://github.com/ever-co/ever-demand.git,Ever® Demand™ - Open-Source Commerce Platform for On-Demand Economy and Digital Marketplaces,1088,313,1088,platform+ecommerce-platform+ecommerce+commerce+e-commerce+on-demand+javascript+typescript+shop+storefront+marketplace+platform+ionic+angular+nodejs+commerce-platform+shopping-website+graphql+framework+headless+multivendor,GitHub
954,BIMserver,https://github.com/opensourceBIM/BIMserver.git,The open source BIMserver platform,1087,497,1087,platform+ifc+openbim+bim+bim-applications+bim-bots+buildingsmart+bimserver+java+bim-server,GitHub
955,libnfc,https://github.com/nfc-tools/libnfc.git,Platform independent Near Field Communication (NFC) library,1087,336,1087,platform+libnfc+c+pcsc-lite+nfc,GitHub
956,platform,https://github.com/cashmusic/platform.git,"A free and open platform giving all musicians access to tools that let them manage, promote, and sell their music online.",1086,270,1086,platform,GitHub
957,paz,https://github.com/paz-sh/paz.git,"An open-source, in-house service platform with a PaaS-like workflow, built on Docker, CoreOS, Etcd and Fleet. This repository houses the documentation and installation scripts.",1086,59,1086,platform,GitHub
958,symphony,https://github.com/88250/symphony.git,🎶 一款用 Java 实现的现代化社区（论坛/问答/BBS/社交网络/博客）系统平台。A modern community (forum/Q&A/BBS/SNS/blog) system platform implemented in Java. https://ld246.com,1085,272,1085,platform+forum+bbs+sns+community+discussion+java+sym+vditor+markdown,GitHub
959,flutter_platform_widgets,https://github.com/stryder-dev/flutter_platform_widgets.git,Target the specific design of Material for Android and Cupertino for iOS widgets through a common set of Platform aware widgets,1083,112,1083,platform+flutter+dart+widgets+package,GitHub
960,swift-crypto,https://github.com/apple/swift-crypto.git,Open-source implementation of a substantial portion of the API of Apple CryptoKit suitable for use on Linux platforms.,1081,73,1081,platform+cryptography+elliptic-curves+hash-functions+ciphers+ecdsa+ecdh+eddsa+boringssl+swift-crypto+swift,GitHub
961,haywire,https://github.com/haywire/haywire.git,Haywire is an asynchronous HTTP server framework written in C that's built using the event loop based libuv platform layer that node.js is built on top of.,1081,133,1081,platform,GitHub
962,rats-search,https://github.com/DEgITx/rats-search.git,BitTorrent P2P multi-platform search engine for Desktop and Web servers with integrated torrent client.,1079,132,1079,platform+bittorrent+search+scanner+p2p+network+torrent+desktop-application+search-engine,GitHub
963,NumberPickerView,https://github.com/Carbs0126/NumberPickerView.git,another NumberPicker with more flexible attributes on Android platform,1078,242,1078,platform,GitHub
964,embedio,https://github.com/unosquare/embedio.git,"A tiny, cross-platform, module based web server for .NET",1077,132,1077,platform+mono+webserver+websocket+dotnet+dotnetcore+websockets+url-segment+tiny+routing-strategies+embedded+raspberry-pi+raspberry-pi-3+http+http-server+http-requests+http-api+http-request+http-response+http-rest-api,GitHub
965,libc,https://github.com/rust-lang/libc.git,Raw bindings to platform APIs for Rust,1076,650,1076,platform,GitHub
966,PeaZip,https://github.com/peazip/PeaZip.git,"Free Zip / Unzip software and Rar file extractor. Cross-platform file and archive manager. Features volume spanning, compression, authenticated encryption. Supports 7Z, 7-Zip sfx, ACE, ARJ, Brotli, BZ2, CAB, CHM, CPIO, DEB, GZ, ISO, JAR, LHA/LZH, NSIS, OOo, PAQ/LPAQ, PEA, QUAD, RAR, RPM, split, TAR, Z, ZIP, ZIPX, Zstandard.",1076,74,1076,platform+peazip+rar+zip+paq+compression+extractor+archiver+encryption+brotli+zstandard,GitHub
967,Locker,https://github.com/LockerProject/Locker.git,"Locker - the ""me"" platform ",1075,138,1075,platform,GitHub
968,datacamp-light,https://github.com/datacamp/datacamp-light.git,Convert any blog or website to an interactive learning platform for data science,1070,324,1070,platform,GitHub
969,libbitcoin-system,https://github.com/libbitcoin/libbitcoin-system.git,Bitcoin Cross-Platform C++ Development Toolkit,1069,319,1069,platform,GitHub
970,nexusjs,https://github.com/voodooattack/nexusjs.git,Nexus.js - The next-gen JavaScript platform,1069,22,1069,platform+multithreading+javascriptcore+javascript+webkit+runtime,GitHub
971,fullstack-tutorial,https://github.com/apollographql/fullstack-tutorial.git,🚀 The Apollo platform tutorial app,1066,787,1066,platform+apollo-server+apollo-client+graphql+node+react+javascript,GitHub
972,qupzilla,https://github.com/QupZilla/qupzilla.git,Cross-platform Qt web browser,1065,353,1065,platform+qtwebengine+browser,GitHub
973,jquery.fileDownload,https://github.com/johnculviner/jquery.fileDownload.git,jQuery File Download is a cross server platform compatible jQuery plugin that allows for an Ajax-like file download experience that isn’t normally possible using the web.,1054,1016,1054,platform,GitHub
974,Cacao,https://github.com/PureSwift/Cacao.git,Pure Swift Cross-platform UIKit (Cocoa Touch) implementation (Supports Linux),1053,44,1053,platform+swift+linux+cocoa-touch+uikit+cross-platform-gui+vector-graphics,GitHub
975,reddit-swiftui,https://github.com/carson-katri/reddit-swiftui.git,A cross-platform Reddit client built in SwiftUI,1048,63,1048,platform+swiftui+swiftui-example+reddit+ios+macos+watchos,GitHub
976,liquidctl,https://github.com/liquidctl/liquidctl.git,Cross-platform CLI and Python drivers for AIO liquid coolers and other devices,1048,127,1048,platform+corsair+evga+nzxt+liquid-cooler+fan-controller+power-supply+led-controller+gigabyte+hacktoberfest+asus+dram+graphics-card,GitHub
977,Kaku,https://github.com/EragonJ/Kaku.git,"🎧 Kaku is a highly integrated music player supports different online platform like YouTube, SoundCloud, Vimeo and more. Available on Mac, Windows and Linux.",1046,108,1046,platform+kaku+vimeo+soundcloud+javascript+music+music-player+youtube+linux+mac+windows+player,GitHub
978,workshops,https://github.com/ansible/workshops.git,Training Course for Ansible Automation Platform,1045,767,1045,platform+training+ansible+networking+vyos+cisco+cisco-ios+juniper-networks+rhel,GitHub
979,awesome-gcp-certifications,https://github.com/ddneves/awesome-gcp-certifications.git, A curated list of resources for learning about Google Cloud Platform certifications and how to prepare for it.,1045,384,1045,platform,GitHub
980,rhodes,https://github.com/rhomobile/rhodes.git,"The Rhodes framework is a platform for building locally executing, device-optimized mobile applications for all major smartphone devices.",1038,237,1038,platform,GitHub
981,CodenameOne,https://github.com/codenameone/CodenameOne.git,"Cross-platform framework for building truly native mobile apps with Java or Kotlin. Write Once Run Anywhere support for iOS, Android, Desktop & Web.",1037,280,1037,platform+cross-platform+java+codename-one+framework+mobile-development+kotlin+ios+android+windows+uwp+web+pwa+wora,GitHub
982,rumprun,https://github.com/rumpkernel/rumprun.git,The Rumprun unikernel and toolchain for various platforms,1032,124,1032,platform,GitHub
983,magma,https://github.com/magma/magma.git,Platform for building access networks and modular network services,1030,367,1030,platform+networks+mobile+3gpp+python+vagrant+c+magma+mno+golang,GitHub
984,pencil,https://github.com/pencil2d/pencil.git,"Pencil2D is an easy, intuitive tool to make 2D hand-drawn animations. Pencil2D is open source and cross-platform.",1029,203,1029,platform+animation+drawing+qt5+graphics2d+cartoon+cplusplus+bitmap+multi-platform+pencil2d+onion-skin+linux+macos+hacktoberfest,GitHub
985,pontoon,https://github.com/mozilla/pontoon.git,Mozilla's Localization Platform,1028,486,1028,platform+pontoon+translation+localization+mozilla+javascript+django+design,GitHub
986,pyperclip,https://github.com/asweigart/pyperclip.git,Python module for cross-platform clipboard functions.,1028,144,1028,platform,GitHub
987,plyer,https://github.com/kivy/plyer.git,Plyer is a platform-independent Python wrapper for platform-dependent APIs,1027,329,1027,platform+python+api-wrapper+windows+linux+macos+ios+android,GitHub
988,geonode,https://github.com/GeoNode/geonode.git,"GeoNode is an open source platform that facilitates the creation, sharing, and collaborative use of geospatial data.",1026,920,1026,platform+python+django+gis+sdi+spatial-data-infrastructure,GitHub
989,Zilliqa,https://github.com/Zilliqa/Zilliqa.git,Zilliqa is the world's first high-throughput public blockchain platform - designed to scale to thousands ​of transactions per second.,1025,236,1025,platform+zilliqa,GitHub
990,cocaine-core,https://github.com/cocaine/cocaine-core.git,An open platform to build your own PaaS clouds.,1021,92,1021,platform,GitHub
991,kopia,https://github.com/kopia/kopia.git,"Cross-platform backup tool for Windows, macOS & Linux with fast, incremental backups, client-side end-to-end encryption, compression and data deduplication. CLI and GUI included.",1020,70,1020,platform+deduplication+backup+google-cloud-storage+encryption+cloud,GitHub
992,GithubXamarin,https://github.com/prajjwaldimri/GithubXamarin.git,GithubXamarin(GitIt) is a cross-platform application for https://github.com which is built using Xamarin.,1018,23,1018,platform+xamarin+gitit+github+uwp+csharp+uwp-apps+android+uwp-applications+xamarin-android,GitHub
993,SoftEtherVPN_Stable,https://github.com/SoftEtherVPN/SoftEtherVPN_Stable.git,"Cross-platform multi-protocol VPN software. This repository is officially managed by Daiyuu Nobori, the founder of the project. Pull requests should be sent to the master repository at https://github.com/SoftEtherVPN/SoftEtherVPN.",1015,331,1015,platform,GitHub
994,IOSSecuritySuite,https://github.com/securing/IOSSecuritySuite.git,iOS platform security & anti-tampering Swift library,1013,116,1013,platform,GitHub
995,ey-cloud-recipes,https://github.com/engineyard/ey-cloud-recipes.git,"A starter repo for custom chef recipes on EY's cloud platform.  These are for reference, and do not indicate a supported status.",1006,302,1006,platform,GitHub
996,redcar,https://github.com/danlucraft/redcar.git,A cross-platform programmer's editor written in Ruby.,1003,147,1003,platform,GitHub
997,aquameta,https://github.com/aquametalabs/aquameta.git,Web development platform built entirely in PostgreSQL,1003,49,1003,platform+postgresql+rest-api+version-control-system+system-catalog+events+widgets+semantics+plpgsql,GitHub
998,cp-docker-images,https://github.com/confluentinc/cp-docker-images.git,[DEPRECATED] Docker images for Confluent Platform.,1000,644,1000,platform+confluent+kafka+docker-images+kafka-connect+kafka-streams,GitHub
999,moonsharp,https://github.com/moonsharp-devs/moonsharp.git,"An interpreter for the Lua language, written entirely in C# for the .NET, Mono, Xamarin and Unity3D platforms, including handy remote debugger facilities.",998,170,998,platform+moonsharp+mono+debugger+interpreter+c-sharp+unity3d+lua+xamarin,GitHub
1000,diez,https://github.com/diez/diez.git,"The Design Token Framework — Adopt a unified design language across platforms, codebases, and teams",996,52,996,platform+design-tokens+design-systems+design-language+cross-platform+compiler+ios-style+android-style+web-styles+style,GitHub
1001,VolleyPlus,https://github.com/DWorkS/VolleyPlus.git,🏐 Volley library : make everything faster . Its an improvements for Volley by Google for Android  https://android.googlesource.com/platform/frameworks/volley ,991,288,991,platform+volley+networking+requestqueue+image-cache+android-library+volleyplus+java,GitHub
1002,Intrinsic,https://github.com/begla/Intrinsic.git,Intrinsic is a Vulkan based cross-platform game and rendering engine. The project is currently in an early stage of development.,990,73,990,platform+vulkan+game+rendering+game-engine+cross-platform-game+cross-platform+data-oriented-design+data-oriented+vulkan-sdk+rendering-engine,GitHub
1003,giu,https://github.com/AllenDang/giu.git,Cross platform rapid GUI framework for golang based on Dear ImGui.,988,68,988,platform+cross-platform+gui+golang+imgui+dear-imgui+ui+uikit,GitHub
1004,vialer-js,https://github.com/vialer/vialer-js.git,Pluggable WebRTC softphone and communication platform.,986,57,986,platform+sip+webrtc+softphone+vue+chrome+electron+webextension,GitHub
1005,HyperPlatform,https://github.com/tandasat/HyperPlatform.git,Intel VT-x based hypervisor aiming to provide a thin VM-exit filtering platform on Windows.,985,311,985,platform+hypervisor+windows-kernel+virtual-machine+driver,GitHub
1006,fusio,https://github.com/apioo/fusio.git,Open source API management platform,984,146,984,platform+api+rest+api-management+serverless+microservice+php+javascript+openapi+api-gateway+api-manager+rpc+backend,GitHub
1007,Azure-Kinect-Sensor-SDK,https://github.com/microsoft/Azure-Kinect-Sensor-SDK.git,A cross platform (Linux and Windows) user mode SDK to read data from your Azure Kinect device.,983,430,983,platform+kinect+sdk,GitHub
1008,xlwt,https://github.com/python-excel/xlwt.git,"Library to create spreadsheet files compatible with MS Excel 97/2000/XP/2003 XLS files, on any platform.",980,286,980,platform,GitHub
1009,android-messages-desktop,https://github.com/chrisknepper/android-messages-desktop.git,Android Messages as a Cross-platform Desktop App,979,83,979,platform+android-messages+desktop+windows+macos+linux+android+android-messaging+sms,GitHub
1010,KafkaCenter,https://github.com/xaecbd/KafkaCenter.git,"KafkaCenter is a unified  platform for Kafka cluster management and maintenance, producer / consumer monitoring, and use of ecological components.",979,158,979,platform+kafka+kafkacenter+kafkamanager+kafka-center+kafka-manager+kmanager+kafkaoffsetmonitor+kafka-monitor+kafka-eagle+ksql+kafka-connect+kafka-connect-ui+connect-ui,GitHub
1011,reallive,https://github.com/parzulpan/reallive.git,A cross-platform network media aggregation application.,978,140,978,platform+cross-platform+media+livestream+live+live-video+hdtv+radio-station,GitHub
1012,python-broadlink,https://github.com/mjg59/python-broadlink.git,"Python module for controlling Broadlink RM2/3 (Pro) remote controls, A1 sensor platforms and SP2/3 smartplugs",977,390,977,platform,GitHub
1013,psst,https://github.com/jpochyla/psst.git,Fast and multi-platform Spotify client with native GUI,974,28,974,platform,GitHub
1014,PyUserInput,https://github.com/SavinaRoja/PyUserInput.git,A module for cross-platform control of the mouse and keyboard in python that is simple to install and use.,971,243,971,platform,GitHub
