,full_name,link,description,stars,forks,watchers,keywords,source
288,ivideo,https://github.com/phobal/ivideo.git,一个可以观看国内主流视频平台所有视频的客户端（Mac、Windows、Linux） A client that can watch video of domestic(China) mainstream video platform,11873,3291,11873,platform,GitHub
289,directus,https://github.com/directus/directus.git,Open-Source Data Platform 🐰  — Directus wraps any SQL database with a real-time GraphQL+REST API and an intuitive app for non-technical users.,11741,1234,11741,platform+api+cms+graphql+content+app+database+dashboard+vue+sqlite+mysql+postgresql+mssql+oracle+directus+headless+realtime+node+headless-cms,GitHub
290,Avalonia,https://github.com/AvaloniaUI/Avalonia.git,A cross platform XAML framework for .NET,11712,1052,11712,platform+c-sharp+xaml+multi-platform+gui+avalonia+avaloniaui+cross-platform+dotnet+dotnetcore+user-interface+csharp+cross-platform-xaml,GitHub
291,Files,https://github.com/files-community/Files.git,A modern file manager that pushes the boundaries of the platform.,11650,619,11650,platform+uwp+fluent-design+xaml+file-manager+winui+files+windows+csharp+windows-10+windows-11+fluent,GitHub
292,Marlin,https://github.com/MarlinFirmware/Marlin.git,Marlin is an optimized firmware for RepRap 3D printers based on the Arduino platform. | Many commercial 3D printers come with Marlin installed. Check with your vendor if you need source code for your specific machine.,11585,14759,11585,platform+reprap+arduino+3d-printing+firmware+avr+atmel+stmicro+esp32,GitHub
293,tink,https://github.com/google/tink.git,"Tink is a multi-language, cross-platform, open source library that provides cryptographic APIs that are secure, easy to use correctly, and hard(er) to misuse.",11501,988,11501,platform+cryptography+java+cpp+go+objc+crypto+security+javascript,GitHub
294,reaction,https://github.com/reactioncommerce/reaction.git,"Reaction is an API-first, headless commerce platform built using Node.js, React, GraphQL. Deployed via Docker and Kubernetes. ",11397,2081,11397,platform+ecommerce-platform+ecommerce+commerce+reactioncommerce+e-commerce+javascript+cart+shop+storefront+marketplace+docker+mongodb+headless+graphql+reaction-action,GitHub
295,spree,https://github.com/spree/spree.git,"Open Source multi-language/multi-currency/multi-store E-commerce platform for Ruby on Rails with a modern UX, PWA frontend, REST API, GraphQL, several official extensions, and 3rd party integrations. ",11359,4764,11359,platform+spree+spreecommerce+rails+ecommerce+e-commerce+ruby+rubyonrails+cart+headless-commerce+ecommerce-platform+store+shop+spree-commerce+graphql,GitHub
296,VasSonic,https://github.com/Tencent/VasSonic.git,"VasSonic is a lightweight and high-performance Hybrid framework developed by tencent VAS team, which is intended to speed up the first screen of websites working on Android and iOS platform. ",11358,1554,11358,platform+hybrid+android-sdk+ios-sdk+h5+web+webview,GitHub
297,eos,https://github.com/EOSIO/eos.git,An open source smart contract platform ,11233,3636,11233,platform+eosio,GitHub
298,cube.js,https://github.com/cube-js/cube.js.git,📊 Cube.js — Open-Source Analytical API Platform,10873,1049,10873,platform+chart+analytics+serverless+microservice+javascript+cube+postgresql+mysql+athena+nodejs+hive+presto+spark+bigquery,GitHub
299,maui,https://github.com/dotnet/maui.git,".NET MAUI is the .NET Multi-platform App UI, a framework for building native device applications spanning mobile, tablet, and desktop.",10825,454,10825,platform+dotnet+maui+multi-platform+user-interface+microsoft,GitHub
300,keepassxc,https://github.com/keepassxreboot/keepassxc.git,KeePassXC is a cross-platform community-driven port of the Windows application “Keepass Password Safe”.,10806,878,10806,platform+keepassxc+keepass+password-manager+linux+windows+cross-platform+yubikey+macos+password+security+privacy,GitHub
301,proton-native,https://github.com/kusti8/proton-native.git,A React environment for cross platform desktop apps,10755,379,10755,platform+react+js+desktop+cross-platform+native,GitHub
302,october,https://github.com/octobercms/october.git,Self-hosted CMS platform based on the Laravel PHP Framework.,10695,2265,10695,platform+cms+framework+cmf+laravel+php+platform+octobercms+backend+cms-platform,GitHub
303,v2ray-core,https://github.com/v2fly/v2ray-core.git,A platform for building proxies to bypass network restrictions.,10673,1771,10673,platform+proxy+network+socks5+shadowsocks+v2ray+vmess+vless+v2fly+anticensorship+vpn+trojan+tunnel,GitHub
304,postal,https://github.com/postalserver/postal.git,✉️ A fully featured open source mail delivery platform for incoming & outgoing e-mail,10640,738,10640,platform+ruby+mail+smtp+postal+mail-server,GitHub
305,botkit,https://github.com/howdyai/botkit.git,"Botkit is an open source developer tool for building chat bots, apps and custom integrations for major messaging platforms.",10408,2275,10408,platform+botkit+botkit-studio+microsoft-bot-framework+bot-application+slack+facebook+twilio+cisco-spark+bots+sms+conversational-ui+workplacebyfacebook+microsoft-teams+bot+facebook-bot+facebook-messenger+glitch+making-bots+web-bot+chatbot,GitHub
306,micro,https://github.com/micro/micro.git,Micro is a cloud platform for API development,10271,903,10271,platform+micro+cloud+m3o+mu+microkernel,GitHub
307,keeweb,https://github.com/keeweb/keeweb.git,Free cross-platform password manager compatible with KeePass,10222,891,10222,platform+keeweb+keepass+security+password-manager+password+electron+javascript,GitHub
308,fpm,https://github.com/jordansissel/fpm.git,"Effing package management! Build packages for multiple platforms (deb, rpm, etc) with great ease and sanity.",10059,1007,10059,platform+packaging,GitHub
309,iced,https://github.com/hecrj/iced.git,"A cross-platform GUI library for Rust, inspired by Elm",9969,440,9969,platform+gui+graphics+rust+elm+interface+widget+widgets+toolkit+user-interface+renderer-agnostic,GitHub
310,libui,https://github.com/andlabs/libui.git,Simple and portable (but not inflexible) GUI library in C that uses the native GUI technologies of each platform it supports.,9960,593,9960,platform,GitHub
311,mlflow,https://github.com/mlflow/mlflow.git,Open source platform for the machine learning lifecycle,9899,2193,9899,platform+machine-learning+ai+ml+mlflow+apache-spark+model-management,GitHub
312,ungit,https://github.com/FredrikNoren/ungit.git,The easiest way to use git. On any platform. Anywhere.,9730,646,9730,platform+ungit+javascript+git+nodejs+ui,GitHub
313,openresty,https://github.com/openresty/openresty.git,High Performance Web Platform Based on Nginx and LuaJIT,9727,1296,9727,platform,GitHub
314,bgfx,https://github.com/bkaradzic/bgfx.git,"Cross-platform, graphics API agnostic, ""Bring Your Own Engine/Framework"" style rendering library.",9646,1476,9646,platform+engine+rendering+graphics+directx+vulkan+metal+opengl+d3d9+d3d11+d3d12+gles+webgl+glfw+sdl+gamedev+directx-11+directx-12+vulkan-api+webgpu+dawn,GitHub
315,PeerTube,https://github.com/Chocobozzz/PeerTube.git,ActivityPub-federated video streaming platform using P2P directly in your web browser,9545,1020,9545,platform+video+decentralized+p2p+angular+activitypub,GitHub
316,cutter,https://github.com/rizinorg/cutter.git,Free and Open Source Reverse Engineering Platform powered by rizin,9535,762,9535,platform+cutter+gui+reverse-engineering+security,GitHub
317,ceph,https://github.com/ceph/ceph.git,"Ceph is a distributed object, block, and file storage platform ",9482,4455,9482,platform,GitHub
318,botpress,https://github.com/botpress/botpress.git,"🤖 The Conversational Platform with built-in language understanding (NLU), beautiful graphical interface and Dialog Manager (DM). Easily create chatbots and AI-based virtual assistants.",9306,1234,9306,platform+chatbot+bot+botpress+bot-framework+sdk+bot-builder+microsoft-bot-framework+botkit+botkit-bots+bots+conversation+conversational-ui+nlu+nlp+luis+machine-learning-algorithms+chatbot-framework+chatbots+conversational-ai,GitHub
319,react-native-firebase,https://github.com/invertase/react-native-firebase.git,🔥 A well-tested feature-rich modular Firebase implementation for React Native. Supports both iOS & Android platforms for all Firebase services.,9296,1834,9296,platform+firebase+analytics+android+ios+database+push-notifications+react-native+fcm+react-native-app+react+auth+javascript+realtime-database+web-sdk+storage+transactions+remote-config+firestore+crashlytics+react-hooks,GitHub
320,Tars,https://github.com/TarsCloud/Tars.git,"Tars is a high-performance RPC framework based on name service and Tars protocol, also integrated administration platform, and implemented hosting-service via flexible schedule.",9172,2079,9172,platform+rpc-framework+high-performance+high-availability+microservice+tars-foundation+tars,GitHub
321,wcdb,https://github.com/Tencent/wcdb.git,WCDB is a cross-platform database framework developed by WeChat.,9092,1202,9092,platform+database+android+ios+wechat+mobile+mobile-database+sqlcipher+sqlite,GitHub
322,thingsboard,https://github.com/thingsboard/thingsboard.git,"Open-source IoT Platform - Device management, data collection, processing and visualization.",9008,2974,9008,platform+dashboard+visualization+iot+iot-platform+mqtt+coap+middleware+netty+akka+websockets+grpc+widgets+thingsboard+iot-analytics+spark+fleet-tracking+smart-farm+platform+kafka,GitHub
323,coreutils,https://github.com/uutils/coreutils.git,Cross-platform Rust rewrite of the GNU coreutils,8812,701,8812,platform+rust+coreutils+gnu-coreutils+busybox+cross-platform+command-line-tool,GitHub
324,esp8266_deauther,https://github.com/SpacehuhnTech/esp8266_deauther.git,Affordable WiFi hacking platform for testing and learning,8779,1929,8779,platform+wifi+arduino+attack+esp8266+deauth+hack+deauther+board+scanning+hacktoberfest,GitHub
325,flipper,https://github.com/facebook/flipper.git,A desktop debugging platform for mobile developers.,8764,642,8764,platform,GitHub
326,robomongo,https://github.com/Studio3T/robomongo.git,Native cross-platform MongoDB management tool,8673,728,8673,platform,GitHub
327,webview,https://github.com/webview/webview.git,Tiny cross-platform webview library for C/C++/Golang. Uses WebKit (Gtk/Cocoa) and Edge (Windows),8672,667,8672,platform+webui+webkit+golang+c+single-header-lib+cgo,GitHub
328,AudioKit,https://github.com/AudioKit/AudioKit.git,"Swift audio synthesis, processing, & analysis platform for iOS, macOS and tvOS",8590,1327,8590,platform+audiokit+swift+playground+audio+ios+macos+tvos+midi+swift-playgrounds+music,GitHub
329,Google-Play-Music-Desktop-Player-UNOFFICIAL-,https://github.com/MarshallOfSound/Google-Play-Music-Desktop-Player-UNOFFICIAL-.git,A beautiful cross platform Desktop Player for Google Play Music,8483,821,8483,platform+electron+music+player+cross-platform+google-play-music,GitHub
330,openFrameworks,https://github.com/openframeworks/openFrameworks.git,openFrameworks is a community-developed cross platform toolkit for creative coding in C++.,8468,2470,8468,platform+openframeworks+osx+windows+linux+raspberry-pi+android+ios+creative-coding+video+audio+opengl+graphics+computer-vision+opencv+emscripten,GitHub
331,OnsenUI,https://github.com/OnsenUI/OnsenUI.git,"Mobile app development framework and SDK using HTML5 and JavaScript. Create beautiful and performant cross-platform mobile apps. Based on Web Components, and provides bindings for Angular 1, 2, React and Vue.js.",8425,977,8425,platform+onsen-ui+cordova+react+angular+monaca+hybrid-apps+javascript+webcomponents+customelements+vue+material+android+ios+html+pwa,GitHub
332,gitbucket,https://github.com/gitbucket/gitbucket.git,"A Git platform powered by Scala with easy installation, high extensibility & GitHub API compatibility",8422,1191,8422,platform+scala+gitbucket+git+scalatra,GitHub
333,reactxp,https://github.com/microsoft/reactxp.git,Library for cross-platform app development.,8327,572,8327,platform,GitHub
334,vnote,https://github.com/vnotex/vnote.git,A pleasant note-taking platform.,8311,900,8311,platform+vnote+vim+markdown+note-taking+note+editor+uml+mathjax,GitHub
335,Windows-universal-samples,https://github.com/microsoft/Windows-universal-samples.git,API samples for the Universal Windows Platform.,8287,7768,8287,platform,GitHub
336,travis-ci,https://github.com/travis-ci/travis-ci.git,Free continuous integration platform for GitHub projects.,8199,815,8199,platform,GitHub
337,vue-native-core,https://github.com/GeekyAnts/vue-native-core.git,Vue Native is a framework to build cross platform native mobile apps using JavaScript,8195,308,8195,platform+vue-native+vue+framework+javascript+ios+android+mobile-app-development,GitHub
338,SoftEtherVPN,https://github.com/SoftEtherVPN/SoftEtherVPN.git,Cross-platform multi-protocol VPN software. Pull requests are welcome. The stable version is available at https://github.com/SoftEtherVPN/SoftEtherVPN_Stable.,8191,2073,8191,platform+vpn-tunnel+vpn-protocols+softether-vpn+vpn+vpn-server+ssl-vpn+softethervpn+openvpn+l2tp+ipsec+ike+sstp+l2tpv3+etherip+tls+wfh+work-from-home+wireguard,GitHub
339,chokidar,https://github.com/paulmillr/chokidar.git,Minimal and efficient cross-platform file watching library,8130,515,8130,platform+watch-files+fsevents+watcher+filesystem,GitHub
340,typecho,https://github.com/typecho/typecho.git,A PHP Blogging Platform. Simple and Powerful.,8042,1631,8042,platform+php+blog+typecho+markdown,GitHub
341,crawlab,https://github.com/crawlab-team/crawlab.git,Distributed web crawler admin platform for spiders management regardless of languages and frameworks. 分布式爬虫管理平台，支持任何语言和框架,8037,1206,8037,platform+webcrawler+scrapy+crawlab+spiders-management+go+scrapyd-ui+spider+crawler+webspider+web-crawler+docker+platform+crawling-tasks,GitHub
342,libgit2,https://github.com/libgit2/libgit2.git,"A cross-platform, linkable library implementation of Git that you can use in your application.",7996,2091,7996,platform+libgit2+git+library+dvcs+version-control,GitHub
343,buck,https://github.com/facebook/buck.git,"A fast build system that encourages the creation of small, reusable modules over a variety of platforms and languages.",7994,1176,7994,platform+build-tool+java+python+android+ios+buck,GitHub
344,spinnaker,https://github.com/spinnaker/spinnaker.git,"Spinnaker is an open source, multi-cloud continuous delivery platform for releasing software changes with high velocity and confidence.",7978,1103,7978,platform+continuous-delivery+continuous-deployment+spinnaker,GitHub
345,Activiti,https://github.com/Activiti/Activiti.git,"Activiti is a light-weight workflow and Business Process Management (BPM) Platform targeted at business people, developers and system admins. Its core is a super-fast and rock-solid BPMN 2 process engine for Java. It's open-source and distributed under the Apache license. Activiti runs in any Java application, on a server, on a cluster or in the cloud. It integrates perfectly with Spring, it is extremely lightweight and based on simple concepts. ",7947,6461,7947,platform+java+bpm+spring+cloud+microservices+business-process+activiti+product-activiti+bpmn,GitHub
346,glfw,https://github.com/glfw/glfw.git,"A multi-platform library for OpenGL, OpenGL ES, Vulkan, window and input",7927,2950,7927,platform+vulkan+opengl+c+linux+macos+windows+unix+opengl-es,GitHub
347,ui,https://github.com/andlabs/ui.git,Platform-native GUI library for Go.,7924,722,7924,platform,GitHub
348,flynn,https://github.com/flynn/flynn.git,[UNMAINTAINED] A next generation open source platform as a service (PaaS),7923,602,7923,platform,GitHub
349,shadowsocks-qt5,https://github.com/shadowsocks/shadowsocks-qt5.git,A cross-platform shadowsocks GUI client,7877,2377,7877,platform+shadowsocks+cross-platform+proxy+qt5,GitHub
350,cash,https://github.com/dthree/cash.git,Cross-platform Linux commands in ES6,7738,241,7738,platform,GitHub
351,orleans,https://github.com/dotnet/orleans.git,Orleans is a cross-platform framework for building distributed applications with .NET,7729,1712,7729,platform+actor-model+distributed-actors+distributed-systems+cloud-computing+scalability+reactive+concurrency+orleans,GitHub
352,revery,https://github.com/revery-ui/revery.git,":zap: Native, high-performance, cross-platform desktop apps - built with Reason!",7651,199,7651,platform+reason+reasonml+ocaml+react+electron+ui+desktop+app+native+cross-platform+desktop-apps,GitHub
353,MonoGame,https://github.com/MonoGame/MonoGame.git,One framework for creating powerful cross-platform games.,7650,2492,7650,platform+xna+monogame+game-framework+gamedev+csharp+cross-platform+open-source+graphics+game-engine+dotnet+hacktoberfest,GitHub
354,dolphin,https://github.com/dolphin-emu/dolphin.git,"Dolphin is a GameCube / Wii emulator, allowing you to play games for these two platforms on PC with improvements.",7627,1778,7627,platform+emulation+gamecube+wii+emulator+cpp,GitHub
355,machinelearning,https://github.com/dotnet/machinelearning.git,ML.NET is an open source and cross-platform machine learning framework for .NET.,7589,1636,7589,platform+machine-learning+algorithms+dotnet+ml,GitHub
356,psutil,https://github.com/giampaolo/psutil.git,Cross-platform lib for process and system monitoring in Python,7534,1130,7534,platform+python+monitoring+ps+top+cpu+memory+freebsd+osx+windows+netbsd+openbsd+linux+disk+sensors+system-monitoring+psutil,GitHub
357,chat,https://github.com/tinode/chat.git,"Instant messaging platform. Backend in Go. Clients: Swift iOS, Java Android, JS webapp, scriptable command line; chatbots",7443,1044,7443,platform+chat+chat-application+chatapp+go+golang+instant-messaging+messenger+messaging+messaging-api+grpc+chatbots+chatserver+webchat-server+whatsapp+telegram+xmpp,GitHub
358,Lona,https://github.com/Lona/Lona.git,"A tool for defining design systems and using them to generate cross-platform UI code, Sketch files, and other artifacts.",7428,253,7428,platform,GitHub
359,universe,https://github.com/openai/universe.git,"Universe: a software platform for measuring and training an AI's general intelligence across the world's supply of games, websites and other applications.",7281,902,7281,platform,GitHub
360,codimd,https://github.com/hackmdio/codimd.git,CodiMD - Realtime collaborative markdown notes on all platforms.,7262,885,7262,platform+hackmd+collaboration+realtime+notes+markdown+codimd,GitHub
361,youtube-dl-gui,https://github.com/MrS0m30n3/youtube-dl-gui.git,A cross platform front-end GUI of the popular youtube-dl written in wxPython.,7232,1338,7232,platform+youtube-dl+python+wxpython+gui+cross-platform+youtube-dlg+downloader+video+video-downloader+linux+windows+youtube-dl-gui+pypi+youtube,GitHub
362,BookStack,https://github.com/BookStackApp/BookStack.git,A platform to create documentation/wiki content built with PHP & Laravel,6966,1060,6966,platform+bookstack+laravel+php+wiki+selfhosted+documentation,GitHub
363,nodegui,https://github.com/nodegui/nodegui.git,A library for building cross-platform native desktop applications with Node.js and CSS  🚀.  React NodeGui : https://react.nodegui.org and Vue NodeGui: https://vue.nodegui.org,6957,196,6957,platform+nodejs+desktop+openlibrary+qt+cross-platform+javascript+gui,GitHub
364,pgweb,https://github.com/sosedoff/pgweb.git,Cross-platform client for PostgreSQL databases,6955,552,6955,platform+postgresql+golang+pgweb+cross-platform,GitHub
365,facebook-ios-sdk,https://github.com/facebook/facebook-ios-sdk.git,Used to integrate the Facebook Platform with your iOS & tvOS apps.,6828,2872,6828,platform,GitHub
366,robotgo,https://github.com/go-vgo/robotgo.git,"RobotGo, Go Native cross-platform GUI automation  @vcaesar",6783,623,6783,platform+go+robot+golang+automation+robotgo+c,GitHub
367,runtime,https://github.com/dotnet/runtime.git,".NET is a cross-platform runtime for cloud, mobile, desktop, and IoT apps.",6688,2233,6688,platform+hacktoberfest,GitHub
368,kittenTricks,https://github.com/akveo/kittenTricks.git,React Native starter kit with over 40 screens and modern Light and Dark theme for creating stunning cross-platform mobile applications.,6686,975,6686,platform+react-native+starter-kit+demo-app+react-native-ui-kitten+ios+android+ui,GitHub
369,chef,https://github.com/chef/chef.git,"Chef Infra, a powerful automation platform that transforms infrastructure into code automating how infrastructure is configured, deployed and managed across any environment, at any scale",6648,2525,6648,platform+chef+devops+cfgmgt+infrastructure+automation+deployment+hacktoberfest,GitHub
370,lorca,https://github.com/zserge/lorca.git,Build cross-platform modern desktop apps in Go + HTML5,6557,339,6557,platform,GitHub
371,AndPermission,https://github.com/yanzhenjie/AndPermission.git,:strawberry: Permissions manager for Android platform.,6535,1103,6535,platform+permission+android-permission+runtime-permission,GitHub
372,liteide,https://github.com/visualfc/liteide.git,"LiteIDE is a simple, open source, cross-platform Go IDE. ",6521,894,6521,platform+liteide+cross-platform+ide+golang+go+qt,GitHub
373,lab,https://github.com/deepmind/lab.git,A customisable 3D platform for agent-based AI research,6508,1324,6508,platform+machine-learning+artificial-intelligence+neural-networks+deep-learning,GitHub
374,MalwareSourceCode,https://github.com/vxunderground/MalwareSourceCode.git,Collection of malware source code for a variety of platforms in an array of different programming languages.,6467,641,6467,platform+malware+malware-research+malware-development+malware-detection,GitHub
375,pupy,https://github.com/n1nj4sec/pupy.git,"Pupy is an opensource, cross-platform (Windows, Linux, OSX, Android) remote administration and post-exploitation tool mainly written in python",6457,1650,6457,platform+pupy+python+remote-access+post-exploitation+pentesting+windows+linux+android+rat+shell+reverse-shell+reflective-injection+backdoor+payload+meterpreter+remote-admin-tool+mac-os,GitHub
376,kubesphere,https://github.com/kubesphere/kubesphere.git,"The container platform tailored for Kubernetes multi-cloud, datacenter, and edge management ⎈ 🖥 ☁️",6413,1037,6413,platform+devops+container-management+k8s+cncf+cloud-native+servicemesh+kubesphere+kubernetes-platform-solution+kubernetes+jenkins+istio+observability+multi-cluster,GitHub
377,ReactiveUI,https://github.com/reactiveui/ReactiveUI.git,"An advanced, composable, functional reactive model-view-viewmodel framework for all .NET platforms that is inspired by functional reactive programming. ReactiveUI allows you to  abstract mutable state away from your user interfaces, express the idea around a feature in one readable place and improve the testability of your application.",6413,1038,6413,platform+reactiveui+xamarin+ios+android+uwp+wpf+winforms+reactive-programming+reactive-extensions+functional-reactive-programming+mvvm+framework+csharp+first-timers+xamarin-forms+tizen+dotnet+fody+reactivex+hacktoberfest,GitHub
378,RIBs,https://github.com/uber/RIBs.git,Uber's cross-platform mobile architecture framework.,6408,745,6408,platform+ios+android+mobile+mobile-app+mobile-development+architecture+architectural-patterns+mvc+mvvm+mvp+viper,GitHub
379,Sylius,https://github.com/Sylius/Sylius.git,Open Source eCommerce Platform on Symfony,6400,1853,6400,platform+sylius+php+symfony+ecommerce+ecommerce-platform+shop+shopping-cart+framework+symfony-bundle+hacktoberfest,GitHub
380,fbctf,https://github.com/facebookarchive/fbctf.git,Platform to host Capture the Flag competitions,6378,1335,6378,platform+ctf+ctf-framework,GitHub
381,fkill-cli,https://github.com/sindresorhus/fkill-cli.git,Fabulously kill processes. Cross-platform.,6369,194,6369,platform+nodejs+cli-app+cli+kill+unicorns+javascript+cross-platform+fabulous+process,GitHub
382,nupic,https://github.com/numenta/nupic.git,"Numenta Platform for Intelligent Computing is an implementation of Hierarchical Temporal Memory (HTM), a theory of intelligence based strictly on the neuroscience of the neocortex.",6265,1577,6265,platform+neocortex+artificial-intelligence+machine-intelligence+hierarchical-temporal-memory,GitHub
383,popcorn-desktop,https://github.com/popcorn-official/popcorn-desktop.git,"Popcorn Time is a multi-platform, free software BitTorrent client that includes an integrated media player ( Windows / Mac / Linux ) A Butter-Project Fork",6203,306,6203,platform+popcorn+popcorntime+bittorrent+streaming+desktop+nwjs+popcorn-time,GitHub
384,dolphinscheduler,https://github.com/apache/dolphinscheduler.git,"Apache DolphinScheduler is a distributed and extensible workflow scheduler platform with powerful DAG visual interfaces, dedicated to solving complex job dependencies in the data pipeline and providing various types of jobs available `out of the box`.",6159,2195,6159,platform+workflow-scheduling-system+etl-dependency+workflow-platform+distributed-schedule-system+schedule+cronjob-schedule+job-schedule+task-schedule+workflow-schedule+azkaban+oozie+airflow+task-scheduler+job-scheduler+data-schedule,GitHub
385,PrestaShop,https://github.com/PrestaShop/PrestaShop.git,"PrestaShop is an Open Source e-commerce platform, committed to providing the best shopping cart experience for both merchants and customers.",6023,4152,6023,platform+prestashop+ecommerce+ecommerce-platform+cms+php+php-framework+ecommerce-framework,GitHub
386,capacitor,https://github.com/ionic-team/capacitor.git,"Build cross-platform Native Progressive Web Apps for iOS, Android, and the Web ⚡️",6003,664,6003,platform+javascript+html+css+swift+java+cross-platform+capacitor+cordova+ionic+ios+android+pwa,GitHub
387,Hippy,https://github.com/Tencent/Hippy.git,Hippy is designed for Web developer to easily build cross-platform and high-performance awesome apps. 👏,5947,655,5947,platform+react+vue+cross-platform+frontend+android+ios+hippy+mobile+web+layout-engine,GitHub
