,full_name,link,description,stars,forks,watchers,keywords,source
0,openflights,https://github.com/jpatokal/openflights.git,"Website for storing flight information, rendering paths on a zoomable world map and calculating statistics, with plenty of free airline, airport and route data.",1119,326,1119,airport,GitHub
1,JDFlipNumberView,https://github.com/calimarkus/JDFlipNumberView.git,[iOS] Representing analog flip numbers like airport/trainstation displays,740,139,740,airport,GitHub
2,littlenavmap,https://github.com/albar965/littlenavmap.git," Little Navmap is a free flight planner, navigation tool, moving map, airport search and airport information system for Flight Simulator X, Microsoft Flight Simulator 2020, Prepar3D and X-Plane.",659,103,659,airport+navigation+flight+simulator+map+flightplan+fsx+prepar3d+x-plane+flightplanner+msfs,GitHub
3,AirportBrcmFixup,https://github.com/acidanthera/AirportBrcmFixup.git,An open source kernel extension providing a set of patches required for non-native Airport Broadcom Wi-Fi cards.,462,62,462,airport,GitHub
4,FlightAirMap,https://github.com/Ysurac/FlightAirMap.git,"Open source project displaying live aircrafts, ships or trackers on 2D/3D map. Browse through the data based on a particular aircraft, airline, airport, tracker or vessel to search through the database or see extensive statistics. Can use ADS-B in SBS1 format (dump1090, Radarcape,...), VRS, VA (VATSIM, IVAO whazzup.txt, phpvms,...), ACARS (acarsdec, acarsdeco2), APRS, AIS as datasource.",388,124,388,airport+vatsim+ivao+aircraft+crash+cesium+acars+airport+glidernet+phpvms+notam+metar+airline+modes+ads-b+sbs+vessel+ship+tracker+3d-map+flight,GitHub
5,Airports,https://github.com/mwgg/Airports.git,"A JSON database of 28k+ airports with ICAO/IATA codes, names, cities, two-letter country identifiers, elevation, latitude & longitude, and a timezone identifier",291,101,291,airport,GitHub
6,airport-codes,https://github.com/datasets/airport-codes.git,"List of Airport codes, locations and other information around the world",240,78,240,airport,GitHub
7,JSON-Airports,https://github.com/jbrooksuk/JSON-Airports.git,"A JSON array of Airport names, IATA code and location",239,90,239,airport,GitHub
8,airport-codes,https://github.com/lynnandtonic/airport-codes.git,✈️ Making sense of those three-letter airport codes.,232,185,232,airport,GitHub
9,Throttle,https://github.com/dmolsen/Throttle.git,"Throttle is a simple node.js app that makes it easier to test how a website performs on poor network connections. For example, testing a responsive website on a poor 3G connection without actually having to have a poor 3G connection. Simply connect your Mac to ethernet, share the network connection via Airport, run Throttle, and any connected device will then be throttled to the the network speed you specified. Throttle was designed to be used in conjunction with a device lab and products like shim or Adobe Shadow where a shared connection is expected.",207,8,207,airport,GitHub
10,wireless_half-mini,https://github.com/toleda/wireless_half-mini.git,macOS Airport Half Mini (WiFi and Bluetooth),206,53,206,airport,GitHub
11,geneva-dictators,https://github.com/lefranz/geneva-dictators.git,GVA Dictator Alert: tracking dictator's jets landing and leaving Geneva Airport,190,22,190,airport,GitHub
12,AirReceiver,https://github.com/fgp/AirReceiver.git,"AirReceiver is an AirPort Express emulator, i.e. it allows streaming audio from iTunes and iOS devices to a computer running AirReceiver. It does so by implementing a RAOP/AirTunes2 server.",157,96,157,airport,GitHub
13,Airports,https://github.com/InfiniteFlightAirportEditing/Airports.git,"Got a passion for design, and want to help improve Infinite Flight? Help contribute to airport designs here!",154,480,154,airport+infinite-flight+airport-designs+flight-simulator+aviation+airport-editing,GitHub
14,airpyrt-tools,https://github.com/x56/airpyrt-tools.git,Python module and client for the AirPort device management interface,110,14,110,airport,GitHub
15,OS-X-Null-Ethernet,https://github.com/RehabMan/OS-X-Null-Ethernet.git,"A ""Null"" (Fake) Ethernet driver for OS X meant to be used when you have no working Ethernet or AirPort",101,15,101,airport,GitHub
16,Android-FlipDigitView,https://github.com/Vinayrraj/Android-FlipDigitView.git,"The FlipDigitView is simulating an analog flip display (like those for the departure time on the airport). Please open a Github issue, if you think anything is missing or wrong.",87,26,87,airport,GitHub
17,FSDAirportFlipLabel,https://github.com/felix-dumit/FSDAirportFlipLabel.git,UILabel like old Airport flipping labels,83,10,83,airport+ios+ios-animation+label+airport,GitHub
18,airport-sniffer,https://github.com/zhovner/airport-sniffer.git,Very simple Wi-Fi sniffer and dumps parser for built-in macbook AirPort Extreme card. Only native MacOS tools used.,70,13,70,airport,GitHub
19,EDDS-freeware-releases,https://github.com/gravity-EDDS/EDDS-freeware-releases.git,A project to bring the airport back to (virtual) life.,57,2,57,airport+microsoft-flight-simulator-2020+scenery+airport+microsoft-flight-simulator+edds,GitHub
20,jolivia,https://github.com/openairplay/jolivia.git,"An Java implementation of DMAP, DAAP, DPAP, DMCP, DACP and RAOP with Guice + Jetty - Essentially a iTunes share, iPhoto share and Airport Express emulation",56,11,56,airport+itunes+daap+raop+java+protocol+iphoto+bonjour+guice-jetty+airport,GitHub
21,pydata-networkx,https://github.com/MridulS/pydata-networkx.git,"[Archived! Check out http://ericmjl.github.io/Network-Analysis-Made-Simple/] A short tutorial on network analysis using Game of Thrones, US Airports and Python!",55,29,55,airport+network-analysis+tutorial+game-of-thrones+us-airports+networkx+graph-algorithms,GitHub
22,django-airports,https://github.com/bashu/django-airports.git,"✈️ It's like django-cities, but django-airports",54,15,54,airport+django+django-cities,GitHub
23,FlightsNorway,https://github.com/follesoe/FlightsNorway.git,Windows Phone 7 Application to monitor arrivals and departures from Norwegian airports. Demo app from NDC2010,44,20,44,airport,GitHub
24,PleaseSleep,https://github.com/xinstein/PleaseSleep.git,PleaseSleep will disable WiFi (airport) when your Mac goes into sleep mode.,43,13,43,airport,GitHub
25,airport-simulation,https://github.com/heronyang/airport-simulation.git,Airport Surface Simulator and Evaluation Tool 2,36,18,36,airport+airport+simulation+scheduling+nasa+cmu+surface+uncertainty+airport-simulation+evaluation,GitHub
26,InfoHub,https://github.com/KioskApps/InfoHub.git,Airport live data streaming kiosk app for Chrome,34,17,34,airport,GitHub
27,VistArrow,https://github.com/thegenuinegourav/VistArrow.git,An Android App that will unleash Vistara Airport Experience.,31,7,31,airport+android+java+camera-control+gps-tracker+gps-location+camera,GitHub
28,jquery-airport,https://github.com/okcoker/jquery-airport.git,Airport is a rather simple text effect plugin for Jquery. It emulates the style of those flickering information boards you sometimes find on airports and train stations.,31,9,31,airport,GitHub
29,airline-passenger-counts,https://github.com/marklit/airline-passenger-counts.git,"Commercial Airline Passenger Counts between airports (for latest year reported, usually 2013)",31,10,31,airport,GitHub
30,Flight-Schedules,https://github.com/mapm14/Flight-Schedules.git,"Android app that to show flights schedules between airports. Written in Kotlin and uses MVP Architecture, Dagger 2, Retrofit 2, RxKotlin, Arrow. Has unit and Android tests.",29,2,29,airport,GitHub
31,airport-codes,https://github.com/ram-nadella/airport-codes.git,Airport codes (IATA) and their corresponding information. Also available as a web service.,28,16,28,airport,GitHub
32,airportsnear.me,https://github.com/SaraVieira/airportsnear.me.git,Find airports near you or any location you input,28,3,28,airport,GitHub
33,airport,https://github.com/cfircohen/airport.git, Visual puzzle solver for Smartgames “Airport” puzzle,25,14,25,airport,GitHub
34,raop,https://github.com/tenderlove/raop.git,RAOP Client is an Airport Express client written in ruby. It allows you to stream music to an Airport Express from Ruby.,24,2,24,airport,GitHub
35,airport-codes,https://github.com/L1fescape/airport-codes.git,An NPM module containing airport codes (IATA) and other information,22,16,22,airport,GitHub
