,full_name,link,description,stars,forks,watchers,keywords,source
0,electron,https://github.com/electron/electron.git,":electron: Build cross-platform desktop apps with JavaScript, HTML, and CSS",96108,12556,96108,platform+electron+javascript+c-plus-plus+html+css+chrome+nodejs+v8,GitHub
1,angular,https://github.com/angular/angular.git,The modern web developer’s platform,75520,19717,75520,platform+angular+typescript+web+javascript+pwa+web-framework+web-performance,GitHub
2,ansible,https://github.com/ansible/ansible.git,"Ansible is a radically simple IT automation platform that makes your applications and systems easier to deploy and maintain. Automate everything from code deployment to network configuration to cloud management, in a language that approaches plain English, using SSH, with no agents to install on remote systems. https://docs.ansible.com.",49289,20908,49289,platform+python+ansible+hacktoberfest,GitHub
3,ionic-framework,https://github.com/ionic-team/ionic-framework.git,"A powerful cross-platform UI toolkit for building native-quality iOS, Android, and Progressive Web Apps with HTML, CSS, and JavaScript.",45001,13417,45001,platform+ionic+mobile+framework+angular+javascript+frontend+pwa+typescript+web+stencil+stenciljs+capacitor+react+vue+webcomponents+ios+material-design,GitHub
4,grafana,https://github.com/grafana/grafana.git,"The open and composable observability and data visualization platform. Visualize metrics, logs, and traces from multiple sources like Prometheus, Loki, Elasticsearch, InfluxDB, Postgres and many more. ",43260,8651,43260,platform+grafana+monitoring+analytics+metrics+influxdb+prometheus+elasticsearch+alerting+data-visualization+go+dashboard+business-intelligence+mysql+postgres+hacktoberfest,GitHub
5,meteor,https://github.com/meteor/meteor.git,"Meteor, the JavaScript App Platform",42553,5167,42553,platform+javascript+meteor+mongodb+build-system+npm+framework+zero-configuration+reactive-programming+nodejs+hacktoberfest,GitHub
6,godot,https://github.com/godotengine/godot.git,Godot Engine – Multi-platform 2D and 3D game engine,40865,7446,40865,platform+game-engine+godot+godotengine+open-source+multi-platform+gamedev+game-development,GitHub
7,superset,https://github.com/apache/superset.git,Apache Superset is a Data Visualization and Data Exploration Platform,39842,7694,39842,platform+superset+apache+apache-superset+data-visualization+data-viz+analytics+business-intelligence+data-science+data-engineering+asf+bi+business-analytics+data-analytics+data-analysis+python+react+sql-editor+flask,GitHub
8,v2ray-core,https://github.com/v2ray/v2ray-core.git,A platform for building proxies to bypass network restrictions.,37821,8216,37821,platform+v2ray+shadowsocks+golang+proxy+socks+socks5+http-proxy+vmess,GitHub
9,algorithm-visualizer,https://github.com/algorithm-visualizer/algorithm-visualizer.git,:fireworks:Interactive Online Platform that Visualizes Algorithms from Code,35150,5709,35150,platform+algorithm+data-structure+visualization+animation,GitHub
10,caddy,https://github.com/caddyserver/caddy.git,"Fast, multi-platform web server with automatic HTTPS",34181,2758,34181,platform+go+web-server+caddyfile+http+http-server+reverse-proxy+https+tls+automatic-https+privacy+security,GitHub
11,alacritty,https://github.com/alacritty/alacritty.git,"A cross-platform, OpenGL terminal emulator.",33970,1823,33970,platform+terminal-emulators+opengl+gpu+rust+vte+terminal+linux+macos+windows+bsd,GitHub
12,discourse,https://github.com/discourse/discourse.git,"A platform for community discussion. Free, open, simple.",33757,7331,33757,platform+discourse+javascript+rails+ruby+ember+forum+postgresql,GitHub
13,edex-ui,https://github.com/GitSquared/edex-ui.git,"A cross-platform, customizable science fiction terminal emulator with advanced monitoring & touchscreen support.",33318,1782,33318,platform+terminal+science-fiction+linux+windows+nodejs+electron+edex-ui+shell+macos+desktop+unixporn+tron+touchscreen,GitHub
14,jQuery-File-Upload,https://github.com/blueimp/jQuery-File-Upload.git,"File Upload widget with multiple file selection, drag&drop support, progress bar, validation and preview images, audio and video for jQuery. Supports cross-domain, chunked and resumable file uploads. Works with any server-side platform (Google App Engine, PHP, Python, Ruby on Rails, Java, etc.) that supports standard HTML form file uploads.",31056,8221,31056,platform,GitHub
15,sentry,https://github.com/getsentry/sentry.git,"Sentry is cross-platform application monitoring, with a focus on error reporting.",28678,3189,28678,platform+crash-reporting+crash-reports+error-monitoring+monitoring+devops+csp-report+django+error-logging+sentry+python+monitor+apm+hacktoberfest,GitHub
16,kubernetes-the-hard-way,https://github.com/kelseyhightower/kubernetes-the-hard-way.git,Bootstrap Kubernetes the hard way on Google Cloud Platform. No scripts.,27703,8541,27703,platform,GitHub
17,aspnetcore,https://github.com/dotnet/aspnetcore.git,"ASP.NET Core is a cross-platform .NET framework for building modern cloud-based web applications on Windows, Mac, or Linux.",25306,6656,25306,platform+dotnet+aspnetcore+hacktoberfest,GitHub
18,typeorm,https://github.com/typeorm/typeorm.git,"ORM for TypeScript and JavaScript (ES7, ES6, ES5). Supports MySQL, PostgreSQL, MariaDB, SQLite, MS SQL Server, Oracle, SAP Hana, WebSQL databases. Works in NodeJS, Browser, Ionic, Cordova and Electron platforms.",25155,4431,25155,platform+orm+typescript+javascript+database+typeorm+mysql+mariadb+postgresql+sqlite+sqlserver+oracle+websql+active-record+data-mapper+react-native+electron+cockroachdb+sap+sap-hana,GitHub
19,Detectron,https://github.com/facebookresearch/Detectron.git,"FAIR's research platform for object detection research, implementing popular algorithms like Mask R-CNN and RetinaNet.",24540,5346,24540,platform,GitHub
20,drone,https://github.com/drone/drone.git,"Drone is a Container-Native, Continuous Delivery Platform",23637,2311,23637,platform+continuous-delivery+continuous-integration+go+build-pipelines+build-automation+docker+ci+ci-cd+hacktoberfest,GitHub
21,aria2,https://github.com/aria2/aria2.git,"aria2 is a lightweight multi-protocol & multi-source, cross platform download utility operated in command-line. It supports HTTP/HTTPS, FTP, SFTP, BitTorrent and Metalink.",23395,2746,23395,platform+cpp11+http+ftp+sftp+bittorrent+rpc+download+metalink,GitHub
22,airflow,https://github.com/apache/airflow.git,"Apache Airflow - A platform to programmatically author, schedule, and monitor workflows",22684,8950,22684,platform+airflow+apache+apache-airflow+python+scheduler+workflow,GitHub
23,react-native-elements,https://github.com/react-native-elements/react-native-elements.git,Cross-Platform React Native UI Toolkit,21062,4236,21062,platform+ui-components+react-native+ios+android+react+ui+mobile-app+hacktoberfest,GitHub
24,nsq,https://github.com/nsqio/nsq.git,A realtime distributed messaging platform,20064,2598,20064,platform+go+messaging+distributed-systems+queue+message-queue+nsq,GitHub
25,apollo,https://github.com/ApolloAuto/apollo.git,An open autonomous driving platform,18959,7501,18959,platform+apollo+autonomous-vehicles+autonomous-driving+autonomy+self-driving-car,GitHub
26,nacos,https://github.com/alibaba/nacos.git,"an easy-to-use dynamic service discovery, configuration and service management platform for building cloud native applications.",18858,7635,18858,platform+nacos+dubbo+alibaba+kubernetes+istio+spring-cloud+microservices+service-mesh+configuration-management+distributed-configuration+dns+service-discovery+config,GitHub
27,RedisDesktopManager,https://github.com/uglide/RedisDesktopManager.git,:wrench: Cross-platform GUI management tool for Redis,18732,2989,18732,platform+redis+database-gui+redis-gui+redis-gui-client,GitHub
28,generator-jhipster,https://github.com/jhipster/generator-jhipster.git,"JHipster is a development platform to quickly generate, develop, & deploy modern web applications & microservice architectures.",18699,3662,18699,platform+angular+spring-boot+webpack+java+docker+yeoman-generator+generator+react+kubernetes+cloud+jhipster+hacktoberfest,GitHub
29,eShopOnContainers,https://github.com/dotnet-architecture/eShopOnContainers.git,"Cross-platform .NET sample microservices and container based application that runs on Linux Windows and macOS. Powered by .NET 5, Docker Containers and Azure Kubernetes Services. Supports Visual Studio, VS for Mac and CLI based environments with Docker CLI, dotnet CLI, VS Code or any other code editor.",18308,7742,18308,platform+docker+netcore+windowscontainers+xamarin+spa+microservices+ddd+ddd-patterns,GitHub
30,games,https://github.com/leereilly/games.git,":video_game: A list of popular/awesome video games, add-ons, maps, etc. hosted on GitHub. Any genre. Any platform. Any engine.",18069,2361,18069,platform+game-engine+platform-game+html5-games+strategy-game+puzzle-game+sandbox-game+gamedev+games+game+game-development,GitHub
31,electron-react-boilerplate,https://github.com/electron-react-boilerplate/electron-react-boilerplate.git,A Foundation for Scalable Cross-Platform Apps,18005,2938,18005,platform+electron+boilerplate+react+webpack+babel+jest+eslint+hmr+starter-kit+typescript+javascript+cross-platform,GitHub
32,libuv,https://github.com/libuv/libuv.git,Cross-platform asynchronous I/O,17889,2890,17889,platform+asynchronous+io+networking+unix+windows+velociraptors+unicorns+deep-io,GitHub
33,weex,https://github.com/alibaba/weex.git,A framework for building Mobile cross-platform UI,17670,2150,17670,platform+mobile+android+ios+weex+web+sdk,GitHub
34,detectron2,https://github.com/facebookresearch/detectron2.git,"Detectron2 is FAIR's next-generation platform for object detection, segmentation and other visual recognition tasks.",17503,4602,17503,platform,GitHub
35,rancher,https://github.com/rancher/rancher.git,Complete container management platform,17325,2287,17325,platform+rancher+docker+kubernetes+orchestration+cattle+containers,GitHub
36,insomnia,https://github.com/Kong/insomnia.git,"The Open Source API Client and Design Platform for GraphQL, REST and gRPC",17151,1074,17151,platform+electron-app+rest-api+api-client+curl+http-client+graphql+api-design+api+grpc,GitHub
37,TDengine,https://github.com/taosdata/TDengine.git,An open-source big data platform designed and optimized for the Internet of Things (IoT).,15805,3983,15805,platform+iot+bigdata+time-series+database+industrial-iot+connected-vehicles+full-stack+monitoring,GitHub
38,p5.js,https://github.com/processing/p5.js.git,"p5.js is a client-side JS platform that empowers artists, designers, students, and anyone to learn to code and express themselves creatively on the web. It is based on the core principles of Processing. http://twitter.com/p5xjs —",15800,2453,15800,platform+javascript+graphics+education+learning+art+design+sound+html,GitHub
39,mars,https://github.com/Tencent/mars.git,Mars is a cross-platform network component  developed by WeChat.,15633,3263,15633,platform+cross-platform+log+network+wechat,GitHub
40,cocos2d-x,https://github.com/cocos2d/cocos2d-x.git,"Cocos2d-x is a suite of open-source, cross-platform, game-development tools used by millions of developers all over the world.",15377,6957,15377,platform+cocos2d+cocos2d-x+game-engine+c-plus-plus+lua+metal+android+ios+linx+windows,GitHub
41,MagicMirror,https://github.com/MichMich/MagicMirror.git,"MagicMirror² is an open source modular smart mirror platform. With a growing list of installable modules, the MagicMirror² allows you to convert your hallway or bathroom mirror into your personal assistant.",15154,3650,15154,platform+magicmirror+javascript+raspberry-pi+smarthome+mirror+domotics,GitHub
42,yoga,https://github.com/facebook/yoga.git,Yoga is a cross-platform layout engine which implements Flexbox. Follow https://twitter.com/yogalayout for updates.,14525,1206,14525,platform,GitHub
43,expo,https://github.com/expo/expo.git,"An open-source platform for making universal native apps with React. Expo runs on Android, iOS, and the web.",14213,2625,14213,platform+mobile+expo+native+web+universal+react+android+ios+app-framework+web-framework+native-apps,GitHub
44,jaeger,https://github.com/jaegertracing/jaeger.git,"CNCF Jaeger, a Distributed Tracing Platform",14005,1667,14005,platform+distributed-tracing+opentracing+jaeger+cncf+hacktoberfest,GitHub
45,saleor,https://github.com/mirumee/saleor.git,"A modular, high performance, headless e-commerce platform built with Python, GraphQL, Django, and React.",13718,3920,13718,platform+python+e-commerce+django+storefront+store+commerce+shop+ecommerce-storefront+ecommerce+cart+ecommerce-platform+react+pwa+graphql+headless+headless-ecommerce+headless-commerce+hacktoberfest+multichannel,GitHub
46,fyne,https://github.com/fyne-io/fyne.git,Cross platform GUI in Go inspired by Material Design,13655,721,13655,platform+golang+gui+cross-platform+go+fyne+theme+hacktoberfest,GitHub
47,http-api-design,https://github.com/interagent/http-api-design.git,HTTP API design guide extracted from work on the Heroku Platform API,13492,1073,13492,platform,GitHub
48,mediapipe,https://github.com/google/mediapipe.git,"Cross-platform, customizable ML solutions for live and streaming media.",13343,2668,13343,platform+mediapipe+c-plus-plus+computer-vision+deep-learning+android+video-processing+audio-processing+mobile-development+machine-learning+inference+graph-framework+graph-based+calculator+framework+pipeline-framework+stream-processing+perception,GitHub
49,ILSpy,https://github.com/icsharpcode/ILSpy.git,".NET Decompiler with support for PDB generation, ReadyToRun, Metadata (&more) - cross-platform!",13147,2555,13147,platform+decompiler+decompiler-engine+c-sharp+dotnet+dotnetcore+mono+unity+pdb+ilspy+decompile,GitHub
50,packer,https://github.com/hashicorp/packer.git,Packer is a tool for creating identical machine images for multiple platforms from a single source configuration.,13049,3152,13049,platform,GitHub
51,backstage,https://github.com/backstage/backstage.git,Backstage is an open platform for building developer portals,12602,1450,12602,platform+infrastructure+dx+developer-experience+developer-portal+service-catalog+microservices+cncf+backstage,GitHub
52,brook,https://github.com/txthinking/brook.git,Brook is a cross-platform strong encryption and not detectable proxy. Zero-Configuration. Brook 是一个跨平台的强加密无特征的代理软件. 零配置.,12478,2285,12478,platform+brook+proxy+vpn+shadowsocks+linux+macos+ios+android+windows+socks+socks5+zero-configuration+cross-platform+encryption,GitHub
53,intellij-community,https://github.com/JetBrains/intellij-community.git,IntelliJ IDEA Community Edition & IntelliJ Platform,12424,4118,12424,platform+intellij+intellij-platform+ide+code-editor+intellij-community,GitHub
54,ncnn,https://github.com/Tencent/ncnn.git,ncnn is a high-performance neural network inference framework optimized for the mobile platform,12327,3008,12327,platform+inference+high-preformance+simd+arm-neon+deep-learning+artificial-intelligence+android+ios+ncnn+vulkan+neural-network+caffe+mxnet+pytorch+onnx+darknet+tensorflow+mlir+keras+riscv,GitHub
55,Arduino,https://github.com/arduino/Arduino.git,open-source electronics platform,11955,6917,11955,platform+arduino+ide+tooling-team,GitHub
56,kitty,https://github.com/kovidgoyal/kitty.git,"Cross-platform, fast, feature-rich, GPU based terminal",11902,600,11902,platform+terminal-emulators+opengl+terminfo+vt100+python+c+terminal,GitHub
57,ivideo,https://github.com/phobal/ivideo.git,一个可以观看国内主流视频平台所有视频的客户端（Mac、Windows、Linux） A client that can watch video of domestic(China) mainstream video platform,11873,3291,11873,platform,GitHub
58,directus,https://github.com/directus/directus.git,Open-Source Data Platform 🐰  — Directus wraps any SQL database with a real-time GraphQL+REST API and an intuitive app for non-technical users.,11741,1234,11741,platform+api+cms+graphql+content+app+database+dashboard+vue+sqlite+mysql+postgresql+mssql+oracle+directus+headless+realtime+node+headless-cms,GitHub
59,Avalonia,https://github.com/AvaloniaUI/Avalonia.git,A cross platform XAML framework for .NET,11712,1052,11712,platform+c-sharp+xaml+multi-platform+gui+avalonia+avaloniaui+cross-platform+dotnet+dotnetcore+user-interface+csharp+cross-platform-xaml,GitHub
60,Files,https://github.com/files-community/Files.git,A modern file manager that pushes the boundaries of the platform.,11650,619,11650,platform+uwp+fluent-design+xaml+file-manager+winui+files+windows+csharp+windows-10+windows-11+fluent,GitHub
61,Marlin,https://github.com/MarlinFirmware/Marlin.git,Marlin is an optimized firmware for RepRap 3D printers based on the Arduino platform. | Many commercial 3D printers come with Marlin installed. Check with your vendor if you need source code for your specific machine.,11585,14759,11585,platform+reprap+arduino+3d-printing+firmware+avr+atmel+stmicro+esp32,GitHub
62,tink,https://github.com/google/tink.git,"Tink is a multi-language, cross-platform, open source library that provides cryptographic APIs that are secure, easy to use correctly, and hard(er) to misuse.",11501,988,11501,platform+cryptography+java+cpp+go+objc+crypto+security+javascript,GitHub
63,reaction,https://github.com/reactioncommerce/reaction.git,"Reaction is an API-first, headless commerce platform built using Node.js, React, GraphQL. Deployed via Docker and Kubernetes. ",11397,2081,11397,platform+ecommerce-platform+ecommerce+commerce+reactioncommerce+e-commerce+javascript+cart+shop+storefront+marketplace+docker+mongodb+headless+graphql+reaction-action,GitHub
64,spree,https://github.com/spree/spree.git,"Open Source multi-language/multi-currency/multi-store E-commerce platform for Ruby on Rails with a modern UX, PWA frontend, REST API, GraphQL, several official extensions, and 3rd party integrations. ",11359,4764,11359,platform+spree+spreecommerce+rails+ecommerce+e-commerce+ruby+rubyonrails+cart+headless-commerce+ecommerce-platform+store+shop+spree-commerce+graphql,GitHub
65,VasSonic,https://github.com/Tencent/VasSonic.git,"VasSonic is a lightweight and high-performance Hybrid framework developed by tencent VAS team, which is intended to speed up the first screen of websites working on Android and iOS platform. ",11358,1554,11358,platform+hybrid+android-sdk+ios-sdk+h5+web+webview,GitHub
66,eos,https://github.com/EOSIO/eos.git,An open source smart contract platform ,11233,3636,11233,platform+eosio,GitHub
67,cube.js,https://github.com/cube-js/cube.js.git,📊 Cube.js — Open-Source Analytical API Platform,10873,1049,10873,platform+chart+analytics+serverless+microservice+javascript+cube+postgresql+mysql+athena+nodejs+hive+presto+spark+bigquery,GitHub
68,maui,https://github.com/dotnet/maui.git,".NET MAUI is the .NET Multi-platform App UI, a framework for building native device applications spanning mobile, tablet, and desktop.",10825,454,10825,platform+dotnet+maui+multi-platform+user-interface+microsoft,GitHub
69,keepassxc,https://github.com/keepassxreboot/keepassxc.git,KeePassXC is a cross-platform community-driven port of the Windows application “Keepass Password Safe”.,10806,878,10806,platform+keepassxc+keepass+password-manager+linux+windows+cross-platform+yubikey+macos+password+security+privacy,GitHub
70,proton-native,https://github.com/kusti8/proton-native.git,A React environment for cross platform desktop apps,10755,379,10755,platform+react+js+desktop+cross-platform+native,GitHub
71,october,https://github.com/octobercms/october.git,Self-hosted CMS platform based on the Laravel PHP Framework.,10695,2265,10695,platform+cms+framework+cmf+laravel+php+platform+octobercms+backend+cms-platform,GitHub
72,v2ray-core,https://github.com/v2fly/v2ray-core.git,A platform for building proxies to bypass network restrictions.,10673,1771,10673,platform+proxy+network+socks5+shadowsocks+v2ray+vmess+vless+v2fly+anticensorship+vpn+trojan+tunnel,GitHub
73,postal,https://github.com/postalserver/postal.git,✉️ A fully featured open source mail delivery platform for incoming & outgoing e-mail,10640,738,10640,platform+ruby+mail+smtp+postal+mail-server,GitHub
74,botkit,https://github.com/howdyai/botkit.git,"Botkit is an open source developer tool for building chat bots, apps and custom integrations for major messaging platforms.",10408,2275,10408,platform+botkit+botkit-studio+microsoft-bot-framework+bot-application+slack+facebook+twilio+cisco-spark+bots+sms+conversational-ui+workplacebyfacebook+microsoft-teams+bot+facebook-bot+facebook-messenger+glitch+making-bots+web-bot+chatbot,GitHub
75,micro,https://github.com/micro/micro.git,Micro is a cloud platform for API development,10271,903,10271,platform+micro+cloud+m3o+mu+microkernel,GitHub
76,keeweb,https://github.com/keeweb/keeweb.git,Free cross-platform password manager compatible with KeePass,10222,891,10222,platform+keeweb+keepass+security+password-manager+password+electron+javascript,GitHub
77,fpm,https://github.com/jordansissel/fpm.git,"Effing package management! Build packages for multiple platforms (deb, rpm, etc) with great ease and sanity.",10059,1007,10059,platform+packaging,GitHub
78,iced,https://github.com/hecrj/iced.git,"A cross-platform GUI library for Rust, inspired by Elm",9969,440,9969,platform+gui+graphics+rust+elm+interface+widget+widgets+toolkit+user-interface+renderer-agnostic,GitHub
79,libui,https://github.com/andlabs/libui.git,Simple and portable (but not inflexible) GUI library in C that uses the native GUI technologies of each platform it supports.,9960,593,9960,platform,GitHub
80,mlflow,https://github.com/mlflow/mlflow.git,Open source platform for the machine learning lifecycle,9899,2193,9899,platform+machine-learning+ai+ml+mlflow+apache-spark+model-management,GitHub
81,ungit,https://github.com/FredrikNoren/ungit.git,The easiest way to use git. On any platform. Anywhere.,9730,646,9730,platform+ungit+javascript+git+nodejs+ui,GitHub
82,openresty,https://github.com/openresty/openresty.git,High Performance Web Platform Based on Nginx and LuaJIT,9727,1296,9727,platform,GitHub
83,bgfx,https://github.com/bkaradzic/bgfx.git,"Cross-platform, graphics API agnostic, ""Bring Your Own Engine/Framework"" style rendering library.",9646,1476,9646,platform+engine+rendering+graphics+directx+vulkan+metal+opengl+d3d9+d3d11+d3d12+gles+webgl+glfw+sdl+gamedev+directx-11+directx-12+vulkan-api+webgpu+dawn,GitHub
84,PeerTube,https://github.com/Chocobozzz/PeerTube.git,ActivityPub-federated video streaming platform using P2P directly in your web browser,9545,1020,9545,platform+video+decentralized+p2p+angular+activitypub,GitHub
85,cutter,https://github.com/rizinorg/cutter.git,Free and Open Source Reverse Engineering Platform powered by rizin,9535,762,9535,platform+cutter+gui+reverse-engineering+security,GitHub
86,ceph,https://github.com/ceph/ceph.git,"Ceph is a distributed object, block, and file storage platform ",9482,4455,9482,platform,GitHub
87,botpress,https://github.com/botpress/botpress.git,"🤖 The Conversational Platform with built-in language understanding (NLU), beautiful graphical interface and Dialog Manager (DM). Easily create chatbots and AI-based virtual assistants.",9306,1234,9306,platform+chatbot+bot+botpress+bot-framework+sdk+bot-builder+microsoft-bot-framework+botkit+botkit-bots+bots+conversation+conversational-ui+nlu+nlp+luis+machine-learning-algorithms+chatbot-framework+chatbots+conversational-ai,GitHub
88,react-native-firebase,https://github.com/invertase/react-native-firebase.git,🔥 A well-tested feature-rich modular Firebase implementation for React Native. Supports both iOS & Android platforms for all Firebase services.,9296,1834,9296,platform+firebase+analytics+android+ios+database+push-notifications+react-native+fcm+react-native-app+react+auth+javascript+realtime-database+web-sdk+storage+transactions+remote-config+firestore+crashlytics+react-hooks,GitHub
89,Tars,https://github.com/TarsCloud/Tars.git,"Tars is a high-performance RPC framework based on name service and Tars protocol, also integrated administration platform, and implemented hosting-service via flexible schedule.",9172,2079,9172,platform+rpc-framework+high-performance+high-availability+microservice+tars-foundation+tars,GitHub
90,wcdb,https://github.com/Tencent/wcdb.git,WCDB is a cross-platform database framework developed by WeChat.,9092,1202,9092,platform+database+android+ios+wechat+mobile+mobile-database+sqlcipher+sqlite,GitHub
91,thingsboard,https://github.com/thingsboard/thingsboard.git,"Open-source IoT Platform - Device management, data collection, processing and visualization.",9008,2974,9008,platform+dashboard+visualization+iot+iot-platform+mqtt+coap+middleware+netty+akka+websockets+grpc+widgets+thingsboard+iot-analytics+spark+fleet-tracking+smart-farm+platform+kafka,GitHub
92,coreutils,https://github.com/uutils/coreutils.git,Cross-platform Rust rewrite of the GNU coreutils,8812,701,8812,platform+rust+coreutils+gnu-coreutils+busybox+cross-platform+command-line-tool,GitHub
93,esp8266_deauther,https://github.com/SpacehuhnTech/esp8266_deauther.git,Affordable WiFi hacking platform for testing and learning,8779,1929,8779,platform+wifi+arduino+attack+esp8266+deauth+hack+deauther+board+scanning+hacktoberfest,GitHub
94,flipper,https://github.com/facebook/flipper.git,A desktop debugging platform for mobile developers.,8764,642,8764,platform,GitHub
95,robomongo,https://github.com/Studio3T/robomongo.git,Native cross-platform MongoDB management tool,8673,728,8673,platform,GitHub
96,webview,https://github.com/webview/webview.git,Tiny cross-platform webview library for C/C++/Golang. Uses WebKit (Gtk/Cocoa) and Edge (Windows),8672,667,8672,platform+webui+webkit+golang+c+single-header-lib+cgo,GitHub
