,full_name,link,description,stars,forks,watchers,keywords,source
46,DFDTOKEN,https://github.com/Cryptoaj-hack/DFDTOKEN.git,"Decentralized Finance (DeFi) Development Services & Solutions Eliminate the role of a middleman by availing decentralized finance (DEFI) development services & solutions. Get access to the major financial services through a blockchain network and experience the benefits of automation, a higher level of security, anonymity, interoperability, and transparency.  Our wide range of services include   Market-Making Consulting We take immense efforts in establishing financial markets that understand the customers’ proprietary algorithms. We aim at improving the access of liquidity to investors and democratize the whole system. We render customized features according to the customer’s expected return on investment.   Decentralized Crypto Banking We ensure a frictionless user experience by facilitating the direct transfer of value between the involved parties supported by decentralization. Our ready-to-launch white-label mobile payment apps render a variety of services such as wallet integration, value holding, and detailed transactional analysis.   Defi Lottery System Development We provide a no-loss lottery system that benefits our participants completely. We take steps to eliminate the custodianship of the pooled capital. We permit investing your capital in other related dapps and distribute the rewards in form of a major share of the interest earned to a winner randomly selected by the smart contracts. We assure the regular flow of returns.   Derivatives Over Defi Platform We ensure seamless access to derivatives and maximize your earning potential by many notches. by establishing robust dapps, we enable traders to hedge their portfolio of investments and minimize risks by directly engaging with their peers through a democratic platform. We are experts in derivatives market-making and Dapp platform development.   Decentralized Fund Management All your crypto assets will be managed to yield high performance in a decentralized exchange through smart control and management. with in-depth experience in investment exchanges along with our strong knowledge of defi, we render our services at low fees and avoid potential risks.   Defi Insurance System Development We ensure that there are no risks present in our smart contract. With our robust provision of insurance services, we assure you that there will be no chance of uncontrollable liquidity requests. We contain futuristic risks, uncertainties, and emergencies through lucrative insurance deals.   Defi Yield Farming Platform Development Yield farming refers to the technique through which one can earn more cryptocurrencies by using his existing holding of cryptos. Liquidity providers play a vital role in the success of yield farming. They stake their assets in liquidity pools and facilitate trading in cryptos by creating a market.   Defi Staking Platform Development Defi staking involves a mechanism where crypto assets will be staked on a supported wallet or exchange and passive income will be earned. The rewards can be calculated based on the quantity of staked assets, the staking duration, inflation rate, and the network issuance rate.   Defi Lending Platform Development Defi lending platforms have been made popular by the likes of aave and compound. The basic features of a defi lending platform include flash loan facilities, a fiat payment gateway, and an exclusive margin trading facility, the advantages of defi lending include high immutability, better transparency, quick access, and resistance to transaction censorship.   Defi Smart Contract Development One of the pivotal reasons behind the tremendous growth of defi services is due to the heavy investments made in robust defi smart contract development. They are created with the solidity programming language, highly encrypted, and automates the tasks to be executed based on certain pre-set terms and conditions.   Defi Dapp Development Defi Dapp development plays a critical role to avoid the risk of a central point of failure. They are highly secure when compared to centralized applications due to the absence of a central authority.   Defi Tokens Development Defi tokens development has played a critical role in boosting the growth of decentralized applications. Their value is currently higher than bitcoin. it has a huge trading volume and has garnered a lot of attention from the mainstream crowd in recent times.   Defi Dex Development Like Uniswap Uniswap is one of the leading defi projects being undertaken. It is an innovative venture as it utilizes incentivized liquidity pools instead of regular order books. every user of uni swap will is rewarded with a percentage of fees incurred on every ethereum transaction for rendering liquidity to the system.   Defi Wallet Development Traders will have complete control over their funds through defi wallet development without the interference of any authorities in the system. Supreme security is guaranteed for users without any compromise. By supplying customized private keys to every user, there will not be any chances for any loss of data.   DeFi Marketing Services To assist DeFi projects gain user engagement, marketing services are indispensable.From drafting white paper, video and content marketing, to legal advisory, marketing and community management, our DeFi marketing and consulting services are well-versed to get the job done.   DeFi Synthetic Asset Development Synthetic assets derive their value from underlying assets and derivatives which are essentially smart contracts. In DeFi, Synthetic assets have gained acclaim as they involve low risks and little chance of price fluctuations. Users can easily invest, trade, and own assets with no hassles.   DeFi Solutions For Ecommerce Streamline your Ecommerce business with DeFi and its pragmatic tools. With DeFi’s solutions , benefits like omission of intermediaries, faster shipping, supply chain management, and real time tracking can be integrated with your Ecommerce business, increasing profits.   DeFi Tokenization Development Tokenization Development is one of the pragmatic solutions DeFi offers. Users can now convert inoperative and underutilized assets into great profits by simply tokenizing their assets. With our DeFi tokenization, avail of ERC20, ERC721 & NFT tokens for your assets.   DeFi Crowdfunding Platform Development Although a relatively new sector, DeFi crowdfunding has become the go-to mode of aggregating funds to support businesses and start-ups. Our DeFi Crowdfunding platform services come with additional benefits in the likes of tax benefits, instant approval, fundraising calendars and more.   DeFi Real Estate Platform Development DeFi has revolutionized the ways of real estate management. Now real estate owners and investors, with the help of blockchain based tokens, can make property investment seamless and manageable. With fractional ownership, financial inclusivity is now possible.   DeFi ICO Development One of the leading fundraising methods, DeFi ICO services are distinguished. Creating utile tokens, community management, escalating coin value, and launching projects with diligence & guidance from market analysts and blockchain experts is inclusive of our ICO Development.   DeFi Exchange Development Offering users a plethora of apparent benefits, DEXs are the prized innovation of DeFi. Offering high-end security, durable liquidity, complete anonymity and financial inclusivity, DEXs make trading and transacting crypto accessible and lucrative for crypto enthusiasts.   DeFi Protocol Like Yearn. Finance Yearn. Finance offers the best APY the market has to offer by referring to popular exchanges. This protocol offers its users the best yields in a highly secure network. With in-built smart contracts and an open source code, it supports a range of Stablecoins offering huge returns.   DeFi Protocol Like AAve The DeFi protocol Aave offers crypto traders a robust platform for lending and borrowing of crypto for which they earn high interests. The highlight feature of Aave - Flash loans and flexible interest rates make it a profitable platform for crypto traders.   DeFi Exchange Like 1inch 1inch exchange now has the reputation of being the DEX offering users the lowest slippage. As an aggregator, 1inch connects several exchanges to one platform in a non-custodial ecosystem. With governance and farming features, trading on 1inch remains prominent.",4,1,4,blockchain+coin,GitHub
47,suchcoin,https://github.com/suchaimi/suchcoin.git,Suchaimi cryptocurrency coin blockchain,3,1,3,blockchain+coin+crypto+blockchain+suchcoin+coin+cryptocurrency,GitHub
48,MIB-Coin,https://github.com/mosbc/MIB-Coin.git,Blockchain Network MOS Coin,3,0,3,blockchain+coin,GitHub
49,ethereum_ico,https://github.com/JoshBroomberg/ethereum_ico.git,Contracts to perform an Initial Coin Offering on the Ethereum Blockchain,3,0,3,blockchain+coin,GitHub
50,Planumex-Blockchain,https://github.com/Planumex/Planumex-Blockchain.git,The Planumex Blockchain and PEX coin is a hard fork of the NEXT Blockchain and the NXT coin. The Planumex Blockchain and PEX coin bridge the gap between interplanetary commerce. Creating the first cryptocurrency that will inter-operate between planets and be the primary currency for commerce. Become apart of the revolution and join Planumex today!,3,1,3,blockchain+coin+java+npm+js+c-plus-plus+c-sharp+html+objective-c+nodejs+api,GitHub
51,moonShot,https://github.com/bcnmy/moonShot.git,"Gamified version of option trading on blockchain. Where user place a bet on a coin's price and bet if the price will go up or down, if after certain duration his prediction comes true he wins some tokens.",3,0,3,blockchain+coin,GitHub
52,HiCoin,https://github.com/BlockchainLabs/HiCoin.git,"Start Of Efficient Digital HIcoin HICoin has many features and advantages.  It has an ideal HIcoin to transfer anywhere, anytime money to friends HIcoin is a Pos(proof-of-stake) Internet currency that enables instant, near-zero cost payments to anyone in the world.    HIcoin’s Key Features HIcoin features faster transaction confirmation times and improved storage efficiency than the leading math-based currency.  HIcoin is open-source; its design is public, nobody owns or controls HIcoin and everyone can take part.  HIcoin network does not require the use of large-scale, specialized hardware operations.  HIcoin is far more energy-efficient than traditional digital currency networks.  Wallet encryption allows you to secure your wallet, so that you can view transactions and your account balance, but are required to enter your password before spending HIcoins.  This provides protection from wallet-stealing viruses and trojans as well as a sanity check before sending payments. Look for hicoin in more point of sale applications soon with recent addition to merchant services.    SPECIFICATIONS   / POS INTEREST: PoS (Proof-of-Stake) 5% yearly (from non-reserved wallet balance)  / ALGORITHM: Scrypt  / SYMBOL: XHI  / BLOCK TIME: 60 sec  / LAST POW BLOCK: 3600  / TOTAL MONEY SUPPLY: 10,000,000,000 XHI  / BLOCK REWARD: BLOCKS 1-10 (premine): each 1,000,000,000 XHI / BLOCKS 11~3600: 100 XHI  / COIN POS AGE: Min. 1 hour / Max. unlimited  / RPC PORT: 35288 (testnet 45288 )  / P2P PORT: 35289 (testnet 45289 )  / Coin maturity: 100 confirmations | KEY FEATURES Security and control over your money secure against the attacks other digital currencies face due to their reliability on large-scale mining operations  Fast international payments HICoin is the ideal digital currency for face to face transactions and all applications that value speed.  1% compound interest yearly You will earn rewards every few days, depending on the size of your holdings, adding up to 5% interest yearly.  FEATURES MESSAGES Big Miners Back Bitcoin Classic As Scaling Debate Evolves Following a months-long debate on how best to scale the bitcoin network to accommodate a greater number of transactions, bitcoin mining firms are voicing their support for a newly introduced proposal called Bitcoin Classic. Though a new entrant to the debate, Bitcoin Classic so far has the support of bitcoin developers including former Bitcoin Core  Read More admin  01/19/2016  - 5 Must-Read Excerpts from the UK Government’s Blockchain Report “The progress of mankind is marked by the rise of new technologies and the human ingenuity they unlock.” That’s the glowing foreword to a new report on blockchain and distributed ledger tech issued by the UK government’s Chief Scientific Adviser this week. Taking a positive outlook on the emerging technology, the document recommends a broad government initiative to develop and demonstrate blockchain and distributed  Read More admin  01/19/2016  - Is Digital Asset’s $50 Million Funding a Blow to Bitcoin? VCs Weigh In Founded in 2014 and led by CEO and ex-JP Morgan executive Blythe Masters, Digital Asset Holdings had long been the subject of speculation that suggested that, despite its high-profile leadership, the startup was having difficulties raising an initial funding round. All that uncertainty was laid to rest last week, however, when Digital Asset silenced rumors  Read More admin  01/12/2016  0 Our Team Project Manager TIMO SPRAY  Business Development JASON LANE  Art Director TONYA GARCIA  Account Manager ASHLEY SUJAN It Has An Ideal Hicoin To Transfer Anywhere, Anytime Money To Friends. WALLET ",3,5,3,blockchain+coin,GitHub
53,Parser,https://github.com/Colored-Coins/Parser.git,Colored-Coins blockchain parser,2,12,2,blockchain+coin,GitHub
54,MovingBricks,https://github.com/luchenwei9266/MovingBricks.git,Blockchain Coin!!!!!,2,3,2,blockchain+coin,GitHub
55,vgina,https://github.com/vginacoin/vgina.git,Vgina Coin Blockchain,2,3,2,blockchain+coin,GitHub
56,VerusPay,https://github.com/joliverwestbrook/VerusPay.git,Blockchain-integrated payment gateway for accepting Verus Coin (VRSC) in a WooCommerce ecommerce store,2,9,2,blockchain+coin,GitHub
57,bitcoin-coinflip,https://github.com/petrosagg/bitcoin-coinflip.git,Flip a coin on the Bitcoin Blockchain.,2,2,2,blockchain+coin,GitHub
58,uwucoin,https://github.com/legitnull/uwucoin.git,a proof of stake meme coin with a programmable blockchain written entirely in rust,2,3,2,blockchain+coin+cryptocurrency+uwucoin+memecoin+meme-coin,GitHub
59,OpenBullet,https://github.com/OpenBullet-Coin/OpenBullet.git,Blockchain For OpenBullet Coin,2,0,2,blockchain+coin,GitHub
60,pepegold,https://github.com/pepegoldcoin/pepegold.git,PepeGold Coin Blockchain,2,0,2,blockchain+coin,GitHub
61,go-nano,https://github.com/exgolang/go-nano.git,"Blockchain, cryptocurrency, crypto, coin",2,0,2,blockchain+coin,GitHub
62,ICO-Whitepapers,https://github.com/PyPatel/ICO-Whitepapers.git,This repository contains Initial Coin Offering (ICO) whitepapers of some popular Blockchain companies.,2,2,2,blockchain+coin+icos+ico+blockchain+blockchain-technology+bitcoin+ethereum+ethereum-token+ethereum-contract,GitHub
63,unitycoin,https://github.com/onewed/unitycoin.git,Unity Coin ERC20 token and crowdsale smart contracts for the Ethereum blockchain.,2,2,2,blockchain+coin,GitHub
64,brancoin,https://github.com/BranLiang/brancoin.git,A new blockchain coin name by Bran,2,0,2,blockchain+coin+blockchain+blockchain-demos+blockchain-tutorial+mini-blockchain,GitHub
65,GroCoin,https://github.com/painteau/GroCoin.git,a tiny blockchain for a big coin,2,0,2,blockchain+coin,GitHub
66,blockchain-zion-coin,https://github.com/zion-coin/blockchain-zion-coin.git,The blockchain implementation for zion coin,2,0,2,blockchain+coin,GitHub
67,avo,https://github.com/photonized/avo.git,Blockchain and respective coin from scratch,2,0,2,blockchain+coin,GitHub
68,sj_coin_wallet_xamarin,https://github.com/SoftJourn/sj_coin_wallet_xamarin.git,A very simple wallet application for a smart contract based coin token for Eris(Monax) blockchain server,2,2,2,blockchain+coin,GitHub
69,Dogethereum,https://github.com/sjalq/Dogethereum.git,Sending Dogecoins safely from the Doge coin proper blockchain to an Ethereum coin contract and back. ,2,0,2,blockchain+coin,GitHub
70,ReBurner,https://github.com/S0AndS0/ReBurner.git,Burn Data to the Bitcoin blockchain without lossing your coins.,2,0,2,blockchain+coin,GitHub
71,blockchain-coin-wallet,https://github.com/gurhanPro/blockchain-coin-wallet.git,A blockchain app with crypto coin and wallet,2,0,2,blockchain+coin,GitHub
72,Sai-coin,https://github.com/mrsaicharan1/Sai-coin.git,A cryptocurrency coin being built on Nebula's blockchain,2,1,2,blockchain+coin,GitHub
73,web3-domain-manager,https://github.com/aquiladev/web3-domain-manager.git,"Create and manage blockchain domains (.crypto, .coin, .wallet, .bitcoin, .x, .888, .nft, .dao, .blockchain)",2,2,2,blockchain+coin+ethereum+blockchain+domain+domain-name+crypto+nft+bitcoin+888+x+wallet+dao+coin,GitHub
74,skicoin,https://github.com/realcaesar/skicoin.git,"Skicoin is a mineable Scrypt crypto coin, a coin which use the litecoin protocol and blockchain technology.",2,1,2,blockchain+coin,GitHub
75,CoinFlipper-Dapp,https://github.com/shankermjj/CoinFlipper-Dapp.git,"Coin Flipper is a Ethereum game where the user bet some amount and flips the coin, if the coin turns even the user wins amount otherwise the usercan  loses the bet, All the Background is done at Smart Contract using Solidity Programming, Truffle site for Project Setup[Migrate/Delopy/Test in Private Blockchain] + Front-end(HTML+JS+CSS)",2,2,2,blockchain+coin,GitHub
76,monero-tracing,https://github.com/erwa/monero-tracing.git,"For CMU 17703 Cryptocurrencies, Blockchains, and Applications final project on alt coin traceability",2,1,2,blockchain+coin,GitHub
77,opcoin,https://github.com/OmkarPh/opcoin.git,"Op coin, A completely decentralized blockchain with cryptocurrency built from scratch ",2,0,2,blockchain+coin,GitHub
78,btcutils,https://github.com/frz-dev/btcutils.git,"Scripts and tools for Bitcoin, Colored Coins and other Bitcoin-based blockchains",2,1,2,blockchain+coin,GitHub
79,bhuwan-coin,https://github.com/bhuwanadhikari/bhuwan-coin.git,A Crypto-Currency from which one can send and receive bhuwan-coins. It is built with python and Flask is used to interact with blockchain.,2,0,2,blockchain+coin,GitHub
80,Decentralized-Trustless-Network,https://github.com/CryptoHideCoin/Decentralized-Trustless-Network.git,"Crypto Hide Coin is a special blockchain built in order to stimulate the activity of community. Tools, Utilities, Application Clients, Applications for Masternodes, Source code and the like",2,1,2,blockchain+coin,GitHub
81,EmaratCoinProject,https://github.com/emaratcoin/EmaratCoinProject.git,The Emarat Coin is a Superior Distributed Decentralized Ledger Blockchain Technology to serve as a digital-age payment system. EmaratCoin is the future of decentralized economy of world specially Middle East and Asia,2,1,2,blockchain+coin+cryptocurrency+blockchain+cryptography+emaratcoin,GitHub
82,coin,https://github.com/shankermjj/coin.git,"Sha-Coin[Helps to  Creating & Sending Coins/Tokens for any Purpose like an Issuing Tickets in Cricket Matches/Cinema Hall/ Conferences etc.,] is a Basically Solidity Programming[SmartContract] for Creating Ethereum Dapp which includes ,Truffle FrameWork[Migrate/Delopy/Test in Private Blockchain] and  Front-end(HTML+JS+CSS) ",2,0,2,blockchain+coin,GitHub
83,GoVoteNetwork,https://github.com/oldmonitor/GoVoteNetwork.git,"Implemented in Golang, a blockchain P2P network for encrypted voting transaction recods. Each participating voter has one wallet (public & private key pair). The organizer starts the first node, and distributes vote coins to connecting peers. When peer casts its vote, a coin is sent back to organizer and vote data is added to the chain. ",2,0,2,blockchain+coin,GitHub
84,Distributed-Blockchain-,https://github.com/harshalpatil199529/Distributed-Blockchain-.git,"GROUP INFORMATION:  Number     Member names         UFID  1        Niraja Ganpule      17451951  2        Harshal Patil       55528581  Project Description   We have successfully implemented the Distributed Bitcoin protocol and displayed the bitcoin transaction details on a webpage using the Phoenix framework.  We have tested it for 100 nodes.   The concepts implemented are: 1. Distributed Architecture for nodes    Each node is a GenServer that contains the state in the format:    a. Blockchain        Each node must have the same copy of the blockchain at all times.      If there is any change in the blockchain made by any node, it must be advertised to all other nodes and all nodes must synchronize to this    b. Wallet      Each node has its own wallet with the Bitcoin address, private key and balance.     In this design, all the nodes can participate in transactions and also mine blocks.  2. Implemented a simulation with at least 100 participants in which coins get mined and transacted.  3. Implemented a web interface using the Phoenix that allows access to the ongoing simulation using a web browser     The Phoenix webpage dynamically displays the following     a. Transactions from sender to receiver and the amount sent as and when the transaction happens    b. Once all the transactions are mined by a node and a block is added to the blockchain, the balance of every node is calculated by traversing the            blockchain using the wallet address of node and displayed    c. A graph of balance of each node versus the nodes id is plotted to show variation of balance between nodes after transactions are mined  4.  Mining/transacting scenarios include random selection of sender and receiver nodes.     Other features are :  . Bitcoin transaction . Bitcoin wallet . Bitcoin mining or Proof of work . Creating the bitcoin address as done by the real Bitcoin System based on steps described here   https://en.bitcoin.it/wiki/Technical_background_of_version_1_Bitcoin_addresses . Creating a blockchain with a genesis block, adding a new block to the blockchain         after a node mines pending transactions,checking authenticity of     the blockchain and      maintaining synchronization between successive blocks. . Signing transactions with private key of the wallet and verifying them with public       key at any point for security and authentication . Finding the balance of a user wallet by the same user or any other user using only       the current blockchain as input. Here, computations are made based   on transactions  recorded in every block in the blockchain to find the balance of a particular user.    Execution Instructions  To compile and run a demonstration of the built-in functionalities in the application : In the main folder bitcoinmine, on the commandline, run the command  : mix phx.server Go to your favorite browser and type URL http://localhost:4000  To change number of nodes, in lib/start.ex in the main function, change the value of numnodes variable to whatever you want to set it to To change number of transactions per block, in lib/start.ex in the handle/1 function, change the value of numtransact variable to whatever you want to set it to",2,2,2,blockchain+coin,GitHub
85,GenTo2,https://github.com/tayupov/GenTo2.git,"GenTo is a platform that facilitates creating Decentralized Autonomous Organizations (DAOs). It creates user-defined Smart Contracts and automatically deploys them to the blockchain. The platform allows running an Initial Coin Offering for a DAO and implements basic governance mechanisms, that enable token holders to decide over the usage of the organizsation's funds. The application assets are deployed to the InterPlanetary File System. All of this without the need to write a single line of code!",2,0,2,blockchain+coin,GitHub
86,Alcyone,https://github.com/Acylone08/Alcyone.git,"I am a hard working, loyal and dedicated fellow with a passion for literature. For about 7 years, I worked as a freelancer, through platforms like Elance (later UP Work), where I wrote a variety of materials, ranging from quantum physics college papers to romantic novels. I am one of the early adopters of Bitcoin and I have followed the crypto industry for almost a decade. Recently, I have decided to get out of anonymity and I started collaborating with cryptocurrency based platforms such as Coin Info News, where I write reviews about Blockchain projects that are currently undergoing ICO. I also started my own blog, where I cover multiple topics: interviews, reviews, tutorials, trading analysis, Founder at Blockchain & Cryptocurrency Development Hub and Founder at Academia Luminis, ghost writer, Market Speculator, invested in neuralink and other technologies aiding health, qualified mechatronics engineer apprentice.",2,1,2,blockchain+coin,GitHub
87,caesiumcoin,https://github.com/caesiumcoin/caesiumcoin.git,"A cryptocurrency (or crypto currency) is a digital asset designed to work as a medium of exchange that uses cryptography to secure its transactions, to control the creation of additional units, and to verify the transfer of assets. Cryptocurrencies are classified as a subset of digital currencies and are also classified as a subset of alternative currencies and virtual currencies.  Caesiumcoin, created in 2018, is decentralized cryptocurrency. Numerous other cryptocurrencies have been created. These are frequently called altcoins, as a blend of alternative coin. Caesiumcoin and its derivatives use decentralized control as opposed to centralized electronic money and central banking systems. The decentralized control is related to the use of caesiumcoin's blockchain transaction database in the role of a distributed ledger.",2,0,2,blockchain+coin,GitHub
