,full_name,link,description,stars,forks,watchers,keywords,source
0,snowplow,https://github.com/snowplow/snowplow.git,"The enterprise-grade behavioral data engine (web, mobile, server-side, webhooks), running cloud-natively on AWS and GCP",5792,1188,5792,cloud+enterprise+snowplow+analytics+data+data-pipeline+data-collection+product-analytics+marketing-analytics+snowplow-pipeline+snowplow-events,GitHub
1,erda,https://github.com/erda-project/erda.git,An enterprise-grade Cloud-Native application platform for Kubernetes.,1573,185,1573,cloud+enterprise+go+golang+containers+devops+cmp+apm+kubernetes+docker+ci-cd+microservice,GitHub
2,Azure-Sentinel,https://github.com/Azure/Azure-Sentinel.git,Cloud-native SIEM for intelligent security analytics for your entire enterprise.,1480,1026,1480,cloud+enterprise+sample-code+cybersecurity,GitHub
3,pipeline,https://github.com/banzaicloud/pipeline.git,"Banzai Cloud Pipeline is a solution-oriented application platform which allows enterprises to develop, deploy and securely scale container-based applications in multi- and hybrid-cloud environments.",1425,152,1425,cloud+enterprise+kubernetes+microservices+containers+monitoring+golang+container-management,GitHub
4,kyma,https://github.com/kyma-project/kyma.git,A flexible and easy way to connect and extend enterprise applications in a cloud-native world,1190,346,1190,cloud+enterprise+kubernetes+cloud-native+knative,GitHub
5,Microsoft-Integration-and-Azure-Stencils-Pack-for-Visio,https://github.com/sandroasp/Microsoft-Integration-and-Azure-Stencils-Pack-for-Visio.git,"Microsoft Integration, Azure, Power Platform, Office 365 and much more Stencils Pack it’s a Visio package that contains fully resizable Visio shapes (symbols/icons) that will help you to visually represent On-premise, Cloud or Hybrid Integration and Enterprise architectures scenarios (BizTalk Server, API Management, Logic Apps, Service Bus, Event Hub…), solutions diagrams and features or systems that use Microsoft Azure and related cloud and on-premises technologies in Visio 2016/2013",868,279,868,cloud+enterprise+stencils+stencils-pack+mis-azure+support-stencils+systems-logo-stencils+sap-stencils+integration+azure+power-platform+office-365+visio+resizable-visio-shapes+shapes+mis-devices-stencils+office,GitHub
6,one,https://github.com/OpenNebula/one.git,The open source Cloud & Edge Computing Platform bringing real freedom to your Enterprise Cloud 🚀,789,372,789,cloud+enterprise+opennebula+ruby+c-plus-plus+xml-rpc+javascript+scons+rubygems,GitHub
7,impress,https://github.com/metarhia/impress.git,Enterprise application server for Node.js and Metarhia private cloud ⚡,714,92,714,cloud+enterprise+nodejs+application-server+metarhia+api+websocket+cloud+scalable+server+cluster+enterprise+rpc+architecture,GitHub
8,nodejs-storage,https://github.com/googleapis/nodejs-storage.git,"Node.js client for Google Cloud Storage: unified object storage for developers and enterprises, from live data serving to data analytics/ML to data archiving.",646,289,646,cloud+enterprise+nodejs+storage,GitHub
9,humpback,https://github.com/humpback/humpback.git,Quickly build lightweight docker cloud for enterprise user.,380,88,380,cloud+enterprise+docker+container-cluster+container-management+docker-cloud,GitHub
10,nodejs-bigquery,https://github.com/googleapis/nodejs-bigquery.git,"Node.js client for Google Cloud BigQuery: A fast, economical and fully-managed enterprise data warehouse for large-scale data analytics.",306,156,306,cloud+enterprise+nodejs+database+sql+bigquery,GitHub
11,zfsbackup-go,https://github.com/someone1/zfsbackup-go.git,"Backup ZFS snapshots to cloud storage such as Google, Amazon, Azure, etc. Built with the enterprise in mind.",194,28,194,cloud+enterprise+golang+zfs+backup+cloud-storage,GitHub
12,spring-content,https://github.com/paulcwarren/spring-content.git,Cloud-Native Storage and Enterprise Content Services (ECMS) for Spring,158,41,158,cloud+enterprise+spring-data+solr+content-management+content+headless-cms+content-services+spring+spring-content,GitHub
13,terraform-azurerm-caf-enterprise-scale,https://github.com/Azure/terraform-azurerm-caf-enterprise-scale.git,Terraform Module for Cloud Adoption Framework Enterprise-scale,122,84,122,cloud+enterprise+terraform+azure+enterprise-scale,GitHub
14,TAC,https://github.com/TraceabilityChain/TAC.git,"We hope to, basing on the technology of block chain, adopting unique non-tamper distributed ledger characteristics of the block chain, build the traceability cloud platform, solve the enterprise's difficulties in information traceability",121,20,121,cloud+enterprise,GitHub
15,go-tfe,https://github.com/hashicorp/go-tfe.git,Terraform Cloud/Enterprise API Client/SDK in Golang,116,54,116,cloud+enterprise+terraform-enterprise+tfe+sdk+terraform-cloud+cloud,GitHub
16,terraform-provider-ec,https://github.com/elastic/terraform-provider-ec.git,Terraform provider for the Elasticsearch Service and Elastic Cloud Enterprise,90,39,90,cloud+enterprise+elastic+elasticsearch-service,GitHub
17,jakarta.ee,https://github.com/jakartaee/jakarta.ee.git,"Jakarta EE is the future of cloud native Java. Jakarta EE open source software drives cloud native innovation, modernizes enterprise applications and protects investments in Java EE.",86,67,86,cloud+enterprise+webdev+hugo,GitHub
18,cloud-pak,https://github.com/IBM/cloud-pak.git,"IBM Cloud Paks are enterprise-grade containerized software by combining container images with enterprise capabilities for deployment in production use cases with integrations for management and lifecycle operations. Features such as pre-configured deployments based on product expertise, rolling upgrades, rollbacks, security/vulnerability testing and integrations with management services for logging, monitoring, metering and security provide control and management of production workloads.",82,92,82,cloud+enterprise,GitHub
19,cloudinformationmodel,https://github.com/cloudinformationmodel/cloudinformationmodel.git,"CIM provides an open, standards-based specification for connecting enterprise products to achieve interoperability.  CIM reduces barriers to cross-product integration and extend the value proposition of our ecosystems by adopting and contributing to the Cloud Information Model. To learn more about the Cloud Information Model check out our page.",70,20,70,cloud+enterprise,GitHub
20,jumbune,https://github.com/Impetus/jumbune.git,"Jumbune, an open source BigData APM & Data Quality Management Platform for Data Clouds. Enterprise feature offering is available at http://jumbune.com. More details of open source offering are at,",66,28,66,cloud+enterprise+hadoop-cluster+yarn+yarn-hadoop-cluster+optimization-framework+hadoop+hadoop-monitor+data-quality+data-analysis+devops-tools+developer-tools+monitoring-tool+hadoop-monitoring+cluster-monitoring+apm+aiops,GitHub
21,MCW-Enterprise-ready-cloud,https://github.com/microsoft/MCW-Enterprise-ready-cloud.git,MCW Enterprise-ready cloud,63,68,63,cloud+enterprise,GitHub
22,verrazzano,https://github.com/verrazzano/verrazzano.git,Enterprise Container Platform for deploying cloud-native and traditional applications in multi-cloud and hybrid environments.,63,14,63,cloud+enterprise+kubernetes+containers,GitHub
23,docker-logging-plugin,https://github.com/splunk/docker-logging-plugin.git,Splunk Connect for Docker is a Docker logging plugin that allows docker containers to send their logs directly to Splunk Enterprise or a Splunk Cloud deployment.,58,25,58,cloud+enterprise+docker-plugin+splunk-driver,GitHub
24,terraform-provider-tfe,https://github.com/hashicorp/terraform-provider-tfe.git,"Official Terraform Cloud/Enterprise provider, maintained by HashiCorp. Provision Terraform Cloud or Terraform Enterprise - with Terraform!",56,59,56,cloud+enterprise+terraform+terraform-provider+terraform-enterprise+tfe-provider+terraform-cloud+cloud,GitHub
25,TeamCloud,https://github.com/microsoft/TeamCloud.git,Enable enterprise development teams to create secure compliant cloud development environments.,55,18,55,cloud+enterprise,GitHub
26,Avere,https://github.com/Azure/Avere.git,Avere vFXT resources for an enterprise-scale NFS clustered file system built for the cloud.,54,26,54,cloud+enterprise,GitHub
27,agorakube,https://github.com/ilkilab/agorakube.git,Agorakube is a Certified Kubernetes Distribution built on top of CNCF ecosystem that provides an enterprise grade solution following best practices to manage a conformant Kubernetes cluster for on-premise and public cloud providers.,54,37,54,cloud+enterprise+kubernetes+cloud+ansible+containers+k8s+orchestration+docker+containerd+cni+france+agorakube+high-availability+kubernetes-cluster+k8s-cluster+systemd+cncf+k8s-conformance+certified,GitHub
28,nodejs-scheduler,https://github.com/googleapis/nodejs-scheduler.git,"Node.js client for Google Cloud Scheduler: Fully managed, enterprise-grade scheduler",47,10,47,cloud+enterprise,GitHub
29,ansible-elastic-cloud-enterprise,https://github.com/elastic/ansible-elastic-cloud-enterprise.git,Ansible playbooks for Elastic Cloud Enterprise (ECE),43,40,43,cloud+enterprise,GitHub
30,development,https://github.com/servicecatalog/development.git,An Enterprise-ready Cloud Services Management Software,38,28,38,cloud+enterprise+servicecatalog+hybrid-cloud+marketplace+subscriptions+billing+provisioning+glassfish,GitHub
31,project-tracking-system,https://github.com/SelimHorri/project-tracking-system.git,"Enterprise project tracker written with Spring Boot, integration with Angular for better modern frontend, pushed to Docker Hub, deployed on Cloud and much more...",38,7,38,cloud+enterprise+java+spring-boot+jpa-hibernate+rest-api+thymeleaf+heroku-app+spring-security+spring-mvc+sms-api+email-api+docker+mysql+swagger+restful-api+git+javadoc+javamailsender+maven+kubernates,GitHub
32,sbt-sam,https://github.com/dnvriend/sbt-sam.git,Plugin and library to create enterprise-cloud applications leveraging SBT and the SAM component model,35,4,35,cloud+enterprise,GitHub
33,docs-v2,https://github.com/influxdata/docs-v2.git,"InfluxData Documentation that covers InfluxDB Cloud, InfluxDB OSS 2.0, InfluxDB OSS 1.x, InfluxDB Enterprise, Telegraf, Chronograf, Kapacitor, and Flux.",33,105,33,cloud+enterprise,GitHub
34,spingo,https://github.com/homedepot/spingo.git,A collection of Terraform and bash scripts to setup an enterprise-grade Spinnaker deployment on Google Cloud Platform,32,9,32,cloud+enterprise+spinnaker+terraform+gcp,GitHub
35,tfx,https://github.com/straubt1/tfx.git,TFx is a standalone CLI for Terraform Cloud and Terraform Enterprise.,29,2,29,cloud+enterprise,GitHub
36,oscm,https://github.com/servicecatalog/oscm.git,An Enterprise-ready Cloud Services Management Software.,27,10,27,cloud+enterprise+service-catalog+hybrid-cloud+marketplace+subscription+tomee,GitHub
37,cloud-espm-cloud-native,https://github.com/SAP-samples/cloud-espm-cloud-native.git,Enterprise Sales and Procurement Model (ESPM) Cloud Native is a project that showcases how an application can be made resilient by implementing resilience design patterns. This application is developed using Spring Boot framework and can be deployed locally as well as on SAP Cloud Platform Cloud Foundry environment.,24,22,24,cloud+enterprise+sample+sample-code+microservices-architecture+springboot+sap-cloud-platform+cloud-foundry,GitHub
38,eclcli,https://github.com/nttcom/eclcli.git,Enterprise Cloud CLI,23,14,23,cloud+enterprise,GitHub
39,github-enterprise-cloud-configuration,https://github.com/dduzgun-security/github-enterprise-cloud-configuration.git,Guideline of best practices to follow to configure Github Enterprise Cloud in a secure way.,21,3,21,cloud+enterprise+github-enterprise+cloud+configuration,GitHub
40,terracreds,https://github.com/tonedefdev/terracreds.git,A Terraform Cloud/Enterprise credentials helper,19,4,19,cloud+enterprise+terraform+devops-tools+devops+security-tools+credential-manager+credential-storage+credentials-helper,GitHub
41,arunna,https://github.com/arunna/arunna.git,"Arunna is a solution that creates a place where social media, networking and community collaborate. You and your customers can have the option to connect and share content online. Our platform gives the opportunity for both hosted community and white label self hosted sites to take the advantage to express themselves. With arunna, small organization to large enterprises can build brand awareness, engage their community and much more. That's what we call connecting the clouds...",19,7,19,cloud+enterprise,GitHub
42,spring-cloud-chapter,https://github.com/hengboy/spring-cloud-chapter.git,"Spring Cloud Enterprise Core Technology, Corresponding to the Special Subject Source of the Brief Book ""Spring Cloud Core Technology""",15,6,15,cloud+enterprise,GitHub
43,Splunk_TA_paloalto,https://github.com/PaloAltoNetworks/Splunk_TA_paloalto.git,The Palo Alto Networks Add-on for Splunk allows a Splunk® Enterprise or Splunk Cloud administrator to collect data from Palo Alto Networks Next-Generation Firewall devices and Advanced Endpoint Protection.,15,14,15,cloud+enterprise+palo-alto-networks+splunk-enterprise+endpoint-protection+splunk+firewall+splunk-cloud-administrator,GitHub
44,SenseWire,https://github.com/i-cuboid/SenseWire.git,"SenseWire is an enterprise-grade IoT platform built on a modern cloud-native architecture and a fully customizable feature set. Based on flexible microservices, SenseWire easily adapts to almost any need and application. It scales from a tiny start-up to a massive corporation and supports advanced deployment models for multi cloud IoT solutions.",15,16,15,cloud+enterprise+iot-platform+iot-cloud+iot+iiot,GitHub
45,terraform-provider-rediscloud,https://github.com/RedisLabs/terraform-provider-rediscloud.git,"Terraform Redis Enterprise Cloud Pro Provider: Deploy, update, and manage Redis Enterprise Cloud Pro databases as code through HashiCorp Terraform",14,7,14,cloud+enterprise+redis+redis-enterprise-cloud+terraform+databases+terraform-provider+terraform-provider-rediscloud,GitHub
46,cloud-sdk-go,https://github.com/elastic/cloud-sdk-go.git,Go client library for Elastic Cloud and Elastic Cloud Enterprise (ECE),13,25,13,cloud+enterprise,GitHub
47,ece-support-diagnostics,https://github.com/elastic/ece-support-diagnostics.git,Support diagnostics utility for Elastic Cloud Enterprise (ECE),12,17,12,cloud+enterprise,GitHub
48,thevelox,https://github.com/SparkAndAssociates/thevelox.git,Enterprise Cloud Storage Solution,11,5,11,cloud+enterprise,GitHub
49,linguisticreview,https://github.com/microsoft/linguisticreview.git,A repo to share Microsoft Cloud & Enterprise product screenshots and collect community feedback,11,14,11,cloud+enterprise,GitHub
50,a7,https://github.com/BouyguesTelecom/a7.git,Enterprise-grade cloud-native solution for serving immutable static assets,11,6,11,cloud+enterprise+cdn+cdnjs+unpkg+jsdeliver+assets+a7,GitHub
51,cloud-run-for-anthos-labs,https://github.com/subfuzion/cloud-run-for-anthos-labs.git,Learn about the serverless experience for your enterprise applications with Cloud Run for Anthos,11,11,11,cloud+enterprise+knative+knative-serving+microservices+kubernetes+google-cloud+cloudrun+anthos+demos,GitHub
52,github-self-hosted-runners,https://github.com/dduzgun-security/github-self-hosted-runners.git,Guideline of best practices to follow to configure Github Enterprise Cloud self-hosted runners in a secure way.,11,2,11,cloud+enterprise+runner+github-actions+security,GitHub
53,terraform-provider-ccloud,https://github.com/sapcc/terraform-provider-ccloud.git,Terraform for Converged Cloud Enterprise Edition extended OpenStack Services,10,5,10,cloud+enterprise+terraform+limes+openstack+kubernikus,GitHub
54,google-deployment-guide,https://github.com/DSPN/google-deployment-guide.git,DataStax Enterprise (DSE) Deployment Guide for Google Cloud Platform (GCP),9,12,9,cloud+enterprise,GitHub
55,event-mesh-client-java-samples,https://github.com/SAP-samples/event-mesh-client-java-samples.git,Samples based on the Java messaging client for SAP Event Mesh (formerly Enterprise Messaging in SAP Cloud Platform).,9,12,9,cloud+enterprise+sample+sample-code+java+sap-cloud-platform+enterprise-messenging+sap-event-mesh,GitHub
56,MulVAL,https://github.com/westlifezs/MulVAL.git,"MulVAL is an cybersecurity reasoning engine that can be applied on top of multiple contexts (cloud, IoT, enterprise network, etc )",9,7,9,cloud+enterprise,GitHub
57,github-audit-log-monitoring-add-on-for-splunk,https://github.com/splunk/github-audit-log-monitoring-add-on-for-splunk.git,Splunk Add-On to collect audit log events from Github Enterprise Cloud,9,3,9,cloud+enterprise,GitHub
58,choreos_middleware,https://github.com/choreos/choreos_middleware.git,"CHOReOS will implement service middleware support, effectively enabling the deployment of adaptable, QoS-aware choreographies in the ULS Future Internet, integrating and further evolving the latest research advances in the area of Grid and Cloud computing, Enterprise Service Bus (ESB), and pervasive computing. Service-oriented middleware enables adaptable choreographies over ESB-based middleware, Grids, Clouds, and technologies for the Internet of Things, thus overcoming scalability and heterogeneity issues of the Future Internet.",9,6,9,cloud+enterprise,GitHub
59,dse-multi-cloud-demo,https://github.com/justinbreese/dse-multi-cloud-demo.git,How to deploy to multiple public clouds with DataStax Enterprise (DSE),8,9,8,cloud+enterprise,GitHub
60,event-mesh-client-nodejs-samples,https://github.com/SAP-samples/event-mesh-client-nodejs-samples.git,Samples based on the Node.js messaging client for SAP Event Mesh (formerly Enterprise Messaging in SAP Cloud Platform).,8,11,8,cloud+enterprise+sample+sample-code+node-js+sap-cloud-platform+enterprise-messaging+sap-event-mesh,GitHub
61,splunk-connect-for-snmp-traps,https://github.com/splunk/splunk-connect-for-snmp-traps.git,This project connects SNMP Trap sending source to Splunk Enterprise and Splunk Enterprise Cloud,8,0,8,cloud+enterprise,GitHub
62,sansfor509,https://github.com/dlcowen/sansfor509.git,Public script from SANS FOR509 Enterprise Cloud Incident Response,8,0,8,cloud+enterprise,GitHub
63,Ecommerce-Shopping,https://github.com/waleedarafa/Ecommerce-Shopping.git,"Ecommerce-Shopping is enterprise open-source extensible ecommerce architecture. With Core backend using JAVA Spring (Spring boot) REST APIs & Frontend using Bootstrap/AngularUI AngularJS fro frontend. Fully support AWS inflashstructure (EC2, Database RDS, Mail service SES, etc) to run system on the cloud inflashstructure.",8,13,8,cloud+enterprise,GitHub
64,eurynome-cloud,https://github.com/herodotus-cloud/eurynome-cloud.git,"Platform for developing micro service architecture and service capability in enterprise technology. Based on Spring Boot 2.5.3, Spring Cloud 2020.0.3, Spring Cloud Alibaba 2021.1 and Nacos 2.0.3, it follows the programming idea of springboot and is highly modular and configurable.   🔝 🔝 Click a star to follow the update!",8,2,8,cloud+enterprise+spring-cloud+nacos+spring-boot+eurynome-cloud+sentinel+skywalking+microservice+postgresql+elk+spring-cloud-gateway+spring-cloud-alibaba+spring-cloud-oauth2+jetcache+seata+knife4j+spring-data-jpa+spring-security-oauth2+docker+kubernates+spring-security-jwt,GitHub
65,github-actions-allow-list-as-code-action,https://github.com/ActionsDesk/github-actions-allow-list-as-code-action.git,Automate GitHub Actions allow list for GitHub Enterprise Cloud accounts,7,2,7,cloud+enterprise+github-enterprise-cloud+github-actions+automation+policy-as-code,GitHub
66,charts,https://github.com/kubemq-io/charts.git,"KubeMQ is a Cloud Native, enterprise grade message broker for distributed services architecture",7,3,7,cloud+enterprise+helm+helm-charts+kubernetes+message-queue+message-broker,GitHub
67,ASP-NET-Core-Cloud-ready-Enterprise-Web-Application-Development,https://github.com/PacktPublishing/ASP-NET-Core-Cloud-ready-Enterprise-Web-Application-Development.git,"ASP.NET Core: Cloud-ready, Enterprise Web Application Development, published by Packt",7,2,7,cloud+enterprise,GitHub
68,appscan-automation-framework,https://github.com/HCL-TECH-SOFTWARE/appscan-automation-framework.git,A framework for interacting with HCL AppScan on Cloud and HCL AppScan Enterprise,7,2,7,cloud+enterprise+appscan+appscan-enterprise+hcl-appscan+cloud,GitHub
69,tfe-ado-project,https://github.com/straubt1/tfe-ado-project.git,Code for creating an AzDO Project and integrating it with Terraform Enterprise or Terraform Cloud,7,0,7,cloud+enterprise,GitHub
