,full_name,link,description,stars,forks,watchers,keywords,source
1005,airports-db,https://github.com/wboyer/airports-db.git,"A database and API for world airports, including typeahead search by name and IATA code.",1,1,1,airport,GitHub
1006,flight-companion,https://github.com/mindsers/flight-companion.git,"iOS app realized for school project. This app save flights for pilot (time, airports...). Use geolocation. ",1,0,1,airport,GitHub
1007,NY-Airports-,https://github.com/alisq786/NY-Airports-.git,This project attempt to analyze the efficiency and flights' delay data for NY's 3 airports,1,1,1,airport,GitHub
1008,AirTrafficControl,https://github.com/JorgeZapatero/AirTrafficControl.git,Processing project. Visualizing looping notes from Track 2 of Brian Eno's Music for Airports,1,0,1,airport,GitHub
1009,django-aviation,https://github.com/bfolks2/django-aviation.git,Django/Python and Ember.js project.  Gets and formats live data for airports across the world,1,0,1,airport,GitHub
1010,Flights_Routes_Map,https://github.com/bar-katz/Flights_Routes_Map.git,"Python code to draw flights routes from a specified airport, using Openflights Flight Route Database ",1,0,1,airport+openflights+basemap,GitHub
1011,AirportScan,https://github.com/Krongrath/AirportScan.git,A multi-view convolutional neural networks (MVCNN) to detect threats in airport body scan images,1,1,1,airport,GitHub
1012,Heathrow_temperature_data,https://github.com/SmilingMountain/Heathrow_temperature_data.git,Some statistics using monthly temperature data from Heathrow airport since 1948,1,0,1,airport,GitHub
1013,Airplane-Takeoff-Times,https://github.com/allenmm/Airplane-Takeoff-Times.git,Python project that schedules aircraft takeoff time slots at an airport.,1,0,1,airport,GitHub
1014,Online-Smart-Parking-Reservation-System,https://github.com/ksheeraj1161/Online-Smart-Parking-Reservation-System.git,"Building a website for managing traffic at the parking lots in Malls, airports etc",1,0,1,airport,GitHub
1015,YULAirportScrape,https://github.com/deoliang/YULAirportScrape.git,Node.js script that scrapes the Montréal–Pierre Elliott Trudeau International Airport(YUL) website for destinations,1,0,1,airport,GitHub
1016,MyAirports,https://github.com/Chrissie/MyAirports.git,"iOS app with local database, containing all airports in the world",1,0,1,airport,GitHub
1017,genetic-algorithm,https://github.com/brosiak/genetic-algorithm.git,Modifcation of genetic algorithm for scheduling approaches and departures on airports.,1,0,1,airport,GitHub
1018,aviation-weather-app,https://github.com/cptartur/aviation-weather-app.git,"Simple website built using flask, allowing for checking aviation weather for airports around the world.",1,0,1,airport+aviation-weather,GitHub
1019,ADSB-Alert,https://github.com/PapaChain/ADSB-Alert.git,I live near an airport. Creating a python program to alert when airplanes are near me :(,1,0,1,airport,GitHub
1020,airports-osm,https://github.com/thomasdubdub/airports-osm.git,Extract and visualize airport data (ex: runway geocoordinates) from OpenStreetMap with Python tools,1,0,1,airport+python+openstreetmap+openstreetmap-data+osm+osm-data+osmnx+airport+runway+airports+maps,GitHub
1021,leaflet-flights-map,https://github.com/Nimrod51/leaflet-flights-map.git,"A leaflet map to visualize departing and incoming flights from Schiphol Airport, Amsterdam",1,1,1,airport,GitHub
1022,metar-grabber-sinatra,https://github.com/amrit/metar-grabber-sinatra.git,A Sinatra web app that retrieves the latest raw METAR for supported airports around the world.  ,1,0,1,airport,GitHub
1023,PebblePilotTZ,https://github.com/geoffeg/PebblePilotTZ.git,"A Pebble watchface to display time, METARS for the closest airports and Zulu time.",1,0,1,airport,GitHub
1024,OfflineAirportApi,https://github.com/jitinsharma/OfflineAirportApi.git,Android library to get nearest Airport from latitude/longitude without webservice call,1,0,1,airport+android+airport+airline+sdk-android,GitHub
1025,KASE,https://github.com/jaypatel512/KASE.git,Xplane 10 and 11 Scenery for KASE - Aspen - Pitkin County Airport,1,0,1,airport,GitHub
1026,Forecasting-Passenger-Flow,https://github.com/xiaojia-guo/Forecasting-Passenger-Flow.git,"Code for the paper ""Forecasting Airport Passenger Flows Using Real-Time Data and Machine Learning""",1,1,1,airport,GitHub
1027,Arrivals-Departures-Digital-Signage,https://github.com/BroadcastVision/Arrivals-Departures-Digital-Signage.git,Display Arrival and Departures from any airport. Flightaware and forecast.io API,1,1,1,airport,GitHub
1028,YXEAirportScrape,https://github.com/deoliang/YXEAirportScrape.git,Node.js script that scrapes the Saskatoon John G. Diefenbaker International Airport(YXE) website for destinations,1,0,1,airport,GitHub
1029,YYCAirportScrape,https://github.com/deoliang/YYCAirportScrape.git,Node.js script that scrapes the Calgary International Airport(YYC) website for destinations,1,0,1,airport,GitHub
1030,YQRAirportScrape,https://github.com/deoliang/YQRAirportScrape.git,Node.js script that scrapes the Regina International Airport(YQR) website for destinations,1,0,1,airport,GitHub
1031,YYTAirportScrape,https://github.com/deoliang/YYTAirportScrape.git,Node.js script that scrapes the St. John's International Airport(YYT) website for destinations,1,0,1,airport,GitHub
1032,FlightBoard,https://github.com/sndpgautm/FlightBoard.git,A simple flight board application for showing arrival and departues information of user selected airports.,1,1,1,airport,GitHub
1033,Airports-List,https://github.com/Vertisize-Solutions/Airports-List.git,"This is a list of aiports with data such as airport codes, names, city and country.",1,0,1,airport+airport+airports+master-lists+data+database+json,GitHub
1034,AirportOperations2021,https://github.com/DanielLubigTUD/AirportOperations2021.git,Data repository for the course 'Airport Operations' in summer semester 2021,1,0,1,airport,GitHub
1035,svo-tg,https://github.com/Flaiers/svo-tg.git,This is an HR platform based on telegram frontend for new airport employees,1,0,1,airport,GitHub
1036,SmartWindow,https://github.com/witrdotnet/SmartWindow.git,Smart Window is a mobile application for passengers in the airport #hackandfly - June 2015,1,0,1,airport,GitHub
1037,airportwifi,https://github.com/una/airportwifi.git,"Airport wifi reviews, so you can check before committing to arriving early",1,0,1,airport,GitHub
1038,Boston_Logan_Domestic_Flight_Analysis_and_Visualization,https://github.com/mtduman/Boston_Logan_Domestic_Flight_Analysis_and_Visualization.git,Python; Boston-Logan International Airport Domestic Flight Analysis and Visualization from 1987 to 2008,1,1,1,airport,GitHub
1039,SYDap,https://github.com/henare/SYDap.git,A half-baked twitter bot that announces comings and goings at SYD airport,1,0,1,airport,GitHub
1040,Airport-Arbitrage,https://github.com/srujayk/Airport-Arbitrage.git,✈️  Calculates discrepancies in airport currency exchanges. Coded for the CS50x Coding Contest 2016.,1,0,1,airport,GitHub
1041,yangon-flights-bot,https://github.com/the-robot/yangon-flights-bot.git,Facebook's messenger bot that shows flights of Yangon International Airport,1,1,1,airport+facebook-messenger-bot+yangon+flight-information+airport,GitHub
1042,onda_android,https://github.com/imadarchid/onda_android.git,A cordova/ionic to check flights status in Moroccan Airports (ONDA),1,0,1,airport,GitHub
1043,YHZAirportScrape,https://github.com/deoliang/YHZAirportScrape.git,Node.js script that scrapes the Halifax Stanfield International Airport(YHZ) website for destinations,1,0,1,airport,GitHub
1044,faa_airport_boardings,https://github.com/storydrivendatasets/faa_airport_boardings.git,Wrangling the spreadsheets from FAA Passenger Boarding (Enplanement) for U.S. Airports (commercial),1,0,1,airport,GitHub
1045,InfoQR,https://github.com/the-rebooted-coder/InfoQR.git,App Created for Smart India Hackathon with the Problem Statement via Airports Authority of India,1,0,1,airport,GitHub
1046,rpi3-airport,https://github.com/bohemianoid/rpi3-airport.git,Ansible Playbooks for Provisioning Apple AirPort Services on a Raspberry Pi 3,1,0,1,airport,GitHub
1047,airport_force_net.sh,https://github.com/paridin/airport_force_net.sh.git,Force the airport to establish the connection with your WiFi prefered,1,0,1,airport,GitHub
1048,cs546,https://github.com/epolixa/cs546.git,"Repository for CS-546 final project, an airport and airline tracking website",1,1,1,airport,GitHub
1049,Chinook,https://github.com/mchernos/Chinook.git,Calgary International Airport weather data and R code to analyze change in Chinook frequency,1,0,1,airport,GitHub
1050,Airport-to-the-Door,https://github.com/samelliott89/Airport-to-the-Door.git,Airport to the Door (A project we worked on with Qantas),1,0,1,airport,GitHub
1051,YQBAirportScrape,https://github.com/deoliang/YQBAirportScrape.git,Node.js script that scrapes the Québec City Jean Lesage International Airport(YQB) website for destinations,1,0,1,airport,GitHub
1052,msfs-etnl,https://github.com/Michaelvsk/msfs-etnl.git,Recreation of airport Rostock-Laage (ICAO: ETNL) for Microsoft Flight Simulator (2020),1,0,1,airport,GitHub
1053,Airport-FCC,https://github.com/adelevie/Airport-FCC.git,MapBasic program which imports the Federal Communication Commission's Airport Database,1,0,1,airport,GitHub
1054,jetDB,https://github.com/esemeniuc/jetDB.git,"An airport, flight, and booking management system built with C++ and Postgres",1,0,1,airport,GitHub
1055,ignite-gate-visualization,https://github.com/azure-appdev-tsp-ncr/ignite-gate-visualization.git,hackathon samples for creating an airport gate visualization using CosmosDB & Power BI,1,0,1,airport,GitHub
1056,AirportSimulator,https://github.com/ktch7069/AirportSimulator.git,This console project simulate the traffic of an airport control tower,1,0,1,airport,GitHub
1057,SFO-landings-EDA-and-LSTM,https://github.com/Len-X/SFO-landings-EDA-and-LSTM.git,EDA of Air Traffic Landings Statistics at San Francisco International Airport (SFO) and LSTM predictions,1,0,1,airport,GitHub
1058,vfrManual-android,https://github.com/ibisek/vfrManual-android.git,"Android app to summarise basic information about airports in CZ, SK, AT, DE & PL",1,0,1,airport,GitHub
1059,AirportProject,https://github.com/yelkamel/AirportProject.git,"C# .NET project manage an airport, MVVM pattern, XAML and WPF #2014",1,0,1,airport,GitHub
1060,crystal_metar_parser,https://github.com/akwiatkowski/crystal_metar_parser.git,Parse METAR weather string. METAR standard is used by every major airport.,1,1,1,airport,GitHub
1061,airport,https://github.com/EricEve/airport.git,Source code for the Airport Game used as an illustration of the adv3Lite Manual,1,0,1,airport,GitHub
1062,airport,https://github.com/jamesjoshuahill/airport.git,Makers Academy week 3 test - Object oriented model of airports and planes,1,1,1,airport,GitHub
1063,Mariposa-Yosemite,https://github.com/StevenFrost/Mariposa-Yosemite.git,Mariposa-Yosemite airport scene for the computer graphics module at the Univeristy of Nottingham.,1,0,1,airport,GitHub
1064,dnschat,https://github.com/hannorein/dnschat.git,Small client to send e-mails via DNS queries (useful behind airport/airplane paywalls),1,0,1,airport,GitHub
1065,Python-Airports-Project,https://github.com/ValygarS/Python-Airports-Project.git,University project in Python: allows to get most economical route between 5 airports,1,0,1,airport,GitHub
1066,usairports,https://github.com/cookm2/usairports.git,A choropleth map of US airport density by state and presence of air traffic control towers. ,1,0,1,airport,GitHub
1067,flightRouteshub.io,https://github.com/malhotra5/flightRoutes.github.io.git,A visualization tool that helps pinpoint airports and their air routes. ,1,0,1,airport,GitHub
1068,YLWAirportScrape,https://github.com/deoliang/YLWAirportScrape.git,Node.js script that scrapes the Kelowna International Airport(YLW) website for destinations,1,0,1,airport,GitHub
1069,earthquake_map,https://github.com/tarunc98/earthquake_map.git,gui interface for map showing earthquakes and airport data with additional features,1,0,1,airport,GitHub
1070,ramp_hand_signals_recognition,https://github.com/astromaf/ramp_hand_signals_recognition.git,"Real-time visual recognition of ""aircraft ramp hand-signals"" applied to UAVs into airport ground operations.",1,0,1,airport,GitHub
1071,business-aviation-top-routes-dashboard,https://github.com/clemensweisgram/business-aviation-top-routes-dashboard.git,Dashboard shows most frequently flown routes per selected aircraft and airport,1,0,1,airport,GitHub
1072,vehicleareo,https://github.com/Lucio-Dos-Santos/vehicleareo.git,This script spawns a panto when you press E in the airport parking lot.,1,1,1,airport,GitHub
1073,tempelhof-tour,https://github.com/thalespessoa/tempelhof-tour.git,App to browse reviews about the tour to Tempelhof Airport in Berlin,1,0,1,airport+java+android+android-architecture-components+pagedlist+room,GitHub
1074,airport-info-ejs,https://github.com/1andee/airport-info-ejs.git,"Lookup METAR, TAF, NOTAM, & airport plates with Node.js + Express.js ✈️ 🌤",1,0,1,airport,GitHub
1075,qgsopenscope,https://github.com/openscope/qgsopenscope.git,A QGIS plugin that adds import/export functions for openScope airports,1,1,1,airport,GitHub
1076,ActionBot_Contact,https://github.com/Rakshith-R/ActionBot_Contact.git,ActionBot Contact is a Contextual AI Chatbot built for Airport Usecases,1,0,1,airport,GitHub
1077,yul-neo4j,https://github.com/sfrechette/yul-neo4j.git,Importing Montreal-Pierre Elliott Trudeau International Airport (YUL) data to Neo4j,1,1,1,airport+neo4j+yul+yul-neo4j+graph-model+graph-database+cypher+airport,GitHub
1078,PLAC,https://github.com/SushantPupneja/PLAC.git,Face Recognition application to provide access to security areas and checkin at airports,1,0,1,airport,GitHub
1079,m2ro-project,https://github.com/MathildeGarrigues/m2ro-project.git,Fixed job scheduling - airport gates management - projet Master 2 recherche opérationnelle,1,1,1,airport,GitHub
1080,Java-Spring-Boot-E-Commerse-,https://github.com/KariSpace/Java-Spring-Boot-E-Commerse-.git,"Java Spring Boot MVC E-commerse (Airport, booking office website, shopping website) using Hibernate, Thymeleaf, PostgreSQL",1,0,1,airport+java+spring-boot+e-commerce+hibernate+postgresql+mvc,GitHub
1081,metropolitan,https://github.com/metro143/metropolitan.git,hotel is good we provide good service and location near by IGI airport  ,1,0,1,airport,GitHub
1082,Airport-Extra-Baggage-Penalty-Minimizer,https://github.com/akshaysharmajs/Airport-Extra-Baggage-Penalty-Minimizer.git,Helps to minimize penalty applied on extra luggage during airport checkIn (using knapsack algorithm) ,1,1,1,airport,GitHub
1083,ulsass,https://github.com/adelevie/ulsass.git,Sybase stored procedures for the ULS antenna structure system. (Calculates glide slope using FCC airport database.),1,0,1,airport,GitHub
1084,airtime,https://github.com/idano/airtime.git,show who's been online on airport for how long per day,1,0,1,airport,GitHub
1085,Ryanair-flight-finder,https://github.com/W95Psp/Ryanair-flight-finder.git,Find flight for specific days from airport near to you (Ryanair only),1,0,1,airport,GitHub
1086,ABMP,https://github.com/Taiwanchaoh/ABMP.git,The Agent Based Modelling Platform for Amazon Prime-Air UAV in Purdue University Airport Airspace,1,0,1,airport,GitHub
1087,AirportObj,https://github.com/mherweg/AirportObj.git,updated airport layouts for Flightgear. ICAO.btg.gz with correct elevations,1,0,1,airport,GitHub
1088,Internet-Watcher,https://github.com/pierresauvignon/Internet-Watcher.git,Watches the Internet connection and restarts Airport if the connection is lost.,1,0,1,airport,GitHub
1089,pygb,https://github.com/naclomi/pygb.git,gameboy emulator written in python because i got bored in an airport,1,0,1,airport,GitHub
1090,AirportDataScience,https://github.com/yilmazvolkan/AirportDataScience.git,Measure and increase the efficiency in the airport by trying new features for passengers.,1,0,1,airport,GitHub
1091,AirportSystems,https://github.com/pgfernandez/AirportSystems.git,"Little demo of airport systems, AODB, BHS and DCS developed in my website www.aeriaa.com",1,0,1,airport+airport-systems+airport+mongodb+nodejs+rabbitmq+demo+bhs+dcs+aodb,GitHub
1092,SeaBreezeData,https://github.com/whundahl/SeaBreezeData.git,"Analyze Sea Breeze Trends in Charleston, SC using local NOAA Airport Data and Python",1,0,1,airport,GitHub
1093,mac-changer,https://github.com/0xAnuj/mac-changer.git,Change MAC Address instantly ! and Enjoy free Wi-fi on airport (LINUX),1,0,1,airport,GitHub
1094,FAA-AVSED-Minecraft-Challenge-2020,https://github.com/Proper-Bandits/FAA-AVSED-Minecraft-Challenge-2020.git,Team Proper Bandits - FAA AVSED Minecraft Airport Design Challenge - NASA Wallops Flight Facility,1,0,1,airport,GitHub
1095,OpenFlightsAPI-SpringBoot,https://github.com/ravishn/OpenFlightsAPI-SpringBoot.git,"SpringBoot application integrated with OpenFlights data to get flights information from airports, airlines and routes",1,0,1,airport+java+spring-boot+h2-database+openflights,GitHub
1096,osmc-config,https://github.com/qbunt/osmc-config.git,Mount-at-boot on a Raspberry Pi for an Airport Extreme drive,1,0,1,airport,GitHub
1097,airports,https://github.com/sethshober/airports.git,airport info from public data set provided by Firebase and some help from Ionic,1,1,1,airport,GitHub
1098,found_it,https://github.com/Messerr/found_it.git,A rails app for users to post found items that have been lost at an airport,1,0,1,airport,GitHub
1099,airport-timezone,https://github.com/donle/airport-timezone.git,The package is used to look for timezone based on airport IATA codes.,1,0,1,airport,GitHub
1100,python-pandas-world-airports,https://github.com/arjun-thakor/python-pandas-world-airports.git,Python program to plot all airports residing around globe using python plotly and pandas libraries.,1,0,1,airport,GitHub
1101,aviation-charts,https://github.com/gavinvangent/aviation-charts.git,"Application to fetch airport charts, manipulate them and make them available for download",1,0,1,airport,GitHub
1102,Binary-Segmentation-of-Large-Scale-3D-Volumes,https://github.com/nwWag/Binary-Segmentation-of-Large-Scale-3D-Volumes.git,This repo implements a 3D segmentation task for an airport baggage dataset.,1,1,1,airport,GitHub
1103,Functional-Programming-Project-1,https://github.com/kris-kandle/Functional-Programming-Project-1.git,Work with Lists in F# and create a solution to an Airport Catalog problem ,1,0,1,airport,GitHub
1104,react-widget-airport,https://github.com/minagawah/react-widget-airport.git,A React widget (UMD library) for Airport animations with flight departures/arrivals.,1,0,1,airport,GitHub
1105,data_engineering,https://github.com/dmatinho/data_engineering.git,"Flight departure delays in Chicago O'Hare airport - The goal of this project was to identify the quantity of delay flights in the six busiest airports in the US. Once we acquired that information we drew the best insights from the six airports and analyse the best practices in each one of them. Finally, we define a extensive list of recommendations to decrease O'Hare airport delays.",1,0,1,airport+of,GitHub
1106,QuadTree-Exercise,https://github.com/RafaelSterzinger/QuadTree-Exercise.git,An implementation of the QuadTree datastructure to find trainstations and airports in a certain radius and also to find e.g. trainstations with X airports in a certain radius.,1,0,1,airport,GitHub
1107,world_of_airports,https://github.com/zsoman/world_of_airports.git,This project is a small Python script which uses a publicly available Cloudant database that contain all airports in the world. The script will find airports sorted by distance in an user defined radius of a latitudinal-longitudinal point.,1,0,1,airport+python+cloudant+cloudant-database+airport+coordinates+longitude+latitude+coordinate-transformation+haversine-formula+haversine-distance,GitHub
1108,Smart-India-Hackathon-17,https://github.com/saba6099/Smart-India-Hackathon-17.git,"Software-cum-hardware solution to regulate the entry of drones into the restricted zones of airports. The solution presented by our team ""Navpravartak"" won the first prize among 58 teams shortlisted by Airports Authority of India as mentioned here.",1,0,1,airport,GitHub
1109,Flight-Sim-Multithreading,https://github.com/embosi97/Flight-Sim-Multithreading.git,"Multithreading project that simulates people arriving at an airport, dealing with airport protocol, boarding the plane, and eventually reaching their destinations. Utilizes semaphore waits and signals along with other Java multithreading method calls.",1,0,1,airport,GitHub
1110,Flight_Tragectory_Simulator,https://github.com/sushansapaliga/Flight_Tragectory_Simulator.git,"In this project, a graphics software system called The OpenGL is used. OpenGL (Open Graphics Library). The project “Flight Trajectory Simulator” shows trajectory path from the initial airport to the selected destination airport.",1,0,1,airport+opengl+flight-trajectory-simulator+airports+codeblocks-ide,GitHub
1111,FIight-Weather-Assistant,https://github.com/jiangguix/FIight-Weather-Assistant.git,"Given the flight number, alternate airport and the time window, Flight-Weather_Assistant Program can provide you the weather condition and temperature of the airport. The weather information is based ADDS TAFs and the temperature information comes from accuweather.com.",1,0,1,airport,GitHub
1112,Airline-routes-and-Flights-around-the-world,https://github.com/AshesisDataMining-2015/Airline-routes-and-Flights-around-the-world.git,This project would explore the relationship between the number of routes passing through an airport and how connected it is to other airports in the world. It uses data from the official website of OpenFlight.      By: Esi Yeenuwa Yeboah,1,0,1,airport,GitHub
1113,FlightManager,https://github.com/anasabau/FlightManager.git,"FlightManager is a Java EE application used to handle airport business such as Airplanes, Flights and Airports. This software is part of Sabau Anastasia and Stoian Dan's bachelor's degree project.",1,0,1,airport,GitHub
1114,Airport-Weather-Service-Java,https://github.com/kennyshittu/Airport-Weather-Service-Java.git,"The Airport Weather Service (AWS) is a REST application for collecting and redistributing meteorological data for a handful of airports. The service provides two distinct interfaces. One is a query interface, used by dozens of client systems to retrieve information such mean temperature and max wind speed. The other is a collector interface used by airports to update meteorological data stored in AWS",1,0,1,airport,GitHub
1115,line-19-passenger-trips,https://github.com/ryanpeterson08/line-19-passenger-trips.git,"Used Mike Bostock's airport d3 map to create similar map, but for passenger trips along a bus route",1,0,1,airport,GitHub
1116,20140103-dailylows,https://github.com/stlpublicradio/20140103-dailylows.git,A project with D3.js to visualize the daily low temperatures at Lambert Airport St. Louis MO,1,0,1,airport,GitHub
1117,always-connected-daemon,https://github.com/mmlindeboom/always-connected-daemon.git,"Checks if you are connected to airport every 20 seconds, and connects you if you are not",1,0,1,airport,GitHub
1118,FlightPlanner,https://github.com/rlammers/FlightPlanner.git,Print flight plan between all NZ airports then back to origin. Shows distance in nautical miles for each leg,1,0,1,airport,GitHub
1119,Travoila,https://github.com/akshatvg/Travoila.git,An application acting as a hub of many features to make your airport travel simpler and more convenient.,1,0,1,airport+travoila+travel+airport+hackathon+lesiure+tourism+web+application+akshatvg+akshat+gupta,GitHub
1120,columbiarideshare,https://github.com/madelinezec/columbiarideshare.git,Columbia Ride Share is for CU community members to create carpools to and from tristate area airports,1,0,1,airport,GitHub
1121,AirBlocker,https://github.com/akaped/AirBlocker.git,A simple shell script to turn off MacOSX Airport when the computer is connected to a network adapter. ,1,0,1,airport,GitHub
1122,itinerary,https://github.com/iloveyii/itinerary.git,Find the shortest path between two airports. Home work for KTH course in 2018 - ID2208 Programming Web-Services,1,0,1,airport,GitHub
1123,METAR-Fetcher,https://github.com/JavaScriptpy/METAR-Fetcher.git,"Fetch METAR data from an airport and logs to the terminal or console, uses CheckWX API for the data.",1,0,1,airport,GitHub
1124,Flight_Planner,https://github.com/shivishivangi/Flight_Planner.git,CS225 Final Project - A flight planner that graphs the shortest path between two airports using flight route databases,1,0,1,airport,GitHub
1125,https_or_proxy,https://github.com/qsun/https_or_proxy.git,a socks5 proxy that tunnel through remote socks5 but bypass HTTPS connections. Ideal for public WIFIs in cafe/airport.                                                                                                                         ,1,1,1,airport,GitHub
1126,caliper,https://github.com/andlum/caliper.git,Demo Webapp that calculates distance (in nautical miles) between American airports and maps it on Google Maps.,1,1,1,airport,GitHub
1127,airport-setup,https://github.com/carolineyyzhu/airport-setup.git,Simulation of an airport facility in which flights are routed and passengers are placed into flights with available seats,1,0,1,airport,GitHub
1128,cph-scraper-api,https://github.com/Jakub41/cph-scraper-api.git,A Ruby on Rails 5 API for scrape the arrivals/departures information from the Copenhagen airport site,1,1,1,airport,GitHub
1129,java-csv-reader,https://github.com/yagianggar/java-csv-reader.git,"Simple script to read CSV file contained of IATA airports, IANA Timezone and generate the SQL update query",1,2,1,airport,GitHub
