,full_name,link,description,stars,forks,watchers,keywords,source
583,rainbond,https://github.com/goodrain/rainbond.git,Cloud-native and easy-to-use application management platform | 云原生且易用的应用管理平台,2718,562,2718,platform+microservice-architecture+cloud-native+kubernetes+devops+hybrid-cloud+multi-cloud+paas+application+saas+service-mesh+cloud-native-applications+microservice-governance,GitHub
584,the_platinum_searcher,https://github.com/monochromegane/the_platinum_searcher.git,A code search tool similar to ack and the_silver_searcher(ag). It supports multi platforms and multi encodings.,2712,137,2712,platform+golang,GitHub
585,monodevelop,https://github.com/mono/monodevelop.git,MonoDevelop is a cross platform .NET IDE,2665,942,2665,platform+monodevelop+c-sharp+dotnet+ide,GitHub
586,mongotron,https://github.com/officert/mongotron.git,Cross platform Mongo DB management,2661,228,2661,platform,GitHub
587,fastpages,https://github.com/fastai/fastpages.git,"An easy to use blogging platform, with enhanced support for Jupyter Notebooks.",2635,590,2635,platform+data-science+jekyll-blog+actions+jupyter+jupyter-notebooks+fastai+literate-programming+visualization+github-pages+python+jupyter-lab+nbdev+visualization-tools+jekyll,GitHub
588,KestrelHttpServer,https://github.com/aspnet/KestrelHttpServer.git,[Archived] A cross platform web server for ASP.NET Core. Project moved to https://github.com/aspnet/AspNetCore,2630,536,2630,platform+aspnet-product,GitHub
589,pinax,https://github.com/pinax/pinax.git,a Django-based platform for rapidly developing websites,2603,464,2603,platform,GitHub
590,GreenDroid,https://github.com/cyrilmottier/GreenDroid.git,GreenDroid is a development library for the Android platform. It makes UI developments easier and consistent through your applications.,2601,916,2601,platform,GitHub
591,bottom,https://github.com/ClementTsang/bottom.git,Yet another cross-platform graphical process/system monitor.,2586,62,2586,platform+top+terminal+cli+tui+monitoring+cross-platform+bottom+btm,GitHub
592,ehForwarderBot,https://github.com/ehForwarderBot/ehForwarderBot.git,An extensible message tunneling chat bot framework. Delivers messages to and from multiple platforms and remotely control your accounts.,2586,255,2586,platform+chat-bot+chatbot+tunnel-bot+chat-tunneling+framework+eh-forwarder-bot+python-3,GitHub
593,yue,https://github.com/yue/yue.git,A library for creating native cross-platform GUI apps,2585,122,2585,platform,GitHub
594,artipub,https://github.com/crawlab-team/artipub.git,Article publishing platform that automatically distributes your articles to various media channels,2568,410,2568,platform+docker+nodejs+typescript+media+article+mongodb+segmentfault+csdn+article-publisher,GitHub
595,FlaxEngine,https://github.com/FlaxEngine/FlaxEngine.git,Flax Engine – multi-platform 3D game engine,2566,237,2566,platform+flax+flaxengine+engine+game-engine+gamedev+multi-platform+game-development+c-sharp+cpp+flax-engine,GitHub
596,colorama,https://github.com/tartley/colorama.git,Simple cross-platform colored terminal text in Python,2542,194,2542,platform,GitHub
597,twitter-text,https://github.com/twitter/twitter-text.git,Twitter Text Libraries. This code is used at Twitter to tokenize and parse text to meet the expectations for what can be used on the platform.,2542,416,2542,platform+twitter-text+tweet+twitter+unicode+emoji,GitHub
598,ethereum-developer-tools-list,https://github.com/ConsenSys/ethereum-developer-tools-list.git,A guide to available tools and platforms for developing on Ethereum.,2537,666,2537,platform,GitHub
599,gauge,https://github.com/getgauge/gauge.git,Light weight cross-platform test automation,2536,301,2536,platform+test-automation+agile+testing-tools+behavior-driven-development+golang+bdd+markdown+acceptance-testing,GitHub
600,wink,https://github.com/themsaid/wink.git,A Laravel-based publishing platform,2513,321,2513,platform+laravel+blogging+publishing,GitHub
601,flutter-folio,https://github.com/gskinnerTeam/flutter-folio.git,"A platform adaptive Flutter app for desktop, mobile and web.",2497,456,2497,platform,GitHub
602,The-Forge,https://github.com/ConfettiFX/The-Forge.git,"The Forge Cross-Platform Rendering Framework PC Windows, Linux, Ray Tracing, macOS / iOS, Android, XBOX, PS4, PS5, Switch",2493,260,2493,platform+directx12+vulkan+vulkan-api+macos+ios+xbox+ps4+android+metal+linux-ubuntu+linux+ray-tracing+shaders+visibility-buffer+vulkan-sdk+directx+shader-translator+multi-gpu+multi-threading+ps5,GitHub
603,musikcube,https://github.com/clangen/musikcube.git,"a cross-platform, terminal-based music player, audio engine, metadata indexer, and server in c++",2485,206,2485,platform+audio-player+audio-engine+music-player+terminal+curses+coreaudio+cross-platform+wasapi+pulseaudio+directsound+alsa+music-library+music-player-client,GitHub
604,svelte-nodegui,https://github.com/nodegui/svelte-nodegui.git,"Build performant, native and cross-platform desktop applications with native Svelte + powerful CSS-like styling.🚀",2482,29,2482,platform+nodegui+cross-platform+svelte+desktop-applications+qt,GitHub
605,AtomicGameEngine,https://github.com/AtomicGameEngine/AtomicGameEngine.git,"The Atomic Game Engine is a multi-platform 2D and 3D engine with a consistent API in C++, C#, JavaScript, and TypeScript",2459,476,2459,platform+game-engine+game-development+javascript+csharp+typescript+cplusplus+android+ios+windows+macos+linux+webgl,GitHub
606,wazuh,https://github.com/wazuh/wazuh.git,Wazuh - The Open Source Security Platform,2454,560,2454,platform+wazuh+ossec+security+loganalyzer+compliance+monitoring+intrusion-detection+policy-monitoring+elasticsearch+openscap+security-hardening+ids+pci-dss+file-integrity-management+security-awareness+log-analysis+vulnerability-detection+incident-response,GitHub
607,iotjs,https://github.com/jerryscript-project/iotjs.git,Platform for Internet of Things with JavaScript http://www.iotjs.net ,2426,430,2426,platform,GitHub
608,gts,https://github.com/AppScale/gts.git,AppScale is an easy-to-manage serverless platform for building and running scalable web and mobile applications on any infrastructure.,2418,289,2418,platform,GitHub
609,LibreCAD,https://github.com/LibreCAD/LibreCAD.git,"LibreCAD is a cross-platform 2D CAD program written in C++11 using the Qt framework. It can read DXF and DWG files and can write DXF, PDF and SVG files. The user interface is highly customizable, and has dozens of translations.",2416,717,2416,platform+cad+qt+dxf+drawing,GitHub
610,ArgusAPM,https://github.com/Qihoo360/ArgusAPM.git,"Powerful, comprehensive (Android) application performance management platform. 360线上移动性能检测平台",2413,371,2413,platform+android+apm+gradle+plugin+argusapm+kotlin-android+performance-management+performance+aspectj+kotlin+java,GitHub
611,Album,https://github.com/yanzhenjie/Album.git,:watermelon: Album and Gallery for Android platform.,2410,482,2410,platform+album+gallery+camera+video+image,GitHub
612,react-native-tab-navigator,https://github.com/ptomasroos/react-native-tab-navigator.git,"A tab bar that switches between scenes, written in JS for cross-platform support",2400,426,2400,platform,GitHub
613,engine,https://github.com/cocos-creator/engine.git,"Cocos Creator is a complete package of game development tools and workflow, including a game engine, resource management, scene editing, game preview, debug and publish one project to multiple platforms.",2376,1055,2376,platform+cocos+cocos2d+cocoscreator+game-engine+game-development+multi-platform+open-source+gamedev,GitHub
614,goboy,https://github.com/Humpheh/goboy.git,Multi-platform Nintendo Game Boy Color emulator written in Go,2372,104,2372,platform+emulator+go+golang+gameboy+gameboy-emulator+windows+macos,GitHub
615,unik,https://github.com/solo-io/unik.git,The Unikernel & MicroVM Compilation and Deployment Platform,2370,184,2370,platform,GitHub
616,onefuzz,https://github.com/microsoft/onefuzz.git,A self-hosted Fuzzing-As-A-Service platform,2367,135,2367,platform,GitHub
617,open,https://github.com/sindresorhus/open.git,"Open stuff like URLs, files, executables. Cross-platform.",2363,145,2363,platform,GitHub
618,Dobby,https://github.com/jmpews/Dobby.git,"a lightweight, multi-platform, multi-architecture hook framework.",2362,461,2362,platform+hook+hook-framework,GitHub
619,transgui,https://github.com/transmission-remote-gui/transgui.git,🧲 A feature rich cross platform Transmission BitTorrent client. Faster and has more functionality than the built-in web GUI.,2360,225,2360,platform+torrent+transmission+transmission-daemon+bittorrent+p2p+gui+remote-control+hacktoberfest,GitHub
620,Polycode,https://github.com/ivansafrin/Polycode.git,Polycode is a cross-platform framework for creative code.,2357,340,2357,platform,GitHub
621,oxyplot,https://github.com/oxyplot/oxyplot.git,A cross-platform plotting library for .NET,2355,826,2355,platform+plotting+charts+wpf+dotnet+c-sharp+plotting-library+plot-library+netstandard+netcore,GitHub
622,MagicOnion,https://github.com/Cysharp/MagicOnion.git,Unified Realtime/API framework for .NET platform and Unity.,2350,295,2350,platform+unity+swagger+grpc+streaming+rpc+c-sharp,GitHub
623,writefreely,https://github.com/writefreely/writefreely.git,"A clean, Markdown-based publishing platform made for writers. Write together, and build a community.",2347,138,2347,platform+writing+publishing+blogging+web-application+go+activitypub+federation+beta+writefreely+markdown+writers,GitHub
624,Caliburn.Micro,https://github.com/Caliburn-Micro/Caliburn.Micro.git,"A small, yet powerful framework, designed for building applications across all XAML platforms. Its strong support for MV* patterns will enable you to build your solution quickly, without the need to sacrifice code quality or testability.",2343,729,2343,platform+c-sharp+mvvm+xamarin+xamarin-forms+wpf+windows-phone+windows-8+windows-10+uwp,GitHub
625,killbill,https://github.com/killbill/killbill.git,Open-Source Subscription Billing & Payments Platform,2337,573,2337,platform+killbill+billing+payments+subscriptions,GitHub
626,bond,https://github.com/microsoft/bond.git,Bond is a cross-platform framework for working with schematized data. It supports cross-language de/serialization and powerful generic mechanisms for efficiently manipulating data. Bond is broadly used at Microsoft in high scale services. ,2326,312,2326,platform,GitHub
627,singa,https://github.com/apache/singa.git,a distributed deep learning platform,2317,684,2317,platform+deep-learning,GitHub
628,WebFrontEndStack,https://github.com/unruledboy/WebFrontEndStack.git,"web front end stack: browsers, platforms, libraries, frameworks, tools etc.",2316,497,2316,platform,GitHub
629,Starling-Framework,https://github.com/Gamua/Starling-Framework.git,The Cross Platform Game Engine,2314,847,2314,platform+starling-framework+actionscript+as3+adobe-air+flash+starling+gpu,GitHub
630,samurai-native,https://github.com/hackers-painters/samurai-native.git,Bring web standards to native platform,2312,397,2312,platform,GitHub
631,nodejs-guidelines,https://github.com/microsoft/nodejs-guidelines.git,"Tips, tricks, and resources for working with Node.js, and the start of an ongoing conversation on how we can improve the Node.js experience on Microsoft platforms.",2310,247,2310,platform,GitHub
632,Glimpse,https://github.com/Glimpse/Glimpse.git,The open source diagnostics platform for the web,2309,441,2309,platform,GitHub
633,engine,https://github.com/locomotivecms/engine.git,"A platform to create, publish and edit sites",2308,645,2308,platform,GitHub
634,platform,https://github.com/orchidsoftware/platform.git,"A @laravel based RAD platform for back-office applications, admin/user panels, and dashboards.",2286,394,2286,platform+laravel+cms+platform+cmf+admin+dashboard+laravel-admin+laravel-cms+crud+extranet+laravel-admin-panel+hacktoberfest,GitHub
635,chipsec,https://github.com/chipsec/chipsec.git,Platform Security Assessment Framework,2278,485,2278,platform,GitHub
636,SkiaSharp,https://github.com/mono/SkiaSharp.git,"SkiaSharp is a cross-platform 2D graphics API for .NET platforms based on Google's Skia Graphics Library. It provides a comprehensive 2D API that can be used across mobile, server and desktop models to render images.",2267,352,2267,platform+xamarin+graphics+dot-net+ios+android+windows+macos+cross-platform+skia+dotnet+skiasharp+hacktoberfest,GitHub
637,ballista,https://github.com/ballista-compute/ballista.git,"Distributed compute platform implemented in Rust, and powered by Apache Arrow.",2252,141,2252,platform+rust+arrow+datafusion+kubernetes+distributed+spark+kotlin+java+scala+dataframe+jvm,GitHub
638,Orchard,https://github.com/OrchardCMS/Orchard.git,"Orchard is a free, open source, community-focused Content Management System built on the ASP.NET MVC platform.",2248,1111,2248,platform,GitHub
639,FluentScheduler,https://github.com/fluentscheduler/FluentScheduler.git,Automated job scheduler with fluent interface for the .NET platform.,2233,362,2233,platform+fluent+scheduler,GitHub
640,Simple-Web-Server,https://github.com/eidheim/Simple-Web-Server.git,"A very simple, fast, multithreaded, platform independent HTTP and HTTPS server and client library implemented using C++11 and Boost.Asio. Created to be an easy way to make REST resources available from C++ applications.",2224,692,2224,platform+cpp+web+rest+http+https+server+client+asio+library,GitHub
641,nodejs-docs-samples,https://github.com/GoogleCloudPlatform/nodejs-docs-samples.git,Node.js samples for Google Cloud Platform products.,2223,1642,2223,platform+nodejs+google-cloud+sample+samples,GitHub
642,msquic,https://github.com/microsoft/msquic.git,"Cross-platform, C implementation of the IETF QUIC protocol.",2221,254,2221,platform+quic+network-programming+protocol+c+secure+cross-platform,GitHub
643,covalent,https://github.com/Teradata/covalent.git,Teradata UI Platform built on Angular Material,2218,345,2218,platform+angular+material-design+angular-material+material+teradata+angular7,GitHub
644,vuedo,https://github.com/Vuedo/vuedo.git,"Vuedo is a blog platform, built with Laravel and Vue.js.",2210,545,2210,platform+laravel+vuejs+blog+vue,GitHub
645,lightproxy,https://github.com/alibaba/lightproxy.git,💎 Cross platform Web debugging proxy,2208,143,2208,platform+whistle+proxy+electron+debug+lightproxy+light+typescript+devtools+chrome,GitHub
646,ROCm,https://github.com/RadeonOpenCompute/ROCm.git,ROCm -  Open Source Platform for HPC and Ultrascale GPU Computing ,2202,180,2202,platform,GitHub
647,pimcore,https://github.com/pimcore/pimcore.git,"Open Source Data & Experience Management Platform (PIM, MDM, CDP, DAM, DXP/CMS & Digital Commerce)",2200,1021,2200,platform+pimcore+cms+pim+shop+ecommerce+ecommerce-platform+master-data-management+dam+wcms+digital-platform+experience-manager+data-management+product-management+product-information-management+cms-framework+mdm+online-shop+online-store+cdp+customer-data-platform,GitHub
648,spring,https://github.com/spring/spring.git,A powerful free cross-platform RTS game engine,2191,714,2191,platform+springrts+c-plus-plus+lua+strategy-game-engine+opengl,GitHub
649,Google-Assistant-Unofficial-Desktop-Client,https://github.com/Melvin-Abraham/Google-Assistant-Unofficial-Desktop-Client.git,A cross-platform unofficial Google Assistant Client for Desktop (powered by Google Assistant SDK),2188,204,2188,platform+google-assistant+google-assistant-sdk+electron-app+virtual-assistant+desktop-app+electron+desktop-assistant+cross-platform+g-assist,GitHub
650,shadowsocksr-native,https://github.com/ShadowsocksR-Live/shadowsocksr-native.git,"翻墙 从容穿越党国敏感日 ShadowsocksR (SSR) native implementation for all platforms, GFW terminator",2185,710,2185,platform+shadowsocks+shadowsocksr+ssr+libuv+linux+windows+macos+ss+gfw+proxy+unix,GitHub
651,spack,https://github.com/spack/spack.git,"A flexible package manager that supports multiple versions, configurations, platforms, and compilers.",2181,1383,2181,platform+python+spack+package-manager+hpc+build-tools+radiuss+macos+scientific-computing+linux,GitHub
652,tmt-workflow,https://github.com/Tencent/tmt-workflow.git,"A web developer workflow used by WeChat team based on Gulp, with cross-platform supported and solutions prepared.",2169,288,2169,platform+workflow+gulp+javascript,GitHub
653,WindowsAppSDK,https://github.com/microsoft/WindowsAppSDK.git,"The Windows App SDK empowers all Windows Desktop apps with modern Windows UI, APIs, and platform features, including back-compat support, shipped via NuGet.",2166,126,2166,platform+desktop+windows+project-reunion+win32+winui+cpp+csharp+windows-app-sdk,GitHub
654,dust3d,https://github.com/huxingyi/dust3d.git,":dromedary_camel: Dust3D is a cross-platform open-source 3D modeling software. Auto UV unwrapping, auto rigging with PBR Material support, pose and motion authoring all in one.",2160,155,2160,platform+dust3d+3d-modelling+3d+game-development+3d-printing+low-poly,GitHub
655,MozDef,https://github.com/mozilla/MozDef.git,MozDef: Mozilla Enterprise Defense Platform,2150,345,2150,platform+siem+python+elk+elk-stack+elasticsearch+security,GitHub
656,coverlet,https://github.com/coverlet-coverage/coverlet.git,Cross platform code coverage for .NET,2145,292,2145,platform+code-coverage+dotnet-core+unittest+coverage+cross-platform+coverage-library+dotnet+coverlet+instrumentation+bytecode,GitHub
657,simplewall,https://github.com/henrypp/simplewall.git,Simple tool to configure Windows Filtering Platform (WFP) which can configure network activity on your computer.,2144,242,2144,platform+wfp+network+firewall+windows+windows-firewall+foss+simplewall,GitHub
658,P4wnP1_aloa,https://github.com/RoganDawes/P4wnP1_aloa.git,"P4wnP1 A.L.O.A. by MaMe82 is a framework which turns a Rapsberry Pi Zero W into a flexible, low-cost platform for pentesting, red teaming and physical engagements ... or into ""A Little Offensive Appliance"".",2139,331,2139,platform,GitHub
659,hedgedoc,https://github.com/hedgedoc/hedgedoc.git,HedgeDoc - The best platform to write and share markdown.,2131,209,2131,platform+codimd+collaboration+markdown+notes+real-time+hacktoberfest+hedgedoc,GitHub
660,ncspot,https://github.com/hrkfdn/ncspot.git,"Cross-platform ncurses Spotify client written in Rust, inspired by ncmpc and the likes.",2128,103,2128,platform,GitHub
661,donkeycar,https://github.com/autorope/donkeycar.git,Open source hardware and software platform to build a small scale self driving car.,2122,1104,2122,platform+self-driving-car+raspberry-pi+tensorflow+keras+python+cv2+vision+donkeycar+jetson-nano,GitHub
662,apkstudio,https://github.com/vaibhavpandeyvpz/apkstudio.git,"Open-source, cross platform Qt based IDE for reverse-engineering Android application packages.",2120,420,2120,platform+android+reverse-engineering+smali+apk-studio+apk-decompiler+android-decompiler+java-decompiler+qt+qt5+java+apktool+ide,GitHub
663,TheHive,https://github.com/TheHive-Project/TheHive.git,"TheHive: a Scalable, Open Source and Free Security Incident Response Platform",2113,420,2113,platform+misp+security-incidents+analyzer+iocs+thehive+digital-forensics+incident-response+rest+api+scala+investigations+dfir+free+open-source+platform+cortex+agplv3+orchestration+incident-management+incident-response-tooling,GitHub
664,sqlitestudio,https://github.com/pawelsalawa/sqlitestudio.git,"A free, open source, multi-platform SQLite database manager.",2111,337,2111,platform+sqlite+database+database-management+cpp+qt+qt5+sqlite3-database+sqlcipher+wxsqlite3,GitHub
665,choerodon,https://github.com/open-hand/choerodon.git,Open Source Multi-Cloud Integrated Platform,2106,324,2106,platform+kubernetes+paas+k8s+containers+microservices-application+enterprise+choerodon+devops+agile+multicloud,GitHub
666,Saturn,https://github.com/vipshop/Saturn.git,The vip.com's distributed job scheduling platform.,2097,665,2097,platform+saturn+java+vipshop+job+scheduling,GitHub
667,helios,https://github.com/spotify/helios.git,Docker container orchestration platform,2085,255,2085,platform+helios+java+docker+container+orchestration,GitHub
668,wezterm,https://github.com/wez/wezterm.git,A GPU-accelerated cross-platform terminal emulator and multiplexer written by @wez and implemented in Rust,2085,106,2085,platform+terminal-emulators+rust+terminal+terminal-emulator+serial-port+serial,GitHub
669,meli,https://github.com/getmeli/meli.git,"Platform for deploying static sites and frontend applications easily. Automatic SSL, deploy previews, reverse proxy, and more.",2074,62,2074,platform+deployment+frontend+meli+getmeli+webdev+jamstack+deployment-automation+react+angular+deploy+gatsby+vue+hosting,GitHub
670,gryffin,https://github.com/yahoo/gryffin.git,Gryffin is a large scale web security scanning platform.,2062,258,2062,platform,GitHub
671,pipcook,https://github.com/alibaba/pipcook.git,Machine learning platform for Web developers,2055,177,2055,platform+js+machine-learning+tensorflow+pipeline,GitHub
672,helio-workstation,https://github.com/helio-fm/helio-workstation.git,"One music sequencer for all major platforms, desktop and mobile",2051,87,2051,platform+audio-applications+music-composition+sequencer+vst+music-sequencer+composition+cross-platform+midi+music-tools+microtonal,GitHub
673,kitsu-tools,https://github.com/hummingbird-me/kitsu-tools.git,":hammer: The tools we use to build Kitsu, the coolest platform for anime and manga",2044,270,2044,platform+anime+manga+docker+hummingbird+kitsu,GitHub
674,ELF,https://github.com/facebookresearch/ELF.git,"An End-To-End, Lightweight and Flexible Platform for Game Research",2043,295,2043,platform+gaming+cpp+python+artificial-intelligence+deep-learning+neural-network+platform+reinforcement-learning,GitHub
675,ruboto,https://github.com/ruboto/ruboto.git,A platform for developing apps using JRuby on Android.,2024,168,2024,platform,GitHub
676,1backend,https://github.com/1backend/1backend.git,Run your web apps easily with a complete platform that you can install on any server. Build composable microservices and lambdas.,2016,74,2016,platform+go+golang+paas+typescript+angular2+microservices+redis+mysql,GitHub
677,vue-objccn,https://github.com/halfrost/vue-objccn.git,🔥 Use Vue.js to develop a cross-platform full stack application / 用 Vue.js 开发的跨三端应用,1989,403,1989,platform+vue+vuejs+vuejs2+vue2+vuex+vue-router+vue-cli+vue-components+cordova-ios+electron+objc+javascript+electron-app+electron-application+electron-vue+electron-builder+cordova+cordova-application+android-cordova-app+ecmascript6,GitHub
678,cezerin,https://github.com/cezerin/cezerin.git,Cezerin is React and Node.js based eCommerce platform.,1977,787,1977,platform+nodejs+react+javascript+redux+mongodb+shopping-cart+ecommerce+cms+pwa+spa,GitHub
679,streamlink-twitch-gui,https://github.com/streamlink/streamlink-twitch-gui.git,A multi platform Twitch.tv browser for Streamlink,1969,172,1969,platform+streamlink+twitch+gui+streaming+javascript+nwjs+nodejs+emberjs+app+front-end+livestreamer,GitHub
680,KomodoEdit,https://github.com/Komodo/KomodoEdit.git,"Komodo Edit is a fast and free multi-language code editor. Written in JS, Python, C++ and based on the Mozilla platform.",1967,277,1967,platform+komodo-edit+python+mozilla+editor+ide+cross-platform+komodo-ide+javascript+xul+xulrunner+tcl+ruby+nodejs+php+perl+go+lua+activestate+debugger+debugger-visualizer,GitHub
681,selenoid,https://github.com/aerokube/selenoid.git,"Selenium Hub successor running browsers within containers. Scalable, immutable, self hosted Selenium-Grid on any platform with single binary.",1960,259,1960,platform+selenium+hub+docker+vnc+selenium-server+grid+selenium-grid+selenium-webdriver,GitHub
682,engine,https://github.com/oasis-engine/engine.git,Oasis Engine is a web-first and mobile-first high-performance real-time development platform. ,1954,132,1954,platform+webgl+3d-engine+typescript+webgl2+engine3d+graphics,GitHub
683,pyrobot,https://github.com/facebookresearch/pyrobot.git,PyRobot: An Open Source Robotics Research Platform,1949,296,1949,platform,GitHub
684,mamba,https://github.com/mamba-org/mamba.git,The Fast Cross-Platform Package Manager,1945,110,1945,platform,GitHub
685,opencti,https://github.com/OpenCTI-Platform/opencti.git,Open Cyber Threat Intelligence Platform,1941,359,1941,platform+cyber+cti+threat-intelligence+security+intelligence+osint+cybersecurity,GitHub
686,tinyusb,https://github.com/hathach/tinyusb.git,An open source  cross-platform USB stack for embedded system,1933,312,1933,platform+embedded+usb+usb-host+usb-devices+usb-hid+usb-cdc+usb-drive+midi+webusb+msc+tinyusb,GitHub
687,edb-debugger,https://github.com/eteran/edb-debugger.git,edb is a cross-platform AArch32/x86/x86-64 debugger.,1933,253,1933,platform+qt+c-plus-plus+reverse-engineering+debugger+ollydbg+x86+x86-64+linux+security+edb+capstone,GitHub
688,DiligentEngine,https://github.com/DiligentGraphics/DiligentEngine.git,A modern cross-platform low-level graphics library and rendering framework,1931,198,1931,platform+gamedev+opengl+opengl-es+graphics-engine+vulkan+d3d11+d3d12+vulkan-game-engine+renderer+graphics-programming+graphics-library+rendering+3d-engine+directx+directx11+directx12+pbr+ibl+raytracing+ray-tracing,GitHub
689,jabba,https://github.com/shyiko/jabba.git,(cross-platform) Java Version Manager,1928,129,1928,platform,GitHub
690,AppMetrics,https://github.com/AppMetrics/AppMetrics.git,App Metrics is an open-source and cross-platform .NET library used to record and report metrics within an application.,1921,252,1921,platform+metrics+dotnetcore+health-check+monitoring+performance+dotnet+instrumentation+application-insights+dotnet-core+dotnet-standard+dotnet-framework+grafana+grafana-dashboard+influxdb+graphite+prometheus,GitHub
